,Song_Name,Artist,Genre,Lyrics
63,Let You Down,NF,Pop,"[Chorus]
Feels like we're on the edge right now
I wish that I could say I'm proud
I'm sorry that I let you down
Let you down
All these voices in my head get loud
I wish that I could shut them out
I'm sorry that I let you down
Le-le-let you down

[Verse 1]
Yeah, I guess I'm a disappointment, doin' everything I can
I don't wanna make you disappointed, it's annoying
I just wanna make you feel like everything I ever do
Was never tryna make an issue for you, but I guess the more you
Thought about everything you were never even wrong
In the first place, right? Yeah, I'ma just ignore you
Walking towards you with my head down
Lookin' at the ground, I'm embarrassed for you
Paranoia, what did I do wrong this time?
That's parents for you
Very loyal? Shoulda had my back
But you put a knife in it—my hands are full
What else should I carry for you?
I cared for you, but…

[Chorus]
Feels like we're on the edge right now
I wish that I could say I'm proud
I'm sorry that I let you down
Le-le-let you down
All these voices in my head get loud
I wish that I could shut them out
I'm sorry that I let you down
Le-le-let you down

[Verse 2]
Yeah, you don't wanna make this work
You just wanna make this worse
Want me to listen to you, but you don't ever hear my words
You don't wanna know my hurt yet
Let me guess, you want an apology, probably
How can we keep going at a rate like this?
We can't, so I guess I'ma have to leave
Please, don't come after me
I just wanna be alone right now, I don't really wanna think at all
Go ahead, just drink it off
Both know you're gonna call tomorrow like nothing's wrong
Ain't that what you always do?
I feel like every time I talk to you, you're in an awful mood
What else can I offer you?
There's nothing left right now, I gave it all to you

[Chorus]
Feels like we're on the edge right now
I wish that I could say I'm proud
I'm sorry that I let you down
Le-le-let you down
All these voices in my head get loud
I wish that I could shut them out
I'm sorry that I let you down
Le-le-let you down

[Verse 3]
Yeah, don't talk down to me
That's not gonna work now
Packed all my clothes and I moved out
I don't even wanna go to your house
Every time I sit on that couch
I feel like you lecture me, eventually, I bet that we
Could have made this work
And prolly woulda figured things out
But I guess I'm a letdown
But it's cool, I checked out
Oh, you wanna be friends now?
Okay, let's put my fake face on and pretend now
Sit around and talk about the good times that didn't even happen
I mean, why are you laughing?
Must have missed that joke, let me see if I can find a reaction
No, but at least you're happy

[Chorus]
Feels like we're on the edge right now
I wish that I could say I'm proud
I'm sorry that I let you down
Oh, I let you down
All these voices in my head get loud
And I wish that I could shut them out
I'm sorry that I let you down
Oh, let you down

[Outro]
I'm sorry
I'm so sorry now
I'm sorry that I let you down"
64,Pray (Remix),Sam Smith,Pop,"[Verse 1: Logic]
They never knew my struggle
Rose above the rubble
Rather live inside they bubble
Than go through the trouble
Of having they double-double vision corrected
They just neglect it and—
I've been thinkin' lately
Will the Devil take me?
Or will God protect me?
I know I ain't perfect, but you should respect me
They don't want me happy
They don't want to let me live

[Verse 2: Sam Smith]
I'm young and I'm foolish, I made bad decisions
I block out the news, turn my back on religion
Don't have no degree, I'm somewhat naïve
I've made it this far on my own
But lately, that shit ain't been gettin' me higher
I lift up my head and the world is on fire
There's dread in my heart and fear in my bones
And I just don't know what to say

[Chorus: Sam Smith]
Maybe I'll pray, pray
Maybe I'll pray
I have never believed in you, no
But I'm gonna pray

[Verse 3: Logic]
I am me
I'm a man, I'm a sinner
But understand, aren't we all?
So when it comes to passin' judgements
I don't think that you're the one to make the call
Heaven want to cast me out for being me
I know there's others like me that'll break the fall
I know you hater motherfuckers just can't relate at all
If I'm the first one to the line, that's fine, I'll take it all
Well Logic, He gon' let 'em know
I ain't perfect, but I'm worth it
I'm alive, I deserve it
I been praying, I ain't playin'
I don't think you hear the words that I'm sayin'
I don't think you know the weight on my shoulders
That gets heavier as I get older
Callin' anybody, callin' anybody
""Can you hear me?""
I pray that you hear me
I pray that you hear me

[Chorus: Sam Smith]
Maybe I'll pray (Lord), pray (Lord), maybe I'll pray
I've never believed in you, no, but I'm gonna...

[Bridge: Sam Smith]
Won't you call me?
Can we have a one-on-one, please?
Let's talk about freedom
Everyone prays in the end
Everyone prays in the end
Oh, won't you call me?
Can we have a one-on-one, please?
Let's talk about freedom
Everyone prays in the end
Everyone prays in the end

[Outro: Sam Smith]
Oh, I'm gonna pray
I'm gonna pray
I'm gonna pray
Pray for a glimmer of hope
Maybe I'll pray, pray
Maybe I'll pray
I've never believed in you
No, but I'm gonna pray"
65,Color Blind,Diplo,Pop,"[Chorus]
I've been so color blind
And I've been so color blind (haha, yeah)

[Verse 1]
Ayy, trips to the mall, I just stripped in the fall
I think I might really be the one after all, yeah
The one to rule them all, I'm the chosen one, the savior
But all these triple six, yeah
Make it look like I was up to no good
At least that's what my momma said, yeah
Now I'm the one givin' momma bread
Done with the pain, I'm just so heartless

[Chorus]
I've been so color blind
And I've been so color blind

[Break]
(I said)
(I said)

[Verse 2]
Love don't cost a thing, yeah
So all my girls need diamond ring, yeah, yo, yo
Text that I sent that you never ever read
Got me feelin' like you never ever ever really cared, yeah
But that's okay though
I hope you feel okay though
They used to call me Diego
My favorite drink is Faygo
I've been so so so-

[Break]
(I said)
(I said)
I've been so color blind
I've been so color blind

[Chorus]
I've been so color blind
And I've been so color blind"
66,Guatemala,"Swae Lee, Slim Jxmmi & Rae Sremmurd",Pop,"[Intro: Swae Lee]
Oh, oh, oh-oh
Seen the way you talkin' up my phone last night, on God
Mally Mall

[Pre-Chorus: Swae Lee]
It was way more than a two dollar holla
Stole your heart like Ali Baba (oh, your heart)

[Chorus: Swae Lee]
Seen the way you talkin' up my phone last night, on God (on my phone last night)
Do it on my jet, let's keep this private
She wants me too, she ain't even in denial (denial)
Wanna make love, she ain't even in denial (in denial)
We can get away-ay, maybe to Guatemala ('temala)
Got me goin' deep, got me all in freshwater (goin' under)

[Verse 1: Swae Lee]
Baby, when you laughin', is it 'cause you feel an excellent vibe? (Ooh, ooh)
That was just a fraction of the good, love I provide (ooh, ooh)
See some niggas talkin' on the side, can you keep that silent? (Keep that quiet)
Maybe sayin' somethin' but you didn't mean nothin' by it
Took her to the room, in other words, kept that private (kept that private)
She was my heartbreak, I told her keep those violets (ooh, ooh)

[Chorus: Swae Lee]
Seen the way you talkin' up my phone last night, on God (talkin' on the phone)
Do it on my jet, let's keep this private
She wants me too, she ain't even in denial (denial)
Wanna make love, she ain't even in denial (in denial)
We can get away-ay, maybe to Guatemala (Guatemala)
Got me goin' deep, got me all in freshwater (freshwater)

[Verse 2: Swae Lee]
Flew in on a jet, what's that? Stylish
Take another sip, then get superpowers (woah, oh, oh)
If she got the hots for me, then dammit, I'm buyin' (I'm, I'm buyin')
I've got more pull than him and him combined (him combined)
Pourin' out dreams, 'cause we're really this high (really that high)
I just had my hand on her hip, she had her eyes on the prize (eyes on the prize)

[Chorus: Swae Lee]
Seen the way you talkin' up my phone last night, on God (talkin' on the phone)
Do it on my jet, let's keep this private
She wants me too, she ain't even in denial (denial)
Wanna make love, she ain't even in denial (in denial)
We can get away-ay, maybe to Guatemala (Guatemala)
Got me goin' deep, got me all in freshwater (freshwater)

[Verse 3: Slim Jxmmi]
Seatbelt, she roller coaster ridin'
Put you on a plane, been thinkin' 'bout it
Sippin' on Fiji, yeah, you taste like water (hey, hey)
Chasin' me, tryna make me your partner (tryna make me your partner)
Maybe we can lock in later on (yeah)
I can't guarantee I'll fall (fall)
Baby, we should lock in later on (hey)
I can't guarantee my heart (hey)
Baby, don't take too, too long (too long)
I ain't ever miss my mark (my mark)
Yeah, my ex-girl had to move on (on)
There's no pictures on the wall (ayy, ayy)

[Chorus: Swae Lee]
Seen the way you talkin' up my phone last night, on God (talkin' on the phone)
Do it at my house, let's keep this private (keep this private)
She wants me too, she ain't even in denial (in denial)
Wanna make love, she ain't even in denial (in denial)
We can get away-ay, maybe to Guatemala ('temala)
Got me goin' deep, got me all in freshwater (goin' under)"
67,Flames,David Guetta & Sia,Pop,"[Intro: Sia]
Oh, oh

[Verse 1: Sia]
One foot in front of the other babe
One breath leads to another, yeah
Just keep moving, oh
Look within for the strength today
Listen out for the voice to say
Just keep moving, oh

[Pre-Chorus: Sia]
Go, go, go
Figure it out, figure it out, but don't stop moving
Go, go, go
Figure it out, figure it out, you can do this

[Chorus: Sia]
So my love, keep on running
You gotta get through today
There my love, keep on running
Gotta keep those tears at bay
Oh, my love, don't stop burning
Gonna send them up in flames
In flames

[Verse 2: Sia]
Don't stop, tomorrow's another day
Don't stop, tomorrow you'll feel no pain
Just keep moving
Don't stop the past'll trip you up
You know, right now's gotta be enough
Just keep moving

[Pre-Chorus: Sia]
Go, go, go
Figure it out, figure it out, but don't stop moving
Go, go, go
Figure it out, figure it out, you can do this

[Chorus: Sia]
So my love, keep on running
You gotta get through today
There my love, keep on running
Gotta keep those tears at bay
Oh, my love, don't stop burning
Gonna send them up in flames
In flames

[Bridge: Sia]
In flames
In flames
Go, go, go
Figure it out, figure it out, but don't stop moving
Go, go, go
Figure it out, figure it out, you can do this

[Chorus: Sia]
So my love, keep on running
You gotta get through today
Then my love, keep on running
Gotta keep those tears at bay
Oh, my love, don't stop burning
Gonna send them up in flames
In flames"
68,Remind Me to Forget,Kygo,Pop,"[Verse 1]
It never fades away, it's staying
Your kiss like broken glass on my skin
And all the greatest loves end in violence
It's tearing up my voice, left in silence

[Pre-Chorus 1]
Baby, it hit so hard, holding on to my chest
Maybe you left your mark, reminding me to forget
It doesn't matter where you are, you can keep my regret
'Cause baby, I got these scars, reminding me to forget
Reminding me, I got these scars, get your love
Keep reminding me, ooh, to forget your love

[Chorus]
You left your mark (my heart)
You left your mark, reminding me to forget
You left your mark (my heart)
You left your mark (understand)
You left your mark (my heart)
You left your mark, reminding me to forget
You left your mark (my heart)
You left your mark (understand)

[Verse 2]
There's no room in war for feelings
Hurt me to the core, still healing
And I know you're no good for me
So I try to forget the memories

[Pre-Chorus 2]
Baby, it hit so hard, holding on to my chest
Maybe you left your mark, reminding me to forget
It doesn't matter where you are, you can keep my regret
Baby, I got these scars, reminding me to forget

[Chorus]
You left your mark (my heart)
You left your mark, reminding me to forget
You left your mark (my heart)
You left your mark (understand)

[Bridge]
Remember I told you
To save it, it's over
And I'll be alright
So hurt me as much as you like
I need you to let go
I got these mementos
And I'll be alright

[Pre-Chorus 2]
Baby, it hit so hard, holding on to my chest
Maybe you left your mark, reminding me to forget
It doesn't matter where you are, you can keep my regret
Baby, I got these scars, reminding me to forget

[Chorus 2]
You left your mark (my heart)
You left your mark, reminding me to forget
You left your mark (my heart)
You left your mark, reminding me to forget"
69,Sky Full of Song,Florence + The Machine,Pop,"[Verse 1]
How deeply are you sleeping or are you still awake?
A good friend told me you've been staying out so late
Be careful, oh, my darling, oh, be careful what it takes
From what I've seen so far, the good ones always seem to break
And I was screaming at my father and you were screaming at me
And I can feel your anger from way across the sea
And I was kissing strangers, I was causing such a scene
Oh, the heart it hides such unimaginable things

[Pre-Chorus]
Grab me by my ankles, I've been flying for too long
I couldn't hide from the thunder in a sky full of song
And I want you so badly, but you could be anyone
I couldn't hide from the thunder in a sky full of song

[Chorus]
Hold me down, I'm so tired now
Aim your arrow at the sky
Take me down, I'm too tired now
Leave me where I lie

[Verse 2]
And I can tell that I'm in trouble when that music starts to play
In a city without seasons, it keeps raining in LA
I feel like I'm about to fall, the room begins to sway
And I can hear the sirens but I cannot walk away

[Pre-Chorus]
Grab me by my ankles, I've been flying for too long
I couldn't hide from the thunder in a sky full of song
And I want you so badly, but you could be anyone
I couldn't hide from the thunder in a sky full of song

[Chorus]
Hold me down, I'm so tired now
Aim your arrow at the sky
Take me down, I'm too tired now
Leave me where I lie

[Bridge]
I thought I was flying but maybe I'm dying tonight
I thought I was flying but maybe I'm dying tonight
And I thought I was flying but maybe I'm dying tonight
And I thought I was flying but maybe I'm dying tonight

[Chorus]
Hold me down, I'm so tired now
Aim your arrow at the sky (shoot, shoot, shoot)
Take me down, I'm too tired now
Leave me where I lie  (Fire)

Hold me down, I'm too tired now
Aim your arrow at the sky (shoot, shoot, shoot)
And take me down, I'm too tired now
Leave me where I lie  (Fire)"
70,Somebody,The Chainsmokers,Pop,"[Chorus: Drew Love]
In the town full of fancy cars and
Crowded bars and supermodels
Looks exactly the way it did inside my head
When I dreamed about it
All the things I could live without
I need 'em now 'cause they're all around me
Only thing that I can't afford is to lose myself
Tryna be somebody, somebody

[Verse 1: Andrew Taggart]
You should've known better
Than to listen to your heart again
People change with the weather
(You know, just know what I like)
I don't really like anybody
So don't tell me I'm like anybody else
You put it back together
Don't let it fall apart again
People change with the weather

[Chorus: Drew Love]
In the town full of fancy cars and
Crowded bars and supermodels
Looks exactly the way it did inside my head
When I dreamed about it
All the things I could live without
I need 'em now 'cause they're all around me
Only thing that I can't afford is to lose myself
Tryna be somebody, somebody

[Post-Chorus: Drew Love & Andrew Taggart]
Somebody
Somebody
(You know, just know what I like)
Somebody

[Verse 2: Andrew Taggart]
In my head I knew better (in my head I knew better)
I won't blame it on my faults again
I know I should forget her
(You know, just know what I like)
I don't really like anybody
So don't tell me I'm like anybody else

[Chorus: Drew Love, Both]
In the town full of fancy cars and
Crowded bars and supermodels
Looks exactly the way it did inside my head
When I dreamed about it
All the things I could live without
I need 'em now 'cause they're all around me
Only thing that I can't afford is to lose myself
Tryna be somebody, somebody

[Post-Chorus: Drew Love & Andrew Taggart]
Somebody, somebody, somebody
Somebody, somebody
(You know, just know what I like)
Somebody, somebody
Somebody, somebody
(You know, just know what I like)

[Bridge: Andrew Taggart]
'Cause I don't really like anybody
So don't tell me I'm like anybody
'Cause I don't really like anybody
So don't tell me I'm like anybody

[Chorus: Drew Love, Both]
In the town full of fancy cars and
Crowded bars and supermodels
Looks exactly the way it did inside my head
When I dreamed about it
All the things I could live without
I need 'em now 'cause they're all around me
Only thing that I can't afford is to lose myself
Tryna be somebody, somebody

[Outro: Drew Love & Andrew Taggart]
Somebody, somebody
Somebody, somebody
(You know, just know what I like)
Somebody, somebody
Somebody, somebody
(You know, just know what I like)
You can stop tryna be somebody
You can stop tryna be somebody"
71,Medicine,Harry Styles,Pop,"[Verse 1]
Here to take my medicine, take my medicine
Treat you like a gentleman
Give me that adrenaline, that adrenaline
Think I’m gonna stick with you
Here to take my medicine, take my medicine
Rest it on your fingertips
Up to your mouth, feeling it out
Feeling it out

[Pre-Chorus]
I had a few, got drunk on you and now I’m wasted
And when I sleep I’m gonna dream of how you

[Chorus]
If you go out tonight, I’m going out ‘cause I know you’re persuasive
You got that something, I got me an appetite; now I can taste it
We're getting dizzy, oh, we're getting dizzy, oh
La la la la la
You get me dizzy, oh, you get me dizzy, oh

[Verse 2]
Tingle running through my bones, fingers to my toes
Tingle running through my bones
The boys and the girls are in
I mess around with him
And I'm okay with it

[Pre-Chorus]
I’m coming down, I figured out I kinda like it
And when I sleep I’m gonna dream of how you

[Chorus]
If you go out tonight, I’m going out ‘cause I know you’re persuasive
You got that something, I got me an appetite; now I can taste it
We're getting dizzy, oh, we're getting dizzy, oh
La la la la la
You get me dizzy, oh, you get me dizzy, oh

[Pre-Chorus]
I had a few, got drunk on you and now I’m wasted

[Chorus]
If you go out tonight, I’m going out ‘cause I know you’re persuasive
You got that something, I got me an appetite; now I can taste it
We're getting dizzy, oh, we're getting dizzy, oh
La la la la la
You get me dizzy, oh, you get me dizzy, oh"
72,These Days,Rudimental,Pop,"[Intro: Macklemore]
I know you moved onto someone new
Hope life is beautiful
You were the light for me to find my truth
I just wanna say, thank you

[Verse 1: Dan Caplen]
Leaving to find my soul
Told her I had to go
And I know it ain't pretty
When our hearts get broke
Too young to feel this old
Watching us both turn cold
Oh, I know it ain't pretty
When two hearts get broke
Yeah, I know it ain't pretty
When two hearts get broke

[Chorus: Jess Glynne]
I hope someday we'll sit down together
And laugh with each other about these days, these days
All our troubles, we'll lay to rest and
We'll wish we could come back to these days, these days

[Post-Chorus: Jess Glynne & Dan Caplen]
Oh I know, I know
Oh I know, I know
Oh I know, I know
These days, these days
Oh I know, I know
Oh I know, I know
Oh I know, I know
These days, these days

[Verse 2: Dan Caplen & Jess Glynne]
Three years of ups and downs
Nothing to show for it now
And I know it ain't pretty when the fire burns out
Calling me when I'm drunk remind me of what I've done
And I know it ain't pretty when you're trying to move on, yeah

[Chorus: Jess Glynne & Dan Caplen]
I hope someday we'll sit down together
And laugh with each other about these days, these days
All our troubles, we'll lay to rest and
We'll wish we could come back to these days, these days

[Post-Chorus: Jess Glynne & Dan Caplen]
Oh I know, I know
Oh I know, I know
Oh I know, I know
These days, these days
Oh I know, I know
Oh I know, I know
Oh I know, I know
To these days, these days

[Verse 3: Macklemore]
Cigarettes in the ashtray
Reminiscing on those past days
I thought you’d end up with my last name
But that changed
And I travelled around the world
Think where you living at now?
I heard you moved to Austin
Got an apartment and settled down
And every once in a while
I start texting
Write a paragraph
But then I delete the message
Think 'bout you like a past time
I could cry you a river
Get you baptised or
I wasn't ready to act right
Used to always think I'd get you back, right
They say that things fall apart
We were gonna move to Brooklyn
You were gonna study Art
Love is just a tool
To remind us who we are
And that we are not alone
And we're walking in the dark

[Chorus: Jess Glynne & Dan Caplen]
I hope someday we'll sit down together
And laugh with each other about these days, these days
All our troubles, we'll lay to rest and
We'll wish we could come back to these days, these days

[Outro : Jess Glynne & Dan Caplen]
We'll wish we could come back to these days, these days"
73,First Place (The Race - Remix),Larray,Pop,"[Intro]
Yo, Larray, ok, skrt, skrt, ooh, bang bang, let's go

[Chorus]
This ain't a race but I still take first place
Take your man just to shove it in your face (mwah)
My name not lightning but I still am a queen (kachow)
I go to Panda just to ask for chow mein

[Verse 1]
Call me gay but your dad texts me 'hey'
You don't like me but you like stalking my page (yikes)
Uno, dos, tres, cuatro, cinco
I don't speak Spanish but I know Despacito (puta)
B-b-b-bitch imma' kick you in the throat (hiya)
My ass so big it be looking like a boat (Titanic)
I got asthma so you know I don't smoke (bang bang)
Why am I ugly? JK bitch that was a joke
I'm cute, I'm hot, I'm everything you're not
I looked you up on Google just to find out you're a flop
I'm sexy take a pic, I'm better than your chick
Your boyfriend messaged me and asked if I was Timmy Thick
I walk around in Guccis
My favorite meal is sushi
If you wanna talk then I'll hit you with that uzi

[Hook: Big Shaq]
Pr-r-r-r-a
Pa pa ka ka ka
Skidiki-papa
And a pu-pu-pu

[Verse 2]
I feel pregnant after dinner
Like my name is Kylie Jenner
I'm a baddie, I'm a sinner
You so ugly, you so bitter
In a foreign, yea we do the most, we skrt skrt
All around the coast
Tell me pick a Dolan Twin, guess what bitch I'm choosing both

[Chorus]
This ain't a race but I still take first place (ya ya)
Take your man just to show it in your face (mwah)
My name not lightning but I still am a queen (kachow)
Go to Panda just to ask for chow mein (yeah yeah)"
74,Bella Ciao,Vasco Scansani di Gualtieri,Pop,"Una mattina mi son svegliato
O bella, ciao! bella, ciao! bella, ciao, ciao, ciao!
Una mattina mi son svegliato
E ho trovato l'invasor

O partigiano, portami via
O bella, ciao! bella, ciao! bella, ciao, ciao, ciao!
O partigiano, portami via
Ché mi sento di morir

E se io muoio da partigiano
(E se io muoio sulla montagna)
O bella, ciao! bella, ciao! bella, ciao, ciao, ciao!
E se io muoio da partigiano
(E se io muoio sulla montagna)
Tu mi devi seppellir

E seppellire lassù in montagna
(E tu mi devi seppellire)
O bella, ciao! bella, ciao! bella, ciao, ciao, ciao!
E seppellire lassù in montagna
(E tu mi devi seppellire)
Sotto l'ombra di un bel fior

Tutte le genti che passeranno
(E tutti quelli che passeranno)
O bella, ciao! bella, ciao! bella, ciao, ciao, ciao!
Tutte le genti che passeranno
(E tutti quelli che passeranno)
Mi diranno «Che bel fior!»
(E poi diranno «Che bel fior!»)

«È questo il fiore del partigiano»

(E questo è il fiore del partigiano)
O bella, ciao! bella, ciao! bella, ciao, ciao, ciao!
«È questo il fiore del partigiano

(E questo è il fiore del partigiano)
Morto per la libertà!»

English translation

One morning I awakened
Oh Goodbye beautiful, Goodbye beautiful, Goodbye beautiful! Bye! Bye!
One morning I awakened
And I found the invader

Oh partisan carry me away
Oh Goodbye beautiful, Goodbye beautiful, Goodbye beautiful! Bye! Bye!
Oh partisan carry me away
Because I feel death approaching

And if I die as a partisan
(And if I die on the mountain)
Oh Goodbye beautiful, Goodbye beautiful, Goodbye beautiful! Bye! Bye!
And if I die as a partisan
(And if I die on the mountain)
Then you must bury me

Bury me up in the mountain
(And you have to bury me)
Oh Goodbye beautiful, Goodbye beautiful, Goodbye beautiful! Bye! Bye!
Bury me up in the mountain
(And you have to bury me)
Under the shade of a beautiful flower

And the people who shall pass
(And all those who shall pass)
Oh Goodbye beautiful, Goodbye beautiful, Goodbye beautiful! Bye! Bye!
And the people who shall pass
(And all those who shall pass)
Will tell me: ""what a beautiful flower""
(And they will say: ""what a beautiful flower"")

This is the flower of the partisan

(And this is the flower of the partisan)
Oh Goodbye beautiful, Goodbye beautiful, Goodbye beautiful! Bye! Bye!
This is the flower of the partisan

(And this is the flower of the partisan)
Who died for freedom"
