,Song_Name,Artist,Genre,Lyrics
0,No Tears Left to Cry,Ariana Grande,Pop,"[Intro]
Right now, I'm in a state of mind
I wanna be in, like, all the time
Ain't got no tears left to cry
So I'm pickin' it up, pickin' it up
I'm lovin', I'm livin', I'm pickin' it up
I'm pickin' it up, pickin' it up
I'm lovin', I'm livin', I'm pickin' it up (oh, yeah)

[Refrain]
I'm pickin' it up (yeah), pickin' it up (yeah)
Lovin', I'm livin', so we turnin' it up
Yeah, we turnin' it up

[Verse 1]
Ain't got no tears in my body
I ran out, but boy, I like it, I like it, I like it
Don't matter how, what, when, who tries it
We're out here vibin', we vibin', we vibin'

[Pre-Chorus]
Comin' out
Even when it's rainin' down (can't stop now)
Can't stop so shut your mouth (shut your mouth)
And if you don't know then now you know it, babe
Know it, babe, yeah

[Chorus]
Right now, I'm in a state of mind
I wanna be in, like, all the time
Ain't got no tears left to cry
So I'm pickin' it up, pickin' it up (oh yeah)
I'm lovin', I'm livin', I'm pickin' it up
Oh, I just want you to come with me
We're on another mentality
Ain't got no tears left to cry (to cry)
So I'm pickin' it up, pickin' it up (oh yeah)
I'm lovin', I'm livin', I'm pickin' it up

[Refrain]
Pickin' it up (yeah), pickin' it up (yeah)
I'm lovin', I'm livin', so we turnin' up (we turnin' it up)
Yeah, we turnin' it up

[Verse 2]
They point out the colors in you, I see 'em too
And, boy, I like 'em, I like 'em, I like 'em
We way too fly to partake in all this hate
We're out here vibin', we vibin', we vibin'

[Pre-Chorus]
Comin' out
Even when it's rainin' down (can't stop now)
Can't stop so shut your mouth (shut your mouth)
And if you don't know then now you know it, babe
Know it, babe, yeah

[Chorus]
Right now, I'm in a state of mind
I wanna be in, like, all the time
Ain't got no tears left to cry
So I'm pickin' it up, pickin' it up (oh yeah)
I'm lovin', I'm livin', I'm pickin' it up
Oh, I just want you to come with me
We're on another mentality
Ain't got no tears left to cry (to cry)
So I'm pickin' it up, pickin' it up (oh yeah)
I'm lovin', I'm livin', I'm pickin' it up

[Pre-Chorus]
Comin' out, even when it's rainin' down
Can't stop now (hmm, oh), shut your mouth
Ain't got no tears left to cry
Oh yeah, oh yeah

[Chorus]
Oh, I just want you to come with me
We're on another mentality
Ain't got no tears left to cry (cry)
So I'm pickin' it up, pickin' it up (oh yeah)
I'm lovin', I'm livin', I'm pickin' it up

[Refrain]
Pickin' it up, pickin' it up
Lovin', I'm livin', so we turnin' up
Yeah, we turnin' it up"
1,FRIENDS,Marshmello & Anne-Marie,Pop,"[Intro: Anne-Marie]
Ooooh-oh, ooooh-woh
Ooooh-oh, ooooh-woh

[Verse 1: Anne-Marie]
You say you love me, I say you crazy
We're nothing more than friends
You're not my lover, more like a brother
I known you since we were like ten, yeah

[Refrain: Anne-Marie]
Don't mess it up, talking that shit
Only gonna push me away, that's it!
When you say you love me, that make me crazy
Here we go again

[Pre-Chorus: Anne-Marie]
Don't go look at me with that look in your eye
You really ain't going away without a fight
You can't be reasoned with, I'm done being polite
I've told you one, two, three, four, five, six thousand times

[Chorus: Anne-Marie]
Haven't I made it obvious?
Haven't I made it clear?
Want me to spell it out for you?
F-R-I-E-N-D-S
Haven't I made it obvious?
Haven't I made it clear?
Want me to spell it out for you?
F-R-I-E-N-D-S
F-R-I-E-N-D-S

[Verse 2: Anne-Marie]
Have you got no shame? You looking insane
Turning up at my door
It's two in the morning, the rain is pouring
Haven't we been here before?

[Refrain: Anne-Marie]
Don't mess it up, talking that shit
Only gonna push me away, that's it!
Have you got no shame? You looking insane
Here we go again

[Pre-Chorus: Anne-Marie]
So don't go look at me with that look in your eye
You really ain't going away without a fight
You can't be reasoned with, I'm done being polite
I've told you one, two, three, four, five, six thousand times

[Chorus: Anne-Marie]
Haven't I made it obvious? (Haven't I made it?)
Haven't I made it clear? (Haven't I made it clear?)
Want me to spell it out for you?
F-R-I-E-N-D-S
Haven't I made it obvious?
Haven't I made it clear? (Haven't I?)
Want me to spell it out for you? (to spell it out for you?)
F-R-I-E-N-D-S
F-R-I-E-N-D-S

[Bridge: Anne-Marie]
F-R-I-E-N-D-S
That's how you f****** spell ""friends""
F-R-I-E-N-D-S
Get that shit inside your head
No, no, yeah, uh, ahh
F-R-I-E-N-D-S
We're just friends

[Pre-Chorus: Anne-Marie]
So don't go look at me with that look in your eye
You really ain't going nowhere without a fight
You can't be reasoned with, I'm done being polite
I've told you one, two, three, four, five, six thousand times

[Chorus: Anne-Marie]
Haven't I made it obvious? (Have I not made it obvious?)
Haven't I made it clear? (Yeah, I made it very clear)
Want me to spell it out for you? (Yo)
F-R-I-E-N-D-S (I said F-R-I-E-N-D-S)
Haven't I made it obvious? (I made it very obvious)
Haven't I made it clear? (I made it very clear)
Want me to spell it out for you?
F-R-I-E-N-D-S
F-R-I-E-N-D-S

[Outro: Anne-Marie]
Mmm, ooh, ooh, ooh
Ah, ah-oh, ah-oh"
2,A Million Dreams,Ziv Zaifman,Pop,"[YOUNG P.T.]
I close my eyes and I can see
The world that's waiting up for me
That I call my own
Through the dark, through the door
Through where no one's been before
But it feels like home

They can say, they can say it all sounds crazy
They can say, they can say I've lost my mind
I don't care, I don't care, so call me crazy
We can live in a world that we design

'Cause every night I lie in bed
The brightest colors fill my head
A million dreams are keeping me awake
I think of what the world could be
A vision of the one I see
A million dreams is all it's gonna take
A million dreams for the world we're gonna make

There's a house we can build
Every room inside is filled
With things from far away
The special things I compile
Each one there to make you smile
On a rainy day

They can say, they can say it all sounds crazy
They can say, they can say we've lost our minds
I don't care, I don't care if they call us crazy
Runaway to a world that we design

[P.T. BARNUM]
Every night I lie  in bed
The brightest colors fill my head
A million dreams are keeping me awake
I think of what the world could be
A vision of the one I see
A million dreams is all it's gonna take
A million dreams for the world we're gonna make

[CHARITY BARNUM, with P.T. BARNUM]
However big, however small
Let me be part of it all
Share your dreams with me
You may be right, you may be wrong
But say that you'll bring me along
To the world you see
To the world I close my eyes to see
I close my eyes to see

Every night I lie in bed
The brightest colors fill my head
A million dreams are keeping me awake
A million dreams, a million dreams
I think of what the world could be
A vision of the one I see
A million dreams is all it's gonna take
A million dreams for the world we're gonna make

For the world we're gonna make"
3,The Middle,Zedd,Pop,"[Verse 1: Maren Morris]
Take a seat
Right over there, sat on the stairs
Stay or leave
The cabinets are bare, and I'm unaware
Of just how we got into this mess, got so aggressive
I know we meant all good intentions

[Pre-Chorus: Maren Morris]
So pull me closer
Why don't you pull me close?
Why don't you come on over?
I can't just let you go

[Chorus: Maren Morris]
Oh baby, why don't you just meet me in the middle?
I'm losing my mind just a little
So why don't you just meet me in the middle?
In the middle
Baby, why don't you just meet me in the middle?
I'm losing my mind just a little
So why don't you just meet me in the middle?
In the middle

[Verse 2: Maren Morris]
Ohh, take a step
Back for a minute, into the kitchen
Floors are wet
And taps are still running, dishes are broken
How did we get into this mess? Got so aggressive
I know we meant all good intentions

[Pre-Chorus: Maren Morris]
So pull me closer
Why don't you pull me close
Why don't you come on over
I can't just let you go

[Chorus: Maren Morris]
Oh baby, why don't you just meet me in the middle?
I'm losing my mind just a little
So why don't you just meet me in the middle?
In the middle

[Bridge: Maren Morris]
Looking at you, I can't lie
Just pouring out admission
Regardless of my objection
And it's not about my pride
I need you on my skin
Just come over, pull me in, just

[Chorus: Maren Morris]
Oh, baby, why don't you just meet me in the middle
I'm losing my mind just a little
So why don't you just meet me in the middle?
In the middle, no no
Baby, why don't you just meet me in the middle?
Oh yeah, I'm losing my mind just a little
So why don't you just meet me in the middle?
Oh, in the middle
Baby-y-y, why don't you just meet me in the middle, baby?
I'm losing my mind just a little
So why don't you just meet me in the middle, middle?
In the middle, middle"
4,Rewrite the Stars,Zac Efron,Pop,"[Verse 1: Phillip Carlyle]
You know I want you
It's not a secret I try to hide
I know you want me
So don't keep saying our hands are tied
You claim it's not in the cards
And fate is pulling you miles away
And out of reach from me
But you're here in my heart
So who can stop me if I decide
That you're my destiny?

[Chorus 1: Phillip Carlyle]
What if we rewrite the stars?
Say you were made to be mine
Nothing could keep us apart
You'd be the one I was meant to find
It's up to you, and it's up to me
No one can say what we get to be
So why don't we rewrite the stars?
Maybe the world could be ours
Tonight

[Verse 2: Anne Wheeler]
You think it's easy
You think I don't want to run to you
But there are mountains
And there are doors that we can't walk through
I know you're wondering why
Because we're able to be
Just you and me
Within these walls
But when we go outside
You're gonna wake up and see that it was hopeless after all

[Chorus 2: Anne Wheeler]
No one can rewrite the stars
How can you say you'll be mine?
Everything keeps us apart
And I'm not the one you were meant to find
It's not up to you, it's not up to me
When everyone tells us what we can be
How can we rewrite the stars?
Say that the world can be ours
Tonight

[Post Chorus: Both, Anne Wheeler, Phillip Carlyle]
All I want is to fly with you
All I want is to fall with you
So just give me all of you
It feels impossible
It's not impossible
Is it impossible?
Say that it's possible

[Chorus 3: Phillip Carlyle and Anne Wheeler]
How do we rewrite the stars?
Say you were made to be mine?
Nothing can keep us apart
Cause you are the one I was meant to find
It's up to you, and it's up to me
No one can say what we get to be
And why don't we rewrite the stars?
Changing the world to be ours

[Outro: Anne Wheeler]
You know I want you
It's not a secret I try to hide
But I can't have you
We're bound to break and
My hands are tied"
5,​lovely,Billie Eilish & Khalid,Pop,"[Verse 1: Billie Eilish & Khalid]
Thought I found a way
Thought I found a way out (found)
But you never go away (never go away)
So I guess I gotta stay now

[Pre-Chorus: Billie Eilish & Khalid]
Oh, I hope some day I'll make it out of here
Even if it takes all night or a hundred years
Need a place to hide, but I can't find one near
Wanna feel alive, outside I can't fight my fear

[Chorus: Billie Eilish with Khalid]
Isn't it lovely, all alone
Heart made of glass, my mind of stone
Tear me to pieces, skin to bone
Hello, welcome home

[Verse 2: Khalid with Billie Eilish]
Walking out of time
Looking for a better place (looking for a better place)
Something's on my mind
Always in my head space

[Pre-Chorus: Billie Eilish & Khalid]
But I know someday I'll make it out of here
Even if it takes all night or a hundred years
Need a place to hide, but I can't find one near
Wanna feel alive outside I can't fight my fear

[Chorus: Billie Eilish with Khalid]
Isn't it lovely, all alone
Heart made of glass, my mind of stone
Tear me to pieces, skin to bone
Hello, welcome home

[Outro: Khalid, Billie Eilish, Khalid & Billie Eilish]
Woah, yeah
Yeah, ah
Woah, woah
Hello, welcome home"
6,Be Careful,Cardi B,Pop,"[Intro]
Yeah
Care for me, care for me, care for me, uh
Yeah, look

[Verse 1]
I wanna get married, like the Currys, Steph and Ayesha shit
But we more like Belly—Tommy and Keisha shit
Gave you TLC, you wanna creep and shit
Poured out my whole heart to a piece of shit
Man, I thought you would've learned your lesson
'Bout likin' pictures, not returnin' texts
I guess it's fine, man, I get the message
You still stutter after certain questions
You keep in contact with certain exes
Do you, though, trust me, nigga, it's cool, though
Said that you was workin', but you out here chasin' culo
And putas, chillin' poolside, livin' two lives
I could've did what you did to me to you a few times
But if I did decide to slide, find a nigga
Fuck him, suck his dick, you would've been pissed
But that's not my M.O., I'm not that type of bitch
And karma for you is gon' be who you end up with
You make me sick, nigga

[Chorus]
The only man, baby, I adore
I gave you everything, what's mine is yours
I want you to live your life of course
But I hope you get what you dyin' for
Be careful with me, do you know what you doin'?
Whose feelings that you're hurtin' and bruisin'?
You gon' gain the whole world
But is it worth the girl that you're losin'?
Be careful with me
Yeah, it's not a threat, it's a warnin'
Be careful with me
Yeah, my heart is like a package with a fragile label on it
Be careful with me

[Bridge]
Care for me, care for me
Always said that you'd be there for me, there for me
Boy, you better treat me carefully, carefully, look

[Verse 2]
I was here before all of this
Guess you actin' out now, you got an audience
Tell me where your mind is, drop a pin, what's the coordinates?
You might have a fortune, but you lose me, you still gon' be misfortunate, nigga
Tell me, this love's got you this fucked up in the head
You want some random bitch up in your bed?
She don't even know your middle name, watch her 'cause she might steal your chain
You don't want someone who loves you instead? I guess not though
It's blatant disrespect, you nothin' like the nigga I met
Talk to me crazy and you quick to forget
You even got me trippin', you got me lookin' in the mirror different
Thinkin' I'm flawed because you inconsistent
Between a rock and a hard place, the mud and the dirt
It's gon' hurt me to hate you, but lovin' you's worse
It all stops so abrupt, we started switchin' it up
Teach me to be like you so I can not give a fuck
Free to mess with someone else, I wish these feelings could melt
'Cause you don't care about a thing except your mothafuckin' self
You make me sick, nigga

[Chorus]
The only man, baby, I adore
I gave you everything, what's mine is yours
I want you to live your life of course
But I hope you get what you dyin' for
Be careful with me, do you know what you doin'?
Whose feelings that you're hurtin' and bruisin'?
You gon' gain the whole world
But is it worth the girl that you're losin'?
Be careful with me
Yeah, it's not a threat, it's a warnin'
Be careful with me
Yeah, my heart is like a package with a fragile label on it
Be careful with me"
7,Te Boté (Remix),"Nio García, Casper Mágico & Bad Bunny",Pop,no lyrics
8,One Kiss,Calvin Harris & Dua Lipa,Pop,"[Chorus]
One kiss is all it takes
Fallin' in love with me
Possibilities
I look like all you need

[Verse 1]
Let me take the night, I love real easy
And I know that you'll still wanna see me
On the Sunday morning, music real loud
Let me love you while the moon is still out

[Pre-Chorus]
Something in you lit up heaven in me
The feeling won't let me sleep
'Cause I'm lost in the way you move, the way you feel

[Chorus]
One kiss is all it takes
Fallin' in love with me
Possibilities
I look like all you need
One kiss is all it takes
Fallin' in love with me
Possibilities
I look like all you need

[Post-Chorus]
One
One
One
One

[Verse 2]
I just wanna feel your skin on mine
Feel your eyes do the exploring
Passion in the message when you smile
Take my time

[Pre-Chorus]
Something in you lit up heaven in me
The feeling won't let me sleep
'Cause I'm lost in the way you move, the way you feel

[Chorus]
One kiss is all it takes
Fallin' in love with me
Possibilities
I look like all you need
One kiss is all it takes
Fallin' in love with me
Possibilities
I look like all you need

[Post-Chorus]
One
One
One
One

[Bridge]
See a wonderland in your eyes
Might need your company tonight

[Pre-Chorus]
Something in you lit up heaven in me
The feeling won't let me sleep
'Cause I'm lost in the way you move, the way you feel

[Chorus]
One kiss is all it takes
Fallin' in love with me
Possibilities
I look like all you need
One kiss is all it takes
Fallin' in love with me
Possibilities
I look like all you need

[Post-Chorus]
One
One
One
One"
9,SAD!,XXXTENTACION,Pop,"[Intro]
(Yeah)

[Chorus]
Who am I? Someone that's afraid to let go, uh
You decide if you're ever gonna let me know (yeah)
Suicide if you ever try to let go, uh
I'm sad, I know, yeah, I'm sad, I know, yeah
Who am I? Someone that's afraid to let go, uh
You decide if you're ever gonna let me know (yeah)
Suicide if you ever try to let go, uh
I'm sad, I know, yeah, I'm sad, I know, yeah

[Verse]
I gave her everything
She took my heart and left me lonely
I think broken heart's contagious
I won't fix, I'd rather weep
I'm lost then I'm found
But it's torture bein' in love
I love when you're around
But I fuckin' hate when you leave

[Chorus]
Who am I? Someone that's afraid to let go, uh
You decide if you're ever gonna let me know (yeah)
Suicide if you ever try to let go, uh
I'm sad, I know, yeah, I'm sad, I know, yeah
Who am I? Someone that's afraid to let go, uh
You decide if you're ever gonna let me know (yeah)
Suicide if you ever try to let go, uh
I'm sad, I know, yeah, I'm sad, I know, yeah
Who am I? Someone that's afraid to let go, uh
You decide if you're ever gonna let me know (yeah)
Suicide if you ever try to let go, uh
I'm sad, I know, yeah, I'm sad, I know, yeah
Who am I? Someone that's afraid to let go, uh
You decide if you're ever gonna let me know (yeah)
Suicide if you ever try to let go, uh
I'm sad, I know, yeah, I'm sad, I know, yeah"
10,OTW,"Khalid, 6LACK & Ty Dolla $ign",Pop,"[Intro: Khalid]
Na, na, na, na, ooh
Oh, no, oh, ayy

[Chorus: Khalid]
Put it in drive, I'll be outside, I'll be on the way
I'll be on the way
You can meet me in five, I'll be all night, I'll be a-all day
I'll be a-all day
Put it in drive, I'll be outside, I'll be on the way
I'll be on the way
You can meet me in five, I'll be all night, I'll be all day
I'll be all day

[Verse 1: Khalid]
Yeah, yeah, yeah
This the type of shit that you been waiting all year for
Back in town for a minute if you with it (yeah)
Got a lot of time, I just need somewhere to spend it
I just press a button and the top go missing
I kept the slip so you know it's not rented, yeah, oh, oh
What you wanna do?
Worried 'bout your friends, they saw you this afternoon
I been reading your mind
No fair, but you gotta let me know
I'm all ears and I got a lot of room in my whip
If you wanna take it there, I'm on my way

[Chorus: Khalid]
Put it in drive, I'll be outside, I'll be on the way
I'll be on the way
You can meet me in five, I'll be all night, I'll be all day
I'll be all day
Put it in drive, I'll be outside, I'll be on the way
I'll be on the way
You can meet me in five, I'll be all night, I'll be all day
I'll be all day

[Verse 2: Ty Dolla $ign]
(Dolla $ign, Dolla $ign)
Drop top the Porsche, put that bitch in sport
Out here in the field, oh yeah (yeah), I'm already here, yeah
Come outside, looking like a snack, hurry up, get in, hell yeah (yeah)
Come with me on this mission (ooh yeah, ooh yeah)
Riding down the coast (ooh yeah), I want that for sure (ooh yeah)
You say, ""Play Khalid"" (ooh yeah)
I say, ""Pass the weed"" (ooh yeah)
Pull up to the crib, oh, said you've never been before
Put you in Provocateur, girl, I made you mi amor
You said you left your ex, that dude was always gassy
You said before me, you ain't never been this happy
You took an L with him and winning ever since (ever since)
You hit my phone, I'm on my way, I cancel plans, yeah, yeah

[Chorus: Khalid]
Put it in drive, I'll be outside, I'll be on the way
I'll be on the way
You can meet me in five, I'll be all night, I'll be all day
I'll be all day
Put it in drive, I'll be outside, I'll be on the way
I'll be on the way
You can meet me in five, I'll be all night, I'll be all day
I'll be all day

[Verse 3: 6LACK]
You tryna make a move
Tonight I got the time, tell me what you wanna do
Call the squad if you wanna rendezvous
They gon' push up on it, on it, I only got room for two
From the 'jects on the set, it's a Porsche, not a 'Vette
I confess, I'ma flex, ayy, show some respect
Get away so we can make sense of your life
You was in park but I just put your shit in drive
Now coast like there's no tomorrow
Moving too fast, I'm hoping to drive slow (yeah)
I don't want you to wonder where I go
Can learn a lot from this and it's something that I know

[Chorus: Khalid]
Put it in drive, I'll be outside, I'll be on the way
I'll be on the way
You can meet me in five, I'll be all night, I'll be all day
I'll be all day
Put it in drive, I'll be outside, I'll be on the way
I'll be on the way
You can meet me in five, I'll be all night, I'll be all day
I'll be all day"
11,Hasta Luego,HRVY & Malu Trevejo,Pop,"[Verse 1: HRVY]
You got them Juliet eyes
An I can be your Romeo tonight
Star crossed and love at first sight
An Its like a movie
She Danced like she never gonna die
Blowin up the floor like she dynamite
I dont wanna tell her good bye
But its only one Night

[Pre-Chorus: Malu Trevejo]
Ohh he got me
Oh he got me
Eye Yie Yie Yie Yie Yie Yie
Ohh he told me
Ohh he Told me
Eye Yie Yie Yie Yie Yie Yie

[Chorus: HRVY]
Hasta Luego (Way go)
But she don’t Know my Name though
(oh no)
Hasta Luego (Way go)
But she don’t Know my Name though
(oh no)
I said bailamos
I said bailamos
I said bailamos and we dance
Hasta Luego (Way go)
But you don’t Know my Name though
(Oh No)

[Verse 2: Malu Trevejo]
No pasa nada esta bien
Haria lo que sea para verte
Y al tenerte a mis pies
Esto se pone caliente
Bailando quiero probar
Pero mi corazón sabe esperar
Tengo Para enamorar
Yo tengo lo que tu quieres

[Pre-Chorus: HRVY]
Ohh she got me
Ohh she got me
Eye Yie Yie Yie Yie Yie Yie
Ohh she told me
Ohh she Told me
Eye Yie Yie Yie Yie Yie Yie

[Chorus: HRVY]
Hasta Luego (Way go)
But she don’t Know my Name though
(oh no)
Hasta Luego (Way go)
But she don’t Know my Name though
(oh no)
I said bailamos
I said bailamos
I said bailamos and we dance
Hasta Luego (Way go)
But you don’t Know my Name though
(Oh No)

[Post-Chorus: HRVY, Malu Trevejo]
I'm like
Ohh ohh
Ay ay ay
Me tienes
Ohh ohh
Ay ay ay
I'm like
Ohh ohh
Ay ay ay
Me tienes
Ohh ohh
Ay ay ay

[Chorus: HRVY]
Hasta Luego (Way go)
But she don’t Know my Name though
(oh no)
Hasta Luego (Way go)
But she don’t Know my Name though
(oh no)
I said bailamos
I said bailamos
I said bailamos and we dance
Hasta Luego (Way go)
But you don’t Know my Name though
(Oh No)"
12,Take a Byte,Janelle Monáe,Pop,"[Verse 1]
I'm not the kind of girl you take home to your mama now
I tell you no lies (I tell no lies)
Your code is programmed not to love me, but you can't pretend
Oh, what a surprise
Maybe it's lust, maybe it's love, maybe it never ends
Ooh, say your goodbyes (say 'em now)
Play in my hair and nibble there all on my mocha skin
Yeah, just take a byte

[Chorus]
Take a byte (just take a byte)
Help yourself (help yourself)
It's alright (it's alright)
I won't tell (it feels so good when you nibble on it)
Take a byte (just take a byte)
Help yourself (you look so good just help yourself)
Don't think twice (don't think twice)
I won't tell

[Verse 2]
My random access memory wants you to come again
No, don't say goodbye (don't say goodbye)
I saw my therapist she thinks you are my magic sin
Oh, maybe she's right (maybe she's right)
Well I'll just lick an angel just to purify again
Ooh, angels are fun (they're so fun)
So dress me up I'll like it better if we both pretend
Yeah, make love 'til we're numb

[Chorus]
Take a byte (just take a byte)
Help yourself (just go ahead and help yourself)
It's alright (it's alright)
I won't tell (take a byte)
Take a byte (just take a byte)
Help yourself (you look so good just help yourself)
Don't think twice (don't think twice)
I won't tell
Take a byte (just take a byte)
Help yourself (help yourself)
It's alright (it's alright)
I won't tell
Take a byte (oh won't you just take a byte)
Help yourself (go on and help yourself)
It's alright
I won't tell

[Outro]
Just take a byte
You look so good just help yourself
It's alright
Take a little byte
Take a little byte
Take a little byte"
