,Song_Name,Artist,Genre,Lyrics
82,The Other Side,Hugh Jackman,Pop,"[Verse 1: P.T. Barnum]
Right here, right now
I put the offer out
I don't want to chase you down
I know you see it
You run with me
And I can cut you free
Out of the drudgery and walls you keep in
So trade that typical for something colorful
And if it's crazy, live a little crazy
You can play it sensible, a king of conventional
Or you can risk it all and see

[Chorus: P.T. Barnum]
Don't you wanna get away from the same old part you gotta play
'Cause I got what you need
So come with me and take the ride
It'll take you to the other side
'Cause you can do like you do
Or you can do like me
Stay in the cage, or you'll finally take the key
Oh, damn! Suddenly you're free to fly
It'll take you to the other side

[Verse 2: Phillip Carlyle]
Okay, my friend, you want to cut me in
Well I hate to tell you, but it just won't happen
So thanks, but no
I think I'm good to go
'Cause I quite enjoy the life you say I'm trapped in
Now I admire you, and that whole show you do
You're onto something, really it's something
But I live among the swells, and we don't pick up peanut shells
I'll have to leave that up to you

[Chorus: Phillip Carlyle]
Don't you know that I'm okay with this uptown part I get to play
'Cause I got what I need and I don't want to take the ride
I don't need to see the other side
So go and do like you do
I'm good to do like me
Ain't in a cage, so I don't need to take the key
Oh, damn! Can't you see I'm doing fine
I don't need to see the other side

[Verse 3: P.T. Barnum]
Now is this really how you like to spend your days?
Whiskey and misery, and parties and plays

[Phillip Carlyle]
If I were mixed up with you, I'd be the talk of the town
Disgraced and disowned, another one of the clowns

[P.T. Barnum]
But you would finally live a little, finally laugh a little
Just let me give you the freedom to dream and it'll
Wake you up and cure your aching
Take your walls and start 'em breaking
Now that's a deal that seems worth taking
But I guess I'll leave that up to you

[Bridge: Phillip Carlyle]
Well it's intriguing, but to go would cost me greatly
So what percentage of the show would I be taking?

[P.T. Barnum]
Fair enough, you'd want a piece of all the action
I'd give you seven, we could shake and make it happen

[Phillip Carlyle]
I wasn't born this morning, eighteen would be just fine

[P.T. Barnum]
Why not just go ahead and ask for nickels on the dime

[Phillip Carlyle]
Fifteen

[P.T. Barnum]
I'd do eight

[Phillip Carlyle]
Twelve

[P.T. Barnum]
Maybe nine

[Phillip Carlyle]
Ten

[Chorus: Both]
Don't you wanna get away to a whole new part you're gonna play
'Cause I got what you need, so come with me and take the ride
To the other side
So if you do like I do
So if you do like me
Forget the cage, 'cause we know how to make the key
Oh, damn! Suddenly we're free to fly
We're going to the other side
So if you do like I do
(To the other side)
So if you do like me
(We're going to the other side)
'Cause if we do we're going to the other side
We're going to the other side"
83,Sunflower,Rex Orange County,Pop,"[Intro]
I want to know
Where I can go
When you're not around
And I'm feeling down
So won't you stay for a moment
So I can say
I, I need you so
Cause right now you know, that nothing here's new
And I'm obsessed with you
Then I fell to the ground
And you smiled at me and said

[Verse 1]
I don't wanna see you cry
You don't have to feel this emptiness
She said I love you till the day that I die
Well maybe she's right
Cause I don't wanna feel like I'm not me
And to be honest I don't even know why
I let myself get down in the first place

[Chorus]
Tryna keep my mind at bay
Sunflowers still grows at night
Waiting for a minute till the sun's seen through my eyes
Make it down down, do-do-down
Diggy dig down, du du du du
Waiting for a minute till the sun's seen through my eyes

[Verse 2]
You know you need to get yourself to sleep and dream
A dream of you and I
There's no need to keep an open eye
I promise I'm the one for you
Just let me hold you in these arms tonight
I’m lucky to be me and you can see it in my face
Back when I fucked my shit up too many times
Why would I let myself get down in the first place

[Chorus]
Tryna keep my mind at bay
Sunflowers still grows at night
Waiting for a minute till the sun's seen through my eyes
Make it down down, do-do-down
Diggy dig down, du du du
Waiting for a minute till the sun's seen through my eyes

[Bridge]
And so she sat me down and told me that I didn't have to cry
Said I didn't need to get down and feel empty inside
And told me that she love me for as long as she's alive
And well, maybe she's right, cause I hate it when I feel like I'm not me
See, I honestly, don't even know why
I, I honestly don't even know why

[Chorus]
Tryna keep my mind at bay
Sunflowers still grows at night
Waiting for a minute till the sun's seen through my eyes
Make it down down, do-do-down
Diggy dig down, du du du
Waiting for a minute till the sun's seen through my eyes"
84,Hon Dansar Vidare I Livet,HOV1,Pop,"[Vers 1: Noel Flike]
Nu står hon där med vitsippor i håret
Tänker på allt tomt
Allt kan bli förlåtet
Vissna, mörka perioder har genomsyrat året
Ser på gamla bilder
Brukade va sår
Men allting ja', allting ja', allting ja' va'
Försvann där o' då, yeah
Du likaså
Som man bäddar får man ligga, Ingen bädda när vi låg
Ligger lågt
Där i sängen var vi en, nu är vi ba' två
Från alfa till omega
Vi låg nog före hela
Stänger av varje gång någon spelar vår sång
Det här är överlevnad
Det är klart vi bytte skepnad
O' vi förlorade varann med nå'ra hundradelar
Inget jag vill ha tillbaks
Det är klart, Inget går i kras
Det är klart, det var du
Men förevigt var aldrig för oss, hjärtat
O' det vet vi nu

[Refräng: Ludwig Kronstrand]
Hon dansar vidare i livet
Jag sparkar backspeglar på vägen hem
Hon har allt för dyra kläder
Men hon var min

[Vers 2: Dante Lindhe]
Hon sa: kasta bort din blyertspenna, båda klär i bläck
Skriver du mitt namn så kan du få mig nu direkt
Alla vet att hon är vacker men finns mer, ett intellekt
Och ingen annan toppar vårat sex
Tårarna ska spruta inte rinna
Hon sa ligga inte luta
Så vi gråter inte längre nu i regnet på en julafton
Och alla våra smycken va' i plast
Men ändå vart det dyraste ja' haft
Så nästa gång vi ses
Kommer jag att minnas för oss båda
O' du vet, att ja' klipper bilar på din gata
Men du skrev
Kommer jag att hålla oss två i hemlighet
Och inget är försent
Så förneka oss föralltid
Kommer alltid va' din första
Kanske inte bästa men ja' hoppas på det största
Vi kanske ses igen när vi är vuxna
O' ligger som vi låg när vi va unga

[Refräng: Ludwig Kronstrand]
Hon dansar vidare i livet
Jag sparkar backspeglar på vägen hem
Hon har allt för dyra kläder
Men hon var min

[Vers 3: Ludwig Kronstrand]
Yo, Det va' så länge sen ja' såg dig, hur mår du nu?
Jag hörde att du träffa nån, o' att ni har kul
Inte för att snoka men ja' vet ju vad du gör
Alla här i staden gillar skvaller så jag hör
Lyssnar du på radio o' vad tycker du om oss?
Berätta nu om världen, var det bättre än du trott?
Stockholm är ju samma varför kommer du tillbaks?
Fan nu är vi gamla, vet du vad?
Vägen hit va' lång
Men inte som vi trott
Vi kollade på lägenheter där vi ville bo
Din mamma skicka hem mig, hon sa nu har ja' fått nog
Du släppte ut ditt hjärta genom fönstret som en bok
O' det va' blommor under kudden, båda drömde om varann
Det sprakar nog med mig, ja' vill minnas att vi brann
Du sa att vi förlora men mitt hjärta, vet du vad?
Vi båda har ju vunnit vi mår bra

[Refräng: ]
Hon dansar vidare i livet
Jag sparkar backspeglar på vägen hem
Hon har allt för dyra kläder
Men hon var min

[Outro: Ludwig Kronstrand]
För hon har blommor
Där i sitt hår
Tror hon har glömt nu
Det va' då
Men ja' ska minnas för oss två
Så bara gå"
85,Revenge,XXXTENTACION,Pop,"[Intro]
I think I, I think I finally
Found a way to forgive myself
From mistakes I made in my past
I think that's the first step, right?
You agree?

[Verse]
I've dug two graves for us, my dear
Can't pretend that I was perfect, leavin' you in fear
Oh man, what a world, the things I hear
If I could act on my revenge, then, oh, would I?
Some kill, some steal, some break your heart
And you thought that I would let it go and let you walk
Broken hearts, break bones, so break up fast
And I don't wanna let it go, so in my grave I'll rot
I've dug two graves for us, my dear
Can't pretend that I was perfect, leavin' you in fear
Oh man, what a world, the things I hear
If I could act on my revenge, then, oh, would I?
Some kill, some steal, some break your heart
And you thought that I would let it go and let you walk
Broken hearts, break bones, so break up fast
And I don't wanna let it go, so in my grave I'll rot

[Outro]
In my grave, I'll rot
In my grave, I'll rot
In my grave, I'll rot
In my grave, I'll rot
In my grave, I'll rot
In my grave, I'll rot
In my grave, I'll rot
I'll rot, I'll rot, I'll rot
Is my pain your freedom?
Is all of my pain your freedom?
Enjoy…"
86,Say Something,Justin Timberlake,Pop,"[Intro: Justin Timberlake]
Mhmm, yeah, alright
Ooh

[Verse 1: Justin Timberlake]
Everyone knows all about my direction
And in my heart somewhere I wanna go there
Still, I don't go there

[Chorus: Justin Timberlake & Chris Stapleton]
Everybody says, ""say something that says something”
“Say something that says something”
“Say something that says something”
I don't wanna get caught, up in the rhythm of it
But I can't help myself, no, I can't help myself, no, no
Caught up in the middle of it
No, I can't help myself, no I can't help myself, no, no, no
Caught up in the rhythm of it

[Post-Chorus: Justin Timberlake & Chris Stapleton]
Maybe I'm looking for something I can't have (Maybe I'm looking for something I can't have)
Maybe I'm looking for something I can't have

[Verse 2: Chris Stapleton & Justin Timberlake]
Everyone knows all about my transgressions
Still in my heart somewhere, there's melody and harmony
For you and me, tonight (whoa)
I hear them call my name

[Chorus: Chris Stapleton & Justin Timberlake]
Everybody says, ""Say something""
Then, ""Say something, say something""
Then, ""Say something, say something""
Then, ""Say something""
I don't want to get caught up in the rhythm of it
But I can't get help myself, no I can't help myself, no, no
Caught up in the middle of it
No, I can't help myself, no I can't help myself, no, no, no
Caught up in the rhythm of it

[Post-Chorus: Justin Timberlake & Chris Stapleton]
Maybe I'm looking for something I can't have (Maybe I'm looking for something I can't have)
Maybe I'm looking for something I can't have (Maybe I'm looking for something I can't have)
Maybe I'm looking for something I can't have (Maybe I'm looking for something I can't have)
Maybe I'm looking for something I can't have (Maybe I'm looking for something I can't have)

[Bridge: Justin Timberlake & Chris Stapleton]
Sometimes, the greatest way to say something is to say nothing at all
Sometimes, the greatest way to say something is to say nothing at all
Sometimes, the greatest way to say something is to say nothing

[Part-Chorus: Justin Timberlake & Chris Stapleton]
But I can't help myself, no I can't help myself, no, no
Caught up in the middle of it
No, I can't help myself, no I can't help myself, no, no, no
Caught up in the rhythm of it

[Post-Chorus: Justin Timberlake & Chris Stapleton]
Maybe I'm looking for something I can't have (Maybe I'm looking for something I can't have)
Maybe I'm looking for something I can't have (Maybe I'm looking for something I can't have)
Maybe I'm looking for something I can't have (Maybe I'm looking for something I can't have)
Maybe I'm looking for something I can't have (Maybe I'm looking for something I can't have)

[Outro: Justin Timberlake & Chris Stapleton]
Sometimes the greatest way to say something is to say nothing at all
Sometimes the greatest way to say something is to say nothing at all
Sometimes the greatest way to say something is to say nothing"
87,Come Alive,Hugh Jackman,Pop,"[Verse 1: P.T. Barnum]
You stumble through your days
Got your head hung low
Your skies' a shade of grey
Like a zombie in a maze
You're asleep inside
But you can shake awake

[Pre-Chorus: P.T. Barnum]
'Cause you're just a dead man walking
Thinking that's your only option
But you can flip the switch and brighten up your darkest day
Sun is up and the color's blinding
Take the world and redefine it
Leave behind your narrow mind
You'll never be the same

[Pre-Chorus: P.T. Barnum]
Come alive, come alive
Go and light your light
Let it burn so bright
Reaching up
To the sky
And it's open wide
You're electrified

[Chorus: P.T. Barnum]
When the world becomes a fantasy
And you're more than you could ever be
'Cause you're dreaming with your eyes wide open
And you know you can't go back again
To the world that you were living in
'Cause you're dreaming with your eyes wide open
So, come alive!

[Verse 2: P.T. Barnum]
I see it in your eyes
You believe that lie
That you need to hide your face
Afraid to step outside
So you lock the door
But don't you stay that way

[Lettie Lutz]
No more living in those shadows
You and me, we know how that goes

[Lord of Leeds]
'Cause once you see it, oh you'll never, never be the same

[Both]
We will be the light that's turning
Bottle up but keep on shining

[All]
You can prove there's more to you

[P.T. Barnum]
You cannot be afraid

[Pre-Chorus: Ensemble]
Come alive, come alive
Go and light your light
Let it burn so bright
Reaching up
To the sky
And it's open wide
You're electrified

[Chorus: Ensemble]
When the world becomes a fantasy
And you're more than you could ever be
'Cause you're dreaming with your eyes wide open
And we know we can't be go back again
To the world that we were living in
'Cause we're dreaming with our eyes wide open
So, come alive!

[Ensemble]
Come one!
Come all!
Come in!
Come on!

[Anne Wheeler]
To anyone who's bursting with a dream

[Ensemble]
Come one!
Come all!
You hear
The call

[P.T. Barnum]
To anyone who's searching for a way to break free

[Ensemble]
Break free!
Break free!

[Chorus: Ensemble and P.T. Barnum]
When the world becomes a fantasy
And you're more than you could ever be
'Cause you're dreaming with your eyes wide open
And we know we can't be go back again
To the world that we were living in
'Cause we're dreaming with our eyes wide open
(Hey!)

[Chorus: Ensemble and P.T. Barnum]
When the world becomes a fantasy
And you're more than you could ever be
'Cause you're dreaming with your eyes wide open
And we know we can't be go back again
To the world that we were living in
'Cause we're dreaming with our eyes wide open

[Outro: Ensemble and P.T. Barnum]
'Cause we're dreaming with our eyes wide open

So come alive! (Come alive!)"
88,The A Team,Ed Sheeran,Pop,"[Verse 1]
White lips, pale face
Breathing in the snowflakes
Burnt lungs, sour taste
Light's gone, day's end
Struggling to pay rent
Long nights, strange men

[Pre-Chorus]
And they say
She's in the Class A Team
Stuck in her daydream
Been this way since 18
But lately, her face seems
Slowly sinking, wasting
Crumbling like pastries
And they scream
The worst things in life come free to us

[Chorus 1]
'Cause she's just under the upper hand
And go mad for a couple of grams
And she don't want to go outside tonight
And in a pipe she flies to the Motherland
Or sells love to another man
It's too cold outside
For angels to fly
Angels to fly

[Verse 2]
Ripped gloves, raincoat
Tried to swim and stay afloat
Dry house, wet clothes
Loose change, bank notes
Weary-eyed, dry throat
Call girl, no phone

[Pre-Chorus]
And they say
She's in the Class A Team
Stuck in her daydream
Been this way since 18
But lately, her face seems
Slowly sinking, wasting
Crumbling like pastries
And they scream
The worst things in life come free to us

[Chorus 1]
'Cause she's just under the upper hand
And go mad for a couple of grams
And she don't want to go outside tonight
And in a pipe she flies to the Motherland
Or sells love to another man
It's too cold outside
For angels to fly

[Bridge]
An angel will die
Covered in white
Closed eyes and hopin' for a better life
This time, we'll fade out tonight
Straight down the line

[Pre-Chorus]
And they say
She's in the Class A Team
Stuck in her daydream
Been this way since 18
But lately, her face seems
Slowly sinking, wasting
Crumbling like pastries
And they scream
The worst things in life come free to us

[Chorus 2]
And we're all under the upper hand
And go mad for a couple of grams
And we don't want to go outside tonight
And in a pipe she flies to the Motherland
Or sells love to another man
It's too cold outside
For angels to fly
Angels to fly
Fly, fly
For angels to fly
To fly, to fly
For angels to die"
89,Intro: Euphoria,BTS,Pop,no lyrics
90,Without You,Avicii,Pop,"[Verse 1]
You said that we would always be
Without you I feel lost at sea
Through the darkness you'd hide with me
Like the wind we'd be wild and free

[Pre-Chorus]
You said you'd follow me anywhere
But your eyes tell me you won't be there

[Chorus]
I've gotta learn how to love without you
I've gotta carry my cross without you
Stuck in the middle and I'm just about to
Figure it out without you
And I'm done sitting home without you
Fuck, I'm going out without you
I'm gonna to tear this city down without you
I'm goin' Bonnie and Clyde without you

[Verse 2]
Now I'm running away, my dear
From myself and the truth I fear
My heart is beating I can't see clear
How I'm wishing that you were here

[Pre-Chorus]
You said you'd follow me anywhere
But your eyes tell me you won't be there

[Chorus]
I've gotta learn how to love without you
I've gotta carry my cross without you
Stuck in the middle and I'm just about to
Figure it out without you
And I'm done sitting home without you
Fuck, I'm going out without you
I'm gonna to tear this city down without you
I'm goin' Bonnie and Clyde without you"
91,Lo malo,Aitana & Ana Guerra,Pop,no lyrics
92,Don't Leave Me,BTS,Pop,"君の言葉には
いくつの意味が
あるように聞こえるから
What is what?

謎の足跡
見つけたら Follow
追い込まれる My shadows
光の裏側に潜めた what?

会えない君だけが知る My answer
途切れる前に
I wanna know everything
時が流れるほど
深まる君の
過去と未来の間にいる僕は今

Don't leave me
I believe 走り出す
No ending 君は僕の鼓動
例えどんな
雨に打たれても
例えどんな
闇に消されても

救い出すよ必ず
君は独りじゃない

動くはずない時計の針が今
一歩一歩踏み出すように Moving on

Calling me passing me
すれ違い All of it destiny
それでも始まる One way race
離れ始めても That's ok
You don't gotta
Worry bout a thing
Nah Not a thang

今度は俺が送る番
必ず届ける Your thoughts

時が戻せるなら出直せるのに
陰と光の間にいる君は泣く

Don't leave me
I believe 手を伸ばす
No ending 君が僕の希望
例えどんな
雨に打たれても
例えどんな
闇に消されても
目を閉じずに感じて
君は独りじゃない

全ては秒速で過去へ
今を生きる意味を知った
君と出会って

Don't leave me
I believe 走り出す
No ending 君は僕の鼓動
例えどんな
雨に打たれても
例えどんな
闇に消されても
救い出すよ必ず
君は独りじゃない"
93,Super Far,LANY,Pop,"[Verse 1]
Up all night on my mind got me thinking
Wanna stay, can you give me a reason?
I don't think so, I don't think so
I'm in love with someone, but I'm not sure
She can love someone back the way they love her
I don't think so, I don't think so

[Pre-Chorus 1]
Don't be mean, if you wanna go
You can leave and leave my heart alone

[Chorus]
Waking up to nothing when you're super far from home
And I watch you fall asleep at night and lay there on my own
Got me begging for affection, all you do is roll your eyes
Broken down, I've had enough
If this is love, I don't want it

[Verse 2]
Give it time, c'mon babe, it's been ten months
You should know, do you know, know what you want?
I don't think so, I don't think so
Make it work, know it hurts, but I'll go there
Do the same, can you show me that you care?
God, I hope so, but I don't think so

[Pre-Chorus 2]
Don't be mean, if you're here for good
I'm gonna need a little more from you

[Chorus]
Waking up to nothing when you're super far from home
And I watch you fall asleep at night and lay there on my own
Got me begging for affection, all you do is roll your eyes
Broken down, I've had enough
If this is love, I don't want it
All my friends keep saying that I'm way too good to you
But my heart is so invested, I don't wanna face the truth
I'm not happy, and you know it, and you still don't even try
Broken down, I've had enough
If this is love, I don't want it

[Instrumental]

[Chorus]
Waking up to nothing when you're super far from home
And I watch you fall asleep at night and lay there on my own
Got me begging for affection, all you do is roll your eyes
Broken down, I've had enough
If this is love, I don't want it
All my friends keep saying that I'm way too good to you
But my heart is so invested, I don't wanna face the truth
I'm not happy, and you know it, and you still don't even try
Broken down, I've had enough
If this is love, I don't want it"
94,These Days,Rudimental,Pop,"[Intro: Macklemore]
I know you moved onto someone new
Hope life is beautiful
You were the light for me to find my truth
I just wanna say, thank you

[Verse 1: Dan Caplen]
Leaving to find my soul
Told her I had to go
And I know it ain't pretty
When our hearts get broke
Too young to feel this old
Watching us both turn cold
Oh, I know it ain't pretty
When two hearts get broke
Yeah, I know it ain't pretty
When two hearts get broke

[Chorus: Jess Glynne]
I hope someday we'll sit down together
And laugh with each other about these days, these days
All our troubles, we'll lay to rest and
We'll wish we could come back to these days, these days

[Post-Chorus: Jess Glynne & Dan Caplen]
Oh I know, I know
Oh I know, I know
Oh I know, I know
These days, these days
Oh I know, I know
Oh I know, I know
Oh I know, I know
These days, these days

[Verse 2: Dan Caplen & Jess Glynne]
Three years of ups and downs
Nothing to show for it now
And I know it ain't pretty when the fire burns out
Calling me when I'm drunk remind me of what I've done
And I know it ain't pretty when you're trying to move on, yeah

[Chorus: Jess Glynne & Dan Caplen]
I hope someday we'll sit down together
And laugh with each other about these days, these days
All our troubles, we'll lay to rest and
We'll wish we could come back to these days, these days

[Post-Chorus: Jess Glynne & Dan Caplen]
Oh I know, I know
Oh I know, I know
Oh I know, I know
These days, these days
Oh I know, I know
Oh I know, I know
Oh I know, I know
To these days, these days

[Verse 3: Macklemore]
Cigarettes in the ashtray
Reminiscing on those past days
I thought you’d end up with my last name
But that changed
And I travelled around the world
Think where you living at now?
I heard you moved to Austin
Got an apartment and settled down
And every once in a while
I start texting
Write a paragraph
But then I delete the message
Think 'bout you like a past time
I could cry you a river
Get you baptised or
I wasn't ready to act right
Used to always think I'd get you back, right
They say that things fall apart
We were gonna move to Brooklyn
You were gonna study Art
Love is just a tool
To remind us who we are
And that we are not alone
And we're walking in the dark

[Chorus: Jess Glynne & Dan Caplen]
I hope someday we'll sit down together
And laugh with each other about these days, these days
All our troubles, we'll lay to rest and
We'll wish we could come back to these days, these days

[Outro : Jess Glynne & Dan Caplen]
We'll wish we could come back to these days, these days"
95,Burn,Lin-Manuel Miranda,Pop,"[ELIZA]
I saved every letter you wrote me
From the moment I read them
I knew you were mine
You said you were mine
I thought you were mine

Do you know what Angelica said
When we saw your first letter arrive?
She said

“Be careful with that one, love
He will do what it takes to survive.”

You and your words flooded my senses
Your sentences left me defenseless
You built me palaces out of paragraphs
You built cathedrals
I’m re-reading the letters you wrote me
I’m searching and scanning for answers
In every line
For some kind of sign
And when you were mine
The world seemed to

Burn
Burn

You published the letters she wrote you
You told the whole world how you brought
This girl into our bed
In clearing your name, you have ruined our lives
Do you know what Angelica said
When she read what you’d done?
She said
“You have married an Icarus
He has flown too close to the sun.”

You and your words, obsessed with your legacy...
Your sentences border on senseless
And you are paranoid in every paragraph
How they perceive you

You, you, you…

I’m erasing myself from the narrative
Let future historians wonder how Eliza
Reacted when you broke her heart
You have torn it all apart
I am watching it
Burn
Watching it burn
The world has no right to my heart
The world has no place in our bed
They don’t get to know what I said
I’m burning the memories
Burning the letters that might have redeemed you
You forfeit all rights to my heart
You forfeit the place in our bed
You sleep in your office instead
With only the memories
Of when you were mine
I hope that you burn"
