,Song_Name,Artist,Genre,Lyrics
28,7 Years,Lukas Graham,Pop,"[Chorus 1]
Once I was 7 years old my momma told me
Go make yourself some friends or you'll be lonely
Once I was 7 years old

[Verse 1]
It was a big big world, but we thought we were bigger
Pushing each other to the limits, we were learning quicker
By eleven smoking herb and drinking burning liquor
Never rich so we were out to make that steady figure

[Chorus 2]
Once I was 11 years old my daddy told me
Go get yourself a wife or you'll be lonely
Once I was 11 years old

[Verse 2]
I always had that dream like my daddy before me
So I started writing songs, I started writing stories
Something about that glory just always seemed to bore me
Cause only those I really love will ever really know me

[Chorus 3]
Once I was 20 years old, my story got told
Before the morning sun, when life was lonely
Once I was 20 years old

(Lukas Graham!!!)

[Verse 3]
I only see my goals, I don't believe in failure
Cause I know the smallest voices, they can make it major
I got my boys with me at least those in favor
And if we don't meet before I leave, I hope I'll see you later

[Chorus 4]
Once I was 20 years old, my story got told
I was writing 'bout everything, I saw before me
Once I was 20 years old
Soon we'll be 30 years old, our songs have been sold
We've traveled around the world and we're still roaming
Soon we'll be 30 years old

[Verse 4]
I'm still learning about life
My woman brought children for me
So I can sing them all my songs
And I can tell them stories
Most of my boys are with me
Some are still out seeking glory
And some I had to leave behind
My brother I'm still sorry

[Bridge]
Soon I'll be 60 years old, my daddy got 61
Remember life and then your life becomes a better one
I made a man so happy when I wrote a letter once
I hope my children come and visit, once or twice a month

[Chorus 5]
Soon I'll be 60 years old, will I think the world is cold
Or will I have a lot of children who can warm me
Soon I'll be 60 years old
Soon I'll be 60 years old, will I think the world is cold
Or will I have a lot of children who can hold me
Soon I'll be 60 years old

[Chorus 1 recap]
Once I was seven years old, my momma told me
Go make yourself some friends or you'll be lonely
Once I was seven years old

Once I was seven years old"
29,Let Me Love You,DJ Snake,Pop,"[Verse 1: Justin Bieber]
I used to believe
We were burnin' on the edge of somethin' beautiful
Somethin' beautiful
Sellin' a dream
Smoke and mirrors keep us waitin' on a miracle
On a miracle

[Pre-Chorus: Justin Bieber]
Say, go through the darkest of days
Heaven's a heartbreak away
Never let you go, never let me down
Oh, it's been a hell of a ride
Driving the edge of a knife
Never let you go, never let me down

[Chorus: Justin Bieber]
Don't you give up, nah, nah, nah
I won't give up, nah, nah, nah
Let me love you
Let me love you
Don't you give up, nah, nah, nah
I won't give up, nah, nah, nah
Let me love you
Let me love you
Oh baby, baby

[Breakdown: DJ Snake]

[Verse 2: Justin Bieber]
Don't fall asleep
At the wheel, we've got a million miles ahead of us
Miles ahead of us
All that we need
Is a rude awakening to know we're good enough yeah
Know we're good enough

[Pre-Chorus: Justin Bieber]
Say go through the darkest of days
Heaven's a heartbreak away
Never let you go, never let me down
Oh it's been a hell of a ride
Driving the edge of a knife
Never let you go, never let me down

[Chorus: Justin Bieber]
Don't you give up, nah, nah, nah
I won't give up, nah, nah, nah
Let me love you
Let me love you
Don't you give up, nah, nah, nah
I won't give up, nah, nah, nah
Let me love you
Let me love you
Oh baby, baby

[Breakdown: DJ Snake]

[Chorus: Justin Bieber]
Don't you give up, nah, nah, nah
I won't give up, nah, nah, nah
Let me love you
Let me love you
Don't you give up, nah, nah, nah
I won't give up, nah, nah, nah
Let me love you
Let me love you
Oh baby, baby"
30,Sign of the Times,Harry Styles,Pop,"[Verse 1]
Just stop your crying, it's a sign of the times
Welcome to the final show
Hope you're wearing your best clothes
You can't bribe the door on your way to the sky
You look pretty good down here
But you ain't really good

[Pre-Chorus]
We never learn, we been here before
Why are we always stuck and running from
The bullets? The bullets?
We never learn, we been here before
Why are we always stuck and running from
The bullets? The bullets?

[Chorus]
Just stop your crying, it's a sign of the times
We gotta get away from here
We gotta get away from here
Just stop your crying, it'll be alright
They told me that the end is near
We gotta get away from here

[Verse 2]
Just stop your crying, have the time of your life
Breaking through the atmosphere
And things are pretty good from here
Remember everything will be alright
We can meet again somewhere
Somewhere far away from here

[Pre-Chorus]
We never learn, we been here before
Why are we always stuck and running from
The bullets? The bullets?
We never learn, we been here before
Why are we always stuck and running from
The bullets? The bullets?

[Chorus]
Just stop your crying, it's a sign of the times
We gotta get away from here
We gotta get away from here
Stop your crying, baby, it'll be alright
They told me that the end is near
We gotta get away from here

[Pre-Chorus]
We never learn, we been here before
Why are we always stuck and running from
The bullets? The bullets?
We never learn, we been here before
Why are we always stuck and running from
The bullets? The bullets?

[Bridge]
We don't talk enough, we should open up
Before it's all too much
Will we ever learn? We've been here before
It's just what we know

[Outro]
Stop your crying, baby, it's a sign of the times
We gotta get away, we got to get away
We got to get away, we got to get away
We got to get away
We got to, we got to, away
We got to, we got to, away
We got to, we got to, away"
31,Despacito,Luis Fonsi,Pop,no lyrics
32,Havana,Camila Cabello,Pop,"[Intro: Pharrell Williams]
Hey

[Chorus: Camila Cabello & Pharrell Williams]
Havana, ooh na-na (ayy)
Half of my heart is in Havana, ooh na-na (ayy, ayy)
He took me back to East Atlanta, na-na-na, ah
Oh, but my heart is in Havana (ayy)
There's somethin' 'bout his manners (uh huh)
Havana, ooh na-na (uh)

[Verse 1: Camila Cabello & Pharrell Williams]
He didn't walk up with that ""how you doin'?"" (uh)
When he came in the room
He said there's a lot of girls I can do with (uh)
But I can't without you
I knew him forever in a minute (hey)
That summer night in June
And papa says he got malo in him (uh)
He got me feelin' like...

[Pre-Chorus: Camila Cabello & Pharrell Williams]
Ooh, ooh-ooh-ooh-ooh-ooh-ooh-ooh (ayy)
I knew it when I met him (ayy), I loved him when I left him
Got me feelin' like, ooh, ooh-ooh-ooh-ooh-ooh-ooh-ooh
And then I had to tell him, I had to go
Oh na-na-na-na-na (woo)

[Chorus: Camila Cabello & Pharrell Williams]
Havana, ooh na-na (ayy, ayy)
Half of my heart is in Havana, ooh na-na (ayy, ayy)
He took me back to East Atlanta, na-na-na (uh huh)
Oh, but my heart is in Havana (ayy)
My heart is in Havana (ayy)
Havana, ooh na-na

[Verse 2: Young Thug]
Jeffery, just graduated, fresh on campus, mmm
Fresh out East Atlanta with no manners, damn (fresh out East Atlanta)
Bump on her bumper like a traffic jam
Hey, I was quick to pay that girl like Uncle Sam (here you go, ayy)
Back it on me
Shawty cravin' on me, get to eatin' on me (on me)
She waited on me (then what?)
Shawty cakin' on me, got the bacon on me (wait up)
This is history in the makin', on me (on me)
Point blank, close range, that B
If it cost a million, that's me (that's me)
I was gettin' mula, baby

[Chorus: Camila Cabello & Pharrell Williams]
Havana, ooh na-na (ayy, ayy)
Half of my heart is in Havana, ooh na-na (oh, ayy, ayy)
He took me back (uh huh) to East Atlanta, na-na-na (oh, no)
Oh, but my heart is in Havana (ayy)
My heart is in Havana (ayy)
Havana, ooh na-na

[Bridge: Starrah & Camila Cabello]
Ooh na-na, oh, na-na-na (ooh, ooh-ooh-ooh-ooh-ooh-ooh)
Take me back, back, back like...
Ooh na-na, oh, na-na-na (yeah, babe)
Take me back, back, back like...
Ooh na-na, oh, na-na-na (yeah, yeah)
Take me back, back, back like...
Ooh na-na, oh, na-na-na (yeah, babe)
Take me back, back, back
Hey, hey...
Ooh, ooh-ooh-ooh-ooh-ooh-ooh-ooh (hey)
Ooh, ooh-ooh-ooh-ooh-ooh-ooh-ooh (hey)
Take me back to my Havana...

[Chorus: Camila Cabello & Pharrell Williams]
Havana, ooh na-na (hey)
Half of my heart is in Havana, ooh na-na (oh, yeah)
He took me back to East Atlanta, (ayy, ayy) na-na-na
Oh, but my heart is in Havana
My heart is in Havana (ayy)
Havana, ooh na-na

[Outro: Starrah, Camila Cabello & Pharrell Williams]
Uh huh
Oh, na-na-na (oh, na, yeah)
Oh, na-na-na
Oh, na-na-na (no, no, no, take me back)
Oh, na-na-na
Havana, ooh na-na"
33,Something Just Like This,The Chainsmokers & Coldplay,Pop,"[Verse 1: Chris Martin]
I've been reading books of old
The legends and the myths
Achilles and his gold
Hercules and his gifts
Spiderman's control
And Batman with his fists
And clearly I don't see myself upon that list

[Pre-Chorus: Chris Martin]
But she said, where'd you wanna go?
How much you wanna risk?
I'm not looking for somebody
With some superhuman gifts
Some superhero
Some fairytale bliss
Just something I can turn to
Somebody I can kiss

[Bridge: Chris Martin]
I want something just like this
Doo-doo-doo, doo-doo-doo
Doo-doo-doo, doo-doo
Doo-doo-doo, doo-doo-doo
Oh, I want something just like this
Doo-doo-doo, doo-doo-doo
Doo-doo-doo, doo-doo
Doo-doo-doo, doo-doo-doo

[Chorus: Chris Martin]
Oh, I want something just like this
I want something just like this

[Verse 2: Chris Martin]
I've been reading books of old
The legends and the myths
The testaments they told
The moon and its eclipse
And Superman unrolls
A suit before he lifts
But I'm not the kind of person that it fits

[Pre-Chorus: Chris Martin]
She said, where'd you wanna go?
How much you wanna risk?
I'm not looking for somebody
With some superhuman gifts
Some superhero
Some fairytale bliss
Just something I can turn to
Somebody I can miss

[Chorus: Chris Martin]
I want something just like this
I want something just like this

[Bridge: Chris Martin]
Oh, I want something just like this
Doo-doo-doo, doo-doo-doo
Doo-doo-doo, doo-doo
Doo-doo-doo, doo-doo-doo
Oh, I want something just like this
Doo-doo-doo, doo-doo-doo
Doo-doo-doo, doo-doo
Doo-doo-doo, doo-doo-doo

[Pre-Chorus: Chris Martin]
Where'd you wanna go?
How much you wanna risk?
I'm not looking for somebody
With some superhuman gifts
Some superhero
Some fairytale bliss
Just something I can turn to
Somebody I can kiss
I want something just like this

[Chorus: Chris Martin]
Oh, I want something just like this
Oh, I want something just like this
Oh, I want something just like this"
34,Issues,Julia Michaels,Pop,"[Verse 1]
I'm jealous, I'm overzealous
When I'm down I get real down
When I'm high I don't come down
But I get angry, baby, believe me
I could love you just like that
And I can leave you just as fast

[Pre-Chorus 1]
But you don't judge me
'Cause if you did, baby, I would judge you too
No, you don't judge me
'Cause if you did, baby, I would judge you too

[Chorus]
'Cause I got issues, but you got 'em too
So give 'em all to me and I'll give mine to you
Bask in the glory, of all our problems
'Cause we got the kind of love it takes to solve 'em
Yeah, I got issues
And one of them is how bad I need you

[Verse 2]
You do shit on purpose
You get mad and you break things
Feel bad, try to fix things
But you're perfect, poorly wired circuit
And got hands like an ocean
Push you out, pull you back in

[Pre-Chorus 2]
'Cause you don't judge me
'Cause if you did, baby, I would judge you too
No, you don't judge me
'Cause you see it from the same point of view

[Chorus]
'Cause I got issues, but you got 'em too
So give 'em all to me and I'll give mine to you
Bask in the glory, of all our problems
'Cause we got the kind of love it takes to solve 'em
Yeah, I got issues
And one of them is how bad I need you

[Bridge]
I got issues, you got 'em too
And one of them is how bad I need you
I got issues, you got 'em too

[Chorus]
'Cause I got issues, but you got 'em too
So give 'em all to me and I'll give mine to you
Bask in the glory, of all our problems
'Cause we got the kind of love it takes to solve 'em
Yeah, I got issues (I got)
And one of them is how bad I need you (You got 'em too)
Yeah, I got issues (I got issues)
And one of them is how bad I need you (You got 'em too)
Yeah, I got issues (I got)
And one of them is how bad I need you"
35,Partition,Beyoncé,Pop,"[Produced by Timbaland, Jerome Harmon, Justin Timberlake, Beyoncé Knowles, Key Wane, Mike Dean and BOOTS]

Part 1: Yoncé

[Intro]
Let me hear you say ""Hey, Ms. Carter!"" (Hey, Ms. Carter!)
Say, ""Hey, Ms. Carter!"" (Hey, Ms. Carter!)
Give me some!

[Verse 1]
See me up in the club with fifty-eleven girls
Posted in the back, diamond fangs in my grill
Brooklyn brim with my eyes sitting low
Every boy in here with me got that smoke
Every girl in here got to look me up and down
All on Instagram, cake by the pound
Circulate the image every time I come around
G's up, tell me how I'm looking babe

[Bridge]
Boy this all for you just walk my way
Just tell me how it's looking babe
Just tell me how it's looking babe
(How it's looking babe)
I do this all for you baby just take aim
And tell me how it's looking babe
(How it's looking babe)
Tell me how it's looking babe, looking babe

[Verse 2]
Drop the bass, mane, the bass get lower
Radio say ""speed it up"", I just go slower
High like treble, pumping on the mids
Ya man ain't ever seen a booty like this
And why you think ya keep my name rolling off the tongue
Cuz when he wanna smash I'll just write another one
I sneezed on the beat and the beat got sicker
Yoncé all on his mouth like liquor
Yoncé all on his mouth like liquor
Yoncé all on his mouth like liquor
Yoncé all on his mouth like liquor
Like like liquor, like like like liquor
Yoncé all on his mouth like liquor
Yoncé all on his mouth like liquor
Yoncé all on his mouth like liquor
Like like liquor, like like like liquor"
36,City of Stars,Ryan Gosling,Pop,"[Sebastian's Verse: Ryan Gosling & Emma Stone]
City of stars
Are you shining just for me?
City of stars
There's so much that I can't see
Who knows?
I felt it from the first embrace I shared with you
That now our dreams
They've finally come true

[Mia's Verse: Emma Stone & Ryan Gosling]
City of stars
Just one thing everybody wants
There in the bars
And through the smokescreen of the crowded restaurants
It's love
Yes, all we're looking for is love from someone else
A rush
A glance
A touch
A dance

[Duet: Ryan Gosling & Emma Stone]
A look in somebody's eyes
To light up the skies
To open the world and send it reeling
A voice that says, I'll be here
And you'll be alright

I don't care if I know
Just where I will go
'Cause all that I need is this crazy feeling
A rat-tat-tat on my heart

[Outro: Ryan Gosling & Emma Stone]
Think I want it to stay
City of stars
Are you shining just for me?
City of stars
You never shined so brightly"
37,Wild Thoughts,DJ Khaled,Pop,"[Intro: DJ Khaled]
Another one
We The Best music
DJ Khaled

[Verse 1: Rihanna]
I don't know if you could take it
Know you wanna see me nakey, nakey, naked
I wanna be your baby, baby, baby
Spinning and it's wet just like it came from Maytag
White girl wasted on that brown liquor
When I get like this I can't be around you
I'm too lit to dim down a notch
'Cause I could name some thangs that I'm gon' do

[Chorus: Rihanna]
Wild, wild, wild
Wild, wild, wild thoughts
Wild, wild, wild
When I'm with you, all I get is wild thoughts
Wild, wild, wild
When I'm with you, all I get is wild thoughts

[Interlude: DJ Khaled]
Let's go!

[Verse 2: Rihanna]
I hope you know I'm for the takin'
You know this cookie is for the baking (ugh)
Kitty, kitty, baby give that thing some rest
'Cause you done beat it like the '68 Jets
Diamonds ain't nothing when I'm rockin' with ya
Diamonds ain't nothing when I'm shinin' with ya
Just keep it white and black as if I'm ya sista
I'm too hip to hop around town out here with ya
I know I get

[Chorus: Rihanna]
Wild, wild, wild
Wild, wild, wild thoughts
Wild, wild, wild
When I'm with you, all I get is wild thoughts
Wild, wild, wild
When I'm with you, all I get is wild thoughts

[Verse 3: Bryson Tiller]
Ayy, I heard that pussy for the taking
I heard it got these other niggas goin' crazy
Yeah I treat you like a lady, lady
Fuck you 'til you're burned out, cremation
Make it cream, yeah, Wu-Tang
Throw that ass back, bouquet
Call me and I can get it juicy
I can tell you're gone off the D'USSÉ
Careful mama watch what you say
You talking to me like ya new bae
Girl, talking like you tryna do things
Now that pipe got her running like she Usain, baby
You made me drown in it, touche, baby
I'm carrying that water, Bobby Boucher, baby
You know I'ma slaughter like I'm Jason
Bust it, why you got it on safety?
White girl wasted on brown liquor
I probably shouldn't be around you
'Cause you get wild, wild, wild
You looking like there's nothing that you won't do
Ayy, girl that's when I told you

[Chorus: Rihanna]
When I'm with you, all I get is wild thoughts
Wild, wild, wild
Wild, wild, wild thoughts
Wild, wild, wild
When I'm with you, all I get is wild thoughts
Wild, wild, wild
When I'm with you, all I get is wild thoughts

[Outro: DJ Khaled & Rihanna]
DJ Khaled!
Wild, wild, wild
Wild, wild, wild
When I'm with you, all I get is wild thoughts"
38,River,Eminem,Pop,"[Chorus: Ed Sheeran]
I've been a liar, been a thief
Been a lover, been a cheat
All my sins need holy water, feel it washing over me
Well, little one, I don't want to admit to something
If all it's gonna cause is pain
Truth and my lies right now are falling like the rain
So let the river run

[Verse 1: Eminem]
He's comin' home with his neck scratched, to catch flack
Sweat jackets and dress slacks, mismatched
On his breath's Jack, he's a sex addict
And she just wants to exact revenge and get back
It's a chess match, she's on his back like a jet-pack
She's kept track of all his Internet chats
And guess who just happens to be movin' on to the next
Actually, just shit on my last chick and she has what my ex lacks
'Cause she loves danger, psychopath
And you don't fuck with no man's girl, even I know that
But she's devised some plan to stab him in the back
Knife in hand, says their relationship's hangin' by a strand
So she's been on the web lately
Says maybe she'll be my Gwen Stacy, to spite her man
And I know she's using me to try to play him, I don't care
Hi Suzanne, but I shoulda said ""Bye Suzanne""
After the first night, but tonight I am

[Chorus: Ed Sheeran]
I've been a liar, been a thief
Been a lover, been a cheat
All my sins need holy water, feel it washing over me
Well, little one, I don't want to admit to something
If all it's gonna cause is pain
The truth and my lies now are falling like the rain
So let the river run

[Verse 2: Eminem]
A one-night stand turned a two-night stand
It was ""come sunlight, scram,"" now we hug tight, and...
He found out, now she feels deserted and used
'Cause he left, so what? He did it first to her too
Now how am I supposed to tell this girl that we're through?
It's hard to find the words, I'm aloof, nervous, and Sue
Don't want this to hurt, but what you deserve is the truth
Don't take it personal, I just can't say this in person to you
So I revert to the studio, like hole-in-the-wall diners
Don't have to be reserved in a booth
I just feel like the person who I'm turning into's
Irreversible, I preyed on you like it's church at the pew
And now that I got you I don't want you
Took advantage in my thirst to pursue
Why do I do this dirt that I do?
Get on my soapbox and preach, my sermon and speech
Detergent and bleach is burnin' the wound
'Cause now with her in the womb
We can't bring her in this world, shoulda knew
To use protection 'fore I bit into your forbidden fruit
Fuck!

[Chorus: Ed Sheeran]
I've been a liar, been a thief
Been a lover, been a cheat
All my sins need holy water, feel it washing over me
Well, little one, I don't want to admit to something
If all it's gonna cause is pain
The truth and my lies now are falling like the rain
So let the river run

[Bridge: Eminem & Ed Sheeran]
My name's (ooh), my name's (ooh)
River (ooh), river run
Call me (ooh), call me (ooh)
River (ooh), we'll let the river run

[Verse 3: Eminem]
Always the bridesmaid, never ""The bride, hey!""
Fuck can I say? If life was a highway
And deceit was an enclave, I'd be swerving in five lanes
Speeds at a high rate, like I'm slidin' on ice, maybe
That's why I may have came at you sideways
I can't keep my lies straight
But I made you terminate my baby
This love triangle left us in a wreck, tangled
What else can I say? It was fun for a while
Bet I really woulda loved your smile
Didn't really wanna abort, but fuck it
What's one more lie, to tell our unborn child?

[Chorus: Ed Sheeran & Eminem]
I've been a liar, been a thief
Been a lover, been a cheat
All my sins need holy water, feel it washing over me
Well, little one (I'm sorry)
I don't want to admit to something (I fucked up)
If all it's gonna cause is pain
The truth and my lies now are falling like the rain
So let the river run"
39,A Million Dreams,Ziv Zaifman,Pop,"[YOUNG P.T.]
I close my eyes and I can see
The world that's waiting up for me
That I call my own
Through the dark, through the door
Through where no one's been before
But it feels like home

They can say, they can say it all sounds crazy
They can say, they can say I've lost my mind
I don't care, I don't care, so call me crazy
We can live in a world that we design

'Cause every night I lie in bed
The brightest colors fill my head
A million dreams are keeping me awake
I think of what the world could be
A vision of the one I see
A million dreams is all it's gonna take
A million dreams for the world we're gonna make

There's a house we can build
Every room inside is filled
With things from far away
The special things I compile
Each one there to make you smile
On a rainy day

They can say, they can say it all sounds crazy
They can say, they can say we've lost our minds
I don't care, I don't care if they call us crazy
Runaway to a world that we design

[P.T. BARNUM]
Every night I lie  in bed
The brightest colors fill my head
A million dreams are keeping me awake
I think of what the world could be
A vision of the one I see
A million dreams is all it's gonna take
A million dreams for the world we're gonna make

[CHARITY BARNUM, with P.T. BARNUM]
However big, however small
Let me be part of it all
Share your dreams with me
You may be right, you may be wrong
But say that you'll bring me along
To the world you see
To the world I close my eyes to see
I close my eyes to see

Every night I lie in bed
The brightest colors fill my head
A million dreams are keeping me awake
A million dreams, a million dreams
I think of what the world could be
A vision of the one I see
A million dreams is all it's gonna take
A million dreams for the world we're gonna make

For the world we're gonna make"
