,Song_Name,Artist,Genre,Lyrics
80,All Too Well,Taylor Swift,country,"[Verse 1]
I walked through the door with you, the air was cold
But something 'bout it felt like home somehow and I
Left my scarf there at your sister's house
And you've still got it in your drawer, even now
Oh, your sweet disposition
And my wide-eyed gaze
We're singing in a car getting lost Upstate
The autumn leaves falling down like pieces into place
And I can picture it after all these days

[Pre-Chorus]
And I know it's long gone, and that magic's not here no more
And I might be okay, but I'm not fine at all

[Chorus]
'Cause there we are again on that little town street
You almost ran the red 'cause you were looking over at me
Wind in my hair, I was there, I remember it all too well

[Verse 2]
Photo album on the counter
Your cheeks were turning red
You used to be a little kid with glasses in a twin-sized bed
And your mother's telling stories 'bout you on the tee ball team
You taught me about your past thinking your future was me

[Pre-Chorus]
And I know it's long gone, and there was nothing else I could do
And I forget about you long enough to forget why I needed to

[Chorus]
'Cause there we are again in the middle of the night
We're dancing round the kitchen in the refrigerator light
Down the stairs, I was there, I remember it all too well, yeah

[Bridge]
And maybe we got lost in translation
Maybe I asked for too much
But maybe this thing was a masterpiece
'Till you tore it all up
Running scared, I was there, I remember it all too well
And you call me up again just to break me like a promise
So casually cruel in the name of being honest
I'm a crumpled up piece of paper lying here
'Cause I remember it all, all, all... too well

[Verse 3]
Time won't fly it's like I'm paralyzed by it
I'd like to be my old self again
But I'm still trying to find it
After plaid shirt days and nights when you made me your own
Now you mail back my things and I walk home alone
But you keep my old scarf from that very first week
'Cause it reminds you of innocence and it smells like me
You can't get rid of it, 'cause you remember it all too well, yeah

[Chorus]
Because there we are again when I loved you so
Back before you lost the one real thing you've ever known
It was rare, I was there, I remember it all too well

[Outro]
Wind in my hair, you were there, you remember it all
Down the stairs, you were there, you remember it all
It was rare, I was there, I remember it all too well"
81,Die Tonight,Adam Calhoun,country,"[Chorus: Upchurch]
I might die tonight, but if I do Imma be okay
And if I die tonight, at least I stood by the stuff I said
I got two graves dug, one for me and one for the motha fucker standing in my way
And if I die tonight, at least I can say I never ran away!

[Verse 1: Upchurch]
Six foot deep, deep deep in the cut
Shovel and a tarp rolled up in the truck
Couple old bikers and they know whats up
Spin my iTunes, shake em, I'm getting people roughed up
And a child molester might end up in the mud
Bones in the shit of a couple wild boars
Teeth buried in the lot of a little white church
I be somewhere dog GPS don’t work
When the cops all do things a little bit dirty
But they stay on my team, I got that baby face money
Ya’ll can buy all that jewelry, I’ll invest in my community
When we both go into the ground, fill it up with plenty shiny things
I got brass for days, pitbulls with teeth so razor sharp you’d think
My females slept with a great white shark
I ain’t tryna brag but my A-Team too big
Some crazy mother fuckers on that 1900’s shit
It’s time for a change, ya I came with some buddies
Who don’t mind getting muddy and bloody and standing for something
And putting some sense into this corrupt country
Go ahead big dog come over here and say something

[Chorus: Upchurch]
I might die tonight, but if I do Imma be okay
And if I die tonight, at least I stood by the stuff I said
I got two graves dug, one for me and one for the motha fucker standing in my way
And if I die tonight, at least I can say I never ran away!

[Verse 2: Adam Calhoun]
You can get it, Imma fight until the death of me
I ain’t never been on the run from an enemy
Heavily armed to the teeth, got an army with me
And I’m ready to die if you threaten me
AK’s, AR’s, you ain’t who you say you are
Bullets start flying, putting ghosts in the graveyard
Full moon lighting up the battlefield
Battle to my last breath and my blood splatter here
Just breathe a minute
Just think a minute
You don’t wanna go to war
Or we could get it, yeah we could bring it right to your front door
I don’t think you wanna go that route
I ain’t known to fuck around, fuck around
Imma throw a hundred rounds
Put your cold body in the fuckin' ground
Get the point bitch, when I hit you with the hollow round
What the fuck you talkin' bout
I don’t wanna talk about it
Leave your body right there layin' with some chalk around it
Why I gotta go so hard
Why you so fuckin' soft
Call your man runnin' bitch, you already fuckin' lost

[Chorus: Upchurch]
I might die tonight, but if I do Imma be okay
And if I die tonight, at least I stood by the stuff I said
I got two graves dug, one for me and one for the motha fucker standing in my way
And if I die tonight, at least I can say I never ran away!"
82,You've Got A Friend,James Taylor,country,"[Verse 1]
When you're down and troubled and you need a helping hand
And nothing, whoa, nothing is going right
Close your eyes and think of me and soon I will be there
To brighten up even your darkest nights

[Chorus]
You just call out my name
And you know where ever I am
I'll come running to see you again
Winter, spring, summer, or fall
All you have to do is call
And I'll be there, yeah, yeah
You've got a friend

[Verse 2]
If the sky above you should turn dark and full of clouds
And that old north wind should begin to blow
Keep your head together and call my name out loud
Soon I will be knocking upon your door

[Chorus]

[Bridge]
Hey, isn't it good to know that you've got a friend?
People can be so cold
They'll hurt you and desert you
Well, they'll take your soul if you let them
Oh yeah, but don't you let them

[Chorus]"
83,I Wanna Go Home (Texas Song),Sandy Cheeks,country,"[Verse 1]
Wish I was back in Texas
The ocean's no place for a squirrel
Wish I was in Texas
Prettiest place in the world, oh no

[Pre-Chorus 1]
I guess deep in my heart I'll always be a Texas girl

[Chorus]
I wanna go home, home, home, oh
Yoldle ay e oh, yodle ay e oh, yodle ay e oh, a lay-ee, a lay-ee

[Verse 2]
I wanna wake up in Texas
I miss those wide open skies
I miss my 20 acres, bar-b-ques
And pecan pies, oh why?

[Pre-Chorus 2]
When I'm so far from you, Texas, all I can do-o is cry

[Chorus & Outro]
I wanna go ho-oome
Ho-oome
I wanna go ho-ome!"
84,Parallel Line,Keith Urban,country,"[Verse 1]
You said ""I love you"" to me
And I don't know what that means
So frozen my feet
People use it too carelessly
And I couldn’t believe
That you would dive in so deep
And you said perfectly
Everything I’ve been feeling about you
It’s time to break the chains that held me back from you

[Chorus]
So come on and
Take a little bit of my
Heart tonight
No, I literally don't mind
Just please don't misplace it
Take a little bit of my
Heart tonight
No, baby be mine now
Baby, be mine now
Maybe it’s time we put our hearts in a parallel line

[Verse 2]
Well I was never the type
To put it all on the line
But I've been changing my mind since you opened my eyes
It was the way that the light
Picked you out of that night
Then you were right by my side
Put a soul in my body
And now it’s time to close the space between the two of us

[Chorus]
So come on and
Take a little bit of my
Heart tonight
No, I literally don't mind
Just please don't misplace it
Take a little bit of my
Heart tonight
No, baby be mine now
Baby, be mine now
Maybe it’s time we put our hearts in a parallel line

[Bridge]
Oh, baby it's time
Oh, it's time

[Chorus]
Take a little bit of my
Heart tonight
No, I literally don't mind
Just please don't misplace it
Take a little bit of my
Heart tonight
No, baby be mine now
Baby, be mine now
Take a little bit of my
Heart tonight
No, I literally don't mind
Just please don't misplace it
Take a little bit of my
Heart tonight
No, baby be mine now
Baby, be mine now

[Outro]
Maybe it’s time we put our hearts in a parallel line
And put our hearts in a parallel line
And put our hearts in a parallel line"
85,Drinkin' Problem,Midland,country,"[Verse 1]
One more night, one more down
One more, one more round
First one in, last one out
Giving this town lots to talk about
They don't know what they don't know

[Chorus]
People say I got a drinkin' problem
That ain't no reason to stop
People saying that I've hit rock bottom
Just cause I'm living on the rocks
It's a broken hearted thinkin' problem
So pull another bottle off the wall
People say I got a drinkin' problem
But I got no problem drinkin' at all

[Post-Chorus]
They keep on talking
Drawing conclusions
They call it a problem, I call it a solution

[Verse 2]
Last call gets later and later
I come in here so I don't have to hate her
Same old folks, same old songs
The same old same old blue neon
The same old buzz, just because

[Chorus]
People say I've got a drinkin' problem
That ain't no reason to stop
People saying that I've hit rock bottom
Just cause I'm living on the rocks
It's a broken hearted thinkin' problem
So pull another bottle off the wall
People say I got a drinkin' problem
But I got no problem drinkin' at all

[Post-Chorus 2]
They keep on talking
Drawing conclusions
They call it a problem, I call it a solution
Just sitting here in all my grand illusions
They call it a problem, I call it a solution

[Bridge]
Just a solution

[Chorus]
It's a broken hearted thinkin' problem
So pull another bottle off the wall
People say I got a drinkin' problem
But I got no problem drinkin' at all

[Post-Chorus 2]
They keep on talking
Drawing conclusions
They call it a problem, I call it a solution
Sitting here in all my grand illusions
They call it a problem, I call it a solution"
86,Whiskey in the Jar,The Dubliners,country,"As I was a goin' over the far famed Kerry mountains
I met with Captain Farrell and his money he was counting
I first produced my pistol and I then produced my rapier
Saying ""stand and deliver"" for he were a bold deceiver

Mush-a ring dum-a do dum-a da
Whack for my daddy-o
Whack for my daddy-o
There's whiskey in the jar

I counted out his money and it made a pretty penny
I put it in me pocket and I took it home to Jenny
She sighed and she swore that she never would deceive me
But the devil take the women for they never can be easy

Mush-a ring dum-a do dum-a da
Whack for my daddy-o
Whack for my daddy-o
There's whiskey in the jar

I went up to my chamber, all for to take a slumber
I dreamt of gold and jewels and for sure 't was no wonder
But Jenny drew me charges and she filled them up with water
Then sent for captain Farrell to be ready for the slaughter

Mush-a ring dum-a do dum-a da
Whack for my daddy-o
Whack for my daddy-o
There's whiskey in the jar

'Twas was early in the morning, just before I rose to travel
Up comes a band of footmen and likewise captain Farrell
I first produced me pistol for she stole away me rapier
I couldn't shoot the water, so a prisoner I was taken

Mush-a ring dum-a do dum-a da
Whack for my daddy-o
Whack for my daddy-o
There's whiskey in the jar

Now there's some take delight in the carriages a-rollin'
And others take delight in the hurling and the bowling
But I take delight in the juice of the barley
And courting pretty fair maids in the morning bright and early

Mush-a ring dum-a do dum-a da
Whack for my daddy-o
Whack for my daddy-o
There's whiskey in the jar

If anyone can aid me 't is my brother in the army
If I can find his station in Cork or in Killarney
And if he'll go with me, we'll go rovin' through Killkenny
And I'm sure he'll treat me better than my own a-sporting Jenny

Mush-a ring dum-a do dum-a da
Whack for my daddy-o
Whack for my daddy-o
There's whiskey in the jar"
87,Barrett's Privateers,Stan Rogers,country,"Oh, the year was 1778
How I wish I was in Sherbrooke now
A letter of marque came from the king
To the scummiest vessel I've ever seen
God damn them all! I was told
We'd cruise the seas for American gold
We'd fire no guns, shed no tears
But I'm a broken man on a Halifax pier
The last of Barrett's Privateers

Oh, Elcid Barrett cried the town
How I wish I was in Sherbrooke now
For twenty brave men all fishermen who
Would make for him the Antelope's crew
God damn them all! I was told
We'd cruise the seas for American gold
We'd fire no guns, shed no tears
But I'm a broken man on a Halifax pier
The last of Barrett's Privateers

The Antelope sloop was a sickening sight
How I wish I was in Sherbrooke now
She'd a list to the port and her sails in rags
And the cook in the scuppers with the staggers and jags
God damn them all! I was told
We'd cruise the seas for American gold
We'd fire no guns, shed no tears
But I'm a broken man on a Halifax pier
The last of Barrett's Privateers

On the King's birthday we put to sea
How I wish I was in Sherbrooke now
We were 91 days to Montego Bay
Pumping like madmen all the way
God damn them all! I was told
We'd cruise the seas for American gold
We'd fire no guns, shed no tears
But I'm a broken man on a Halifax pier
The last of Barrett's Privateers

On the 96th day we sailed again
How I wish I was in Sherbrooke now
When a bloody great Yankee hove in sight
With our cracked four pounders we made to fight
God damn them all! I was told
We'd cruise the seas for American gold
We'd fire no guns, shed no tears
But I'm a broken man on a Halifax pier
The last of Barrett's Privateers

Now the Yankee lay low down with gold
How I wish I was in Sherbrooke now
She was broad and fat and loose in the stays
But to catch her took the Antelope two whole days
God damn them all! I was told
We'd cruise the seas for American gold
We'd fire no guns, shed no tears
But I'm a broken man on a Halifax pier
The last of Barrett's Privateers

Then at length we stood two cables away
How I wish I was in Sherbrooke now
Our cracked four pounders made an awful din
But with one fat ball, the Yank stove us in
God damn them all! I was told
We'd cruise the seas for American gold
We'd fire no guns, shed no tears
But I'm a broken man on a Halifax pier
The last of Barrett's Privateers

The Antelope shook and pitched on her side
How I wish I was in Sherbrooke now
Barrett was smashed like a bowl of eggs
And the Main truck carried off both me legs
God damn them all! I was told
We'd cruise the seas for American gold
We'd fire no guns, shed no tears
But I'm a broken man on a Halifax pier
The last of Barrett's Privateers

So here I lay in my 23rd year
How I wish I was in Sherbrooke now
It's been 6 years since we sailed away
And I just made Halifax yesterday
God damn them all! I was told
We'd cruise the seas for American gold
We'd fire no guns, shed no tears
But I'm a broken man on a Halifax pier
The last of Barrett's Privateers"
88,22,Taylor Swift,country,"[Verse 1]
It feels like a perfect night to dress up like hipsters
And make fun of our exes, uh uh, uh uh
It feels like a perfect night for breakfast at midnight
To fall in love with strangers, uh uh, uh uht

[Pre-Chorus]
Yeah
We're happy, free, confused, and lonely at the same time
It's miserable and magical, oh yeah
Tonight's the night when we forget about the deadlines
It's time, uh uh

[Chorus]
I don't know about you, but I'm feeling 22
Everything will be alright if you keep me next to you
You don't know about me, but I bet you wanted to
Everything will be alright if we just keep dancing like we're 22
22

[Verse 2]
It seems like one of those nights
This place is too crowded, too many cool kids, uh uh, uh uh
(Who's Taylor Swift, anyway? Ew)
It seems like one of those nights
We ditch the whole scene and end up dreaming
Instead of sleeping

[Pre-Chorus]
Yeah
We're happy, free, confused, and lonely in the best way
It's miserable and magical, oh yeah
Tonight's the night when we forget about
The heartbreaks, it's time
Oh oh

[Chorus]
I don't know about you, but I'm feeling 22
Everything will be alright if you keep me next to you
You don't know about me, but I bet you wanted to
Everything will be alright if we just keep dancing like we're 22
22
I don't know about you
22, 22

[Bridge]
It feels like one of those nights
We ditch the whole scene
It feels like one of those nights
We won't be sleeping
It feels like one of those nights
You look like bad news, I gotta have you
I gotta have you

[Chorus]
I don't know about you, but I'm feeling 22
Everything will be alright if you keep me next to you
You don't know about me, but I bet you wanted to
Everything will be alright if we just keep dancing like we're 22
22
Dancing like 22, yeah, 22, yeah yeah

[Outro]
It feels like one of those nights
We ditch the whole scene
It feels like one of those nights
We won't be sleeping
It feels like one of those nights
You look like bad news, I gotta have you
I gotta have you"
89,Break Up in the End,Cole Swindell,country,"[Verse 1]
I still walk in that bar a little drunk
I still ask you what you're drinking, what's your name
I still kiss you by the shuffleboard, last call at 2am
Even though we break up in the end

[Verse 2]
I'll introduce you to my mom and dad
Say ""I think I love her"" when you leave that room
I'd still not take their advice when I say you're moving in
Even though we break up in the end

[Chorus]
Even if I knew you'd be the one that got away
I'd still go back and get you
Even if I knew you'd be my best and worst mistake
Oh, I'd still make it with you
Over and over, again and again
Even though we break up in the end

[Verse 3]
I'd still play my favorite song in your car
Let you love me to it, 'til it felt like ours
Now all I hear is you in it, but I'd still let you ruin it
Even though we break up in the end

[Chorus]
Even if I knew you'd be the one that got away
I'd still go back and get you
Even if I knew you'd be my best and worst mistake
Girl, I'd still make it with you
Over and over, again and again
Even though we break up in the end

[Outro]
You've just had one too many tonight
You're just calling 'cause you're lonely, that's okay
But you know if you come over, I can't not let you in
Even though we'll break up in the end
I'd do it over and over, again and again
Even though we break up in the end"
90,Stop Me from Falling,Kylie Minogue,country,"[Verse 1]
Somehow we've always been together
But never got together
I never felt the pressure 'til now
There's something in the air
I'm here and you're just there
I can't pretend that I don't care

[Pre-Chorus]
Yeah, one day I might get it right
Am I ready for tonight?
Yeah, caution, caution, amber lights
Still can't get you off my mind

[Chorus]
Don't know how, I don't know where
But we're becoming more than friends
Getting closer to the edge
Stop me from falling
Shoulda seen the warning sign
Now we're running out of time
Kinda wanna cross the line
Stop me from falling

[Post-Chorus]
For you
For you
Stop me from falling
For you
For you
Stop me from falling

[Verse 2]
One risk from lying on your shoulder
When I was feeling colder
And now I can't get over
One kiss, a dangerous situation
I'm lost in hesitation
My heart's a little shaken

[Pre-Chorus]
Yeah, one day I might get it right
Am I ready for tonight?
Yeah, caution, caution, amber lights
Still can't get you off my mind

[Chorus]
Don't know how, I don't know where
But we're becoming more than friends
Getting closer to the edge
Stop me from falling
Shoulda seen the warning sign
Now we're running out of time
Kinda wanna cross the line
Stop me from falling

[Post-Chorus]
For you
For you
Stop me from falling
For you
For you
Stop me from falling

[Chorus]
Don't know how, I don't know where
But we're becoming more than friends
Getting closer to the edge
Stop me from falling
Shoulda  seen the warning sign
Now we're running out of time
Kinda wanna cross the line
Stop me from falling

[Post-Chorus]
For you
For you
Stop me from falling
For you
For you
Stop me from falling"
91,I'll Wait for You,Jason Aldean,country,"[Verse 1]
These fields don't grow overnight, this town wasn't built in a day
I'll be turnin' that dirt when the sun comes up
Goin' round in circles while that plane you're on takes you away
Chasin' down that sun in L.A, 2000 miles it ain't that far
Girl, wherever you are

[Chorus]
I'll wait for you, I'll wait for you
Find your way back, I'll pray you do
I'll wait for you

The August rain, the break of dawn
Like anything worth countin' on
Comin' through, I'll wait for you

[Verse 2]
I'll keep the light on on the porch, I'll keep the key under the mat
Just in case I'm out there somewhere tryin' not to lose my mind
When you come back I know you gotta go
And if you don't girl you'll never know
And if you can't find what you want out there
I'll be right here, ain't goin' nowhere

[Chorus]
I'll wait for you, I'll wait for you
Find your way back, I'll pray you do
I'll wait for you

The August rain, the break of dawn
Like anything worth countin' on
Comin' through, I'll wait for you
Oh I'll wait for you

[Bridge]
These fields don't grow overnight
This town wasn't built in a day
Some things you love are worth the wait
Worth the wait

[Chorus]
I'll wait for you, I'll wait for you
Find your way back, I'll pray you do
I'll wait for you

The August rain, the break of dawn
Like anything worth countin' on
Comin' through, I'll wait for you

Oh I'll wait for you
I'll wait for you
Oh I'll wait for you
I'll wait for you"
92,Wagon Wheel,Darius Rucker,country,"[Verse 1]
Heading down south to the land of the pines
I'm thumbing my way into North Caroline
Staring up the road and pray to God I see headlights
I made it down the coast in seventeen hours
Picking me a bouquet of dogwood flowers
And I'm a-hoping for Raleigh, I can see my baby tonight

[Chorus]
So rock me mama like a wagon wheel
Rock me mama any way you feel
Hey mama rock me
Rock me mama like the wind and the rain
Rock me mama like a south bound train
Hey mama rock me

[Verse 2]
Running from the cold up in New England
I was born to be a fiddler in an old time string band
My baby plays a guitar, I pick a banjo now
Oh, north country winters keep a-getting me down
Lost my money playing poker so I had to leave town
But I ain't turning back to living that old life no more

[Chorus]
So rock me mama like a wagon wheel
Rock me mama any way you feel
Hey mama rock me
Rock me mama like the wind and the rain
Rock me mama like a south bound train
Hey mama rock me

[Verse 3]
Walking to the south out of Roanoke
I caught a trucker out of Philly had a nice long toke
But he's a heading west from the Cumberland gap
To Johnson City, Tennessee
And I got to get a move on before the sun
I hear my baby calling my name and I know that she's the only one
And if I die in Raleigh at least I will die free

[Chorus]
So rock me mama like a wagon wheel
Rock me mama any way you feel
Hey mama rock me
Oh rock me mama like the wind and the rain
Rock me mama like a south bound train
Hey hey mama rock me
So rock me mama like a wagon wheel
Rock me mama any way you feel
Hey hey mama rock me
Mama rock me
Mama rock me
Rock me mama like the wind and the rain
Rock me mama like a south bound train
Hey hey mama rock me
You can rock me
Rock me"
93,Better Man,Little Big Town,country,"[Verse 1]
I know I’m probably better off on my own
Than lovin' a man who didn’t know
What he had when he had it
And I see the permanent damage you did to me
Never again, I just wish I could forget when it was magic
I wish it wasn’t 4am, standing in the mirror
Saying to myself, you know you had to do it
I know the bravest thing I ever did was run

[Chorus]
Sometimes, in the middle of the night, I can feel you again
But I just miss you, and I just wish you were a better man
And I know why we had to say goodbye
Like the back of my hand
And I just miss you, and I just wish you were a better man
A better man

[Verse 2]
I know I’m probably better off all alone
Than needing a man who could change his mind
At any given minute
And it’s always on your terms
I’m hanging on every careless word
Hoping it might turn sweet again
Like it was in the beginning
But your jealousy, I can hear it now
You’re talking down to me like I’ll always be around
You push my love away like it’s some kind of loaded gun
Boy, you never thought I’d run

[Chorus]
Sometimes, in the middle of the night, I can feel you again
But I just miss you, and I just wish you were a better man
And I know why we had to say goodbye
Like the back of my hand
And I just miss you, and I just wish you were a better man
A better man
Better man

[Bridge]
I hold onto this pride because these days it’s all I have
And I gave you my best and we both know you can’t say that
You can’t say that
I wish you were a better man
I wonder what we would’ve become
If you were a better man
We might still be in love
If you were a better man
You would’ve been the one
If you were a better man
Yeah, yeah

[Chorus]
Sometimes, in the middle of the night, I can feel you again
But I just miss you, and I just wish you were a better man
And I know why we had to say goodbye
Like the back of my hand
And I just miss you and I just wish you were a better man
A better man
Better man

[Outro]
We might still be in love, if you were a better man
Better man"
