,Song_Name,Artist,Genre,Lyrics
34,In the Blood,John Mayer,country,"[Verse 1]
How much of my mother has my mother left in me?
How much of my love will be insane to some degree?
And what about this feeling that I'm never good enough?
Will it wash out in the water, or is it always in the blood?

[Verse 2]
How much of my father am I destined to become?
Will I dim the lights inside me just to satisfy someone?
Will I let this woman kill me, or do away with jealous love?
Will it wash out in the water, or is it always in the blood?

[Chorus]
I can feel the love I want
I can feel the love I need
But it's never gonna come the way I am
Could I change it if I wanted?
Can I rise above the flood?
Will it wash out in the water
Or is it always in the blood?

[Verse 3]
How much like my brothers do my brothers wanna be?
Does a broken home become another broken family?
Or will we be there for each other like nobody ever could?
Will it wash out in the water, or is it always in the blood?

[Chorus]
I can feel the love I want
I can feel the love I need
But it's never gonna come the way I am
Could I change it if I wanted?
Can I rise above the flood?
Will it wash out in the water
Or is it always in the blood?

[Chorus]
I can feel the love I want
I can feel the love I need
But it's never gonna come the way I am
Could I change it if I wanted?
Can I rise above the flood?
Will it wash out in the water
Or is it always in the blood?"
35,Blue Ain't Your Color,Keith Urban,country,"[Verse 1]
I can...
See you over there starin' at your drink
Watchin' that ice sink, all alone tonight
And...
Chances are you're sittin' here in this bar
'Cause he ain't gonna treat you right
Well, it's...
Probably not my place but I'm gonna say it anyway
‘Cause you look like
You...
Haven’t felt the fire, had a little fun
Hadn’t had a smile in a little while, baby

[Chorus]
Blue...
Looks good on the sky
Looks good on that neon buzzin’ on the wall
But darlin', it don’t match your eyes
I’m tellin’ you...
You don’t need that guy
It’s so black and white, he’s stealin’ your thunder
Baby, blue ain’t your color

[Verse 2]
I'm not tryna...
Be another just pick you up kinda guy
Tryna drink you up, tryna take you home
But I just...
I don't understand how another man
Can take your sun and turn it ice cold
Well, I've...
Had enough to drink and it's makin' me think
That I just might
Tell you...
If I were a painter I wouldn’t change ya
I’d just paint you bright, baby

[Chorus]
'Cause blue...
Looks good on the sky
Looks good on that neon buzzin’ on the wall
But darlin', it don’t match your eyes
I’m tellin’ you...
You don’t need that guy
It’s so black and white, he’s stealin’ your thunder
Baby, blue ain’t your color

[Bridge]
No, no, no
Mmmm
It ain't your color baby
Mmm, baby

[Chorus]
Blue...
Looks good on the sky
Looks good on that neon buzzin’ on the wall
But darlin', it don’t match your eyes
I’m tellin’ you...
You don’t need that guy
It’s so black and white, he’s stealin’ your thunder
Baby, blue ain’t your color
Blue ain’t your color

[Outro]
Mmm, no, no, no baby
Come here, baby
Let me light up your world"
36,Humble and Kind,Tim McGraw,country,"[Verse 1]
You know there's a light that glows by the front door
Don't forget the keys under the mat
When childhood stars shine, always stay humble and kind
Go to church 'cause your momma says to
Visit grandpa every chance that you can
It won't be wasted time
Always stay humble and kind

[Chorus]
Hold the door, say please, say thank you
Don't steal, don't cheat, and don't lie
I know you got mountains to climb but
Always stay humble and kind
When the dreams you're dreamin' come to you
When the work you put in is realized
Let yourself feel the pride but
Always stay humble and kind

[Verse 2]
Don't expect a free ride from no one
Don't hold a grudge or a chip and here's why
Bitterness keeps you from flying
Always stay humble and kind
Know the difference with sleeping with someone
And sleeping with someone you love
""I love you"" ain't no pickup line, so
Always stay humble and kind

[Chorus]
Hold the door, say please, say thank you
Don't steal, don't cheat, and don't lie
I know you got mountains to climb but
Always stay humble and kind
When the dreams you're dreamin' come to you
When the work you put in is realized
Let yourself feel the pride but
Always stay humble and kind

[Outro]
When it's hot, eat a root beer popsicle
Shut off the AC and roll the windows down
Let that summer sun shine
Always stay humble and kind
Don't take for granted the love this life gives you
When you get where you're goin'
Don't forget turn back around
And help the next one in line
Always stay humble and kind"
37,"Take Me Home, Country Roads",John Denver,country,"Almost heaven, West Virginia
Blue ridge mountains, Shenandoah river
Life is old there, older than the trees
Younger than the mountains, blowing like a breeze

Country roads, take me home
To the place I belong
West Virginia, mountain mamma
Take me home, country roads

All my memories, gather round her
Miners' lady, stranger to blue water
Dark and dusty, painted on the sky
Misty taste of moonshine, teardrop in my eye

Country roads, take me home
To the place I belong
West Virginia, mountain mamma
Take me home, to the country roads

I hear her voice in the morning hour she calls me
Radio reminds me of my home far away
Driving down the road I get a feeling
That I should have been home yesterday, yesterday

Country roads, take me home
To the place I belong
West Virginia, mountain mamma
Take me home, country roads

Country roads, take me home
To the place I belong
West Virginia, mountain mamma
Take me home, to the country roads

Take me home, that country road
Take me home, that country road"
38,Fire Away,Chris Stapleton,country,"[Verse 1]
Honey load up your questions
And pick up your sticks and your stones
And pretend I’m a shelter
For heartaches that don’t have a home

[Pre-Chorus 1]
And choose the words that cut like a razor
And all that I’ll say, is...

[Chorus]
Fire away
Take your best shot
Show me what you got
Honey, I’m not afraid
Rear back and take aim
And fire away

[Verse 2]
Well, I wish I could say
That I’ve never been here before
But you know and I know
That I’ll always come back for more

[Pre-Chorus 2]
Your love might be my damnation
But I’ll cry to my grave

[Chorus]
Fire away
Take your best shot
Show me what you got
Honey, I’m not afraid
Rear back and take aim
And fire away

[Outro]
Fire away
Take your best shot
Show me what you got
Honey, I’m not afraid
Rear back and take aim
And fire away
Fire away
Fire away
Fire away"
39,Joanne,Lady Gaga,country,"[Verse 1]
Take my hand, stay Joanne
Heaven's not
Ready for you
Every part
Of my aching heart
Needs you more
Than the angels do

[Chorus]
Girl
Where do you think you're goin'?
Where do you think you're goin'
Goin', girl?
Girl
Where do you think you're goin'?
Where do you think you're goin'
Goin', girl?

[Verse 2]
If you could
I know that you'd stay
We both know
Things don't work that way
I promised I
Wouldn't say goodbye
So I grin
And my voice gets thin

[Chorus]
Girl
Where do you think you're goin'?
Where do you think you're goin'
Goin', girl?
Girl
Where do you think you're goin'?
Where do you think you're goin'
Goin', girl?

[Bridge]
Honestly, I know where you're goin'
And baby, you're just movin' on
And I'll still love you even if I can't
See you anymore
Can't wait to see you soar

[Chorus]
Girl
Where do you think you're goin'?
Where do you think you're goin'
Goin', girl?
Girl
Where do you think you're goin'?
Where do you think you're goin'
Goin', girl?"
40,Ring of Fire,Johnny Cash,country,"[Verse 1]
Love is a burning thing
And it makes a firery ring
Bound by wild desire
I fell in to a ring of fire

[Chorus]
I fell into a burning ring of fire
I went down, down, down
And the flames went higher
And it burns, burns, burns
The ring of fire
The ring of fire
I fell into a burning ring of fire
I went down, down, down
And the flames went higher
And it burns, burns, burns
The ring of fire
The ring of fire

[Verse 2]
The taste of love is sweet
When hearts like ours meet
I fell for you like a child
Oh, but the fire went wild

[Chorus]
I fell in to a burning ring of fire
I went down, down, down
And the flames went higher
And it burns, burns, burns
The ring of fire
The ring of fire
I fell into a burning ring of fire
I went down, down, down
And the flames went higher
And it burns, burns, burns
The ring of fire
The ring of fire

[Outro]
And it burns, burns, burns
The ring of fire
The ring of fire
The ring of fire
The ring of fire
The ring of fire
The ring..."
41,Cry Pretty,Carrie Underwood,country,"[Verse 1]
I'm sorry, but I'm just a girl
Not usually the kind to show my heart to the world
I'm pretty good at keeping it together
I hold my composure, for worse or for better
So I apologize if you don't like what you see
But sometimes my emotions get the best of me
And falling apart is as human as it gets
You can't hide it, you can't fight what the truth is

[Chorus 1]
You can pretty lie and say it's okay
You can pretty smile and just walk away
Pretty much fake your way through anything
But you can't cry pretty

[Verse 2]
Oh no, you can’t dress it up in lace or rhinestones
It don't matter if you're in a crowd or home all alone
Yeah, it's all the same when you're looking in the mirror
A picture of pain, so let it flow like a river

[Chorus 1]
You can pretty lie and say it's okay
You can pretty smile and just walk away
Pretty much fake your way through anything
But you can't cry pretty

[Chorus 2]
You can't turn off the flood when the dam breaks
When all your mascara is going to waste
When things get ugly, you just gotta face
That you can't cry pretty

[Bridge]
Oh no, you can't
Ooh, yeah

[Chorus 2]
You can't turn off the flood when the dam breaks
When all your mascara is going to waste
When things get ugly, you just gotta face
That you can't cry pretty

[Outro]
Yeah, yeah, yeah, yeah
No, you can't cry
No, you can't cry
Yeah, yeah, yeah, yeah, yeah
No, no, no, no, no, no, no, no, woo
You can't cry
You can't cry pretty, baby
Oh yeah, woo, woo
No, you can't cry pretty, yeah"
42,22,Taylor Swift,country,"[Verse 1]
It feels like a perfect night to dress up like hipsters
And make fun of our exes, uh uh, uh uh
It feels like a perfect night for breakfast at midnight
To fall in love with strangers, uh uh, uh uht

[Pre-Chorus]
Yeah
We're happy, free, confused, and lonely at the same time
It's miserable and magical, oh yeah
Tonight's the night when we forget about the deadlines
It's time, uh uh

[Chorus]
I don't know about you, but I'm feeling 22
Everything will be alright if you keep me next to you
You don't know about me, but I bet you wanted to
Everything will be alright if we just keep dancing like we're 22
22

[Verse 2]
It seems like one of those nights
This place is too crowded, too many cool kids, uh uh, uh uh
(Who's Taylor Swift, anyway? Ew)
It seems like one of those nights
We ditch the whole scene and end up dreaming
Instead of sleeping

[Pre-Chorus]
Yeah
We're happy, free, confused, and lonely in the best way
It's miserable and magical, oh yeah
Tonight's the night when we forget about
The heartbreaks, it's time
Oh oh

[Chorus]
I don't know about you, but I'm feeling 22
Everything will be alright if you keep me next to you
You don't know about me, but I bet you wanted to
Everything will be alright if we just keep dancing like we're 22
22
I don't know about you
22, 22

[Bridge]
It feels like one of those nights
We ditch the whole scene
It feels like one of those nights
We won't be sleeping
It feels like one of those nights
You look like bad news, I gotta have you
I gotta have you

[Chorus]
I don't know about you, but I'm feeling 22
Everything will be alright if you keep me next to you
You don't know about me, but I bet you wanted to
Everything will be alright if we just keep dancing like we're 22
22
Dancing like 22, yeah, 22, yeah yeah

[Outro]
It feels like one of those nights
We ditch the whole scene
It feels like one of those nights
We won't be sleeping
It feels like one of those nights
You look like bad news, I gotta have you
I gotta have you"
43,Friends in Low Places,Garth Brooks,country,"[Verse 1]
Blame it all on my roots, I showed up in boots
And ruined your black tie affair
The last one to know, the last one to show
I was the last one you thought you'd see there
And I saw the surprise, and the fear in his eyes
When I took his glass of champagne
And I toasted you, said, ""Honey, we may be through
But you'll never hear me complain""

[Chorus]
'Cause I've got friends in low places
Where the whiskey drowns and the beer chases
My blues away
And I'll be okay
I'm not big on social graces
Think I'll slip on down to the Oasis
Oh, I've got friends
In low places

[Verse 2]
Well, I guess I was wrong, I just don't belong
But then, I've been there before
Everything's alright, I'll just say goodnight
And I'll show myself to the door
Hey, I didn't mean, to cause a big scene
Just give me an hour and then
Well I'll be as high as that ivory tower
That you're livin' in

[Chorus]
'Cause I've got friends in low places
Where the whiskey drowns and the beer chases
My blues away
And I'll be okay
I'm not big on social graces
Think I'll slip on down to the Oasis
Oh, I've got friends
In low places

[Chorus:Garth Brooks + Crowd][x2]
I've got friends in low places
Where the whiskey drowns and the beer chases
My blues away
And I'll be okay
I'm not big on social graces
Think I'll slip on down to the Oasis
Oh, I've got friends
In low places

[Verse 3]
I guess I was wrong
I just don't belong
But then, I've been there before
And everything is alright
I'll just say goodnight
And I'll show myself to the door
I didn't mean to cause a big scene
Just wait 'til I finish this glass
Then sweet little lady
I'll head back to the bar
And you can kiss my ass

[Chorus]
'Cause I've got friends in low places
Where the whiskey drowns and the beer chases
My blues away
And I'll be okay
I'm not big on social graces
Think I'll slip on down to the Oasis
Oh, I've got friends
In low places"
44,Ohio Fried Chicken,Jake Paul,country,"[Intro: Jake Paul]
Jake Paul
Merch link in bio
Ohio Fried
Chicken Bitch
We made this
In one day
Tricky Rick
Bobby Slick
Ohio boys
Let's hit it

[Chorus: Jake Paul]
Honkey donk
Tonkey tonk
Ohio Fried Chicken
Is what it's called
I got my truck
My overalls
Just me and my boys makin' fried chicken, y'all

[Verse 1: Anthony Trujillo]
Kentucky can't compete
OFC yee yeet
Sweep you off yo feet
Please look up to me
We'll tell you what to do
Tenders the move
Getcha self some sauce
Yeah you a boss

[Verse 2: Chance Sutton]
OFC that's how we're livin'
Come around town you'll find me sittin'
Your pretty girl with no care
No problem in the world not even her hair
I think I found what I finally need
Chicken and a girl that's nice and thicken
Slow it down or speed it up
I'm makin' my way to Ohio fried chicken
Bitch

[Chorus: Jake Paul]
Honkey donk
Tonkey tonk
Ohio Fried Chicken
Is what it's called
I got my truck
My overalls
Just me and my boys makin' fried chicken, y'all

[Verse 3: Jake Paul]
They said I wouldn't make it
Now my chicken's naked
And my truck is lifted
Shout out to ma n' pops
I got my piggy
I got my goat
But I still need a little boat
I wanna make
My family proud
I just wanna sell out a crowd
I need a girl
Who's down to ride
Workin' all day, that's that Ohio pride

[Chorus: Jake Paul]
Honkey donk
Tonkey tonk
Ohio Fried Chicken
Is what it's called
I got my truck
My overalls
Just me and my boys makin' fried chicken, y'all

[Outro: Jake Paul, Chance Sutton & Anthony Trujillo]
Yeah
Ohio, baby
Trio's rollin' up
Represent your country
We're here
Merch link in bio
You need to cop that shit quick
But, uh, didn't we grow up in the suburb?
That doesn't matter
Bro, shut up, dude
Don't talk about that
Shit
Oh my, my bad
My friends are going to make fun of me again
Alright
Sorry
It's everyday bro
Peace"
45,The Climb,Miley Cyrus,country,"[Verse 1]
I can almost see it
That dream I'm dreaming, but
There's a voice inside my head saying
You'll never reach it
Every step I'm taking
Every move I make feels lost, with no direction
My faith is shaken

[Pre-Chorus 1]
But I, I gotta keep trying
Gotta keep my head held high

[Chorus]
There's always gonna be another mountain
I'm always gonna wanna make it move
Always gonna be an uphill battle
Sometimes I'm gonna have to lose
Ain’t about how fast I get there
Ain’t about what's waiting on the other side
It's the climb

[Verse 2]
The struggles I'm facing
The chances I'm taking
Sometimes might knock me down, but
No, I'm not breaking
I may not know it
But these are the moments that I'm gonna remember most, yeah
Just gotta keep going

[Pre-Chorus 2]
And I, I gotta be strong
Just keep pushing on, 'cause...

[Chorus]
There's always gonna be another mountain
I'm always gonna wanna make it move
Always gonna be an uphill battle
Sometimes I'm gonna have to lose
Ain’t about how fast I get there
Ain’t about what's waiting on the other side
It's the climb

[Instrumental Bridge]

[Chorus]
There's always gonna be another mountain
I'm always gonna wanna make it move
Always gonna be an uphill battle
Sometimes I'm gonna have to lose
Ain’t about how fast I get there
Ain’t about what's waiting on the other side
It's the climb

[Outro]
Keep on moving
Keep climbing
Keep the faith, baby
It's all about, it's all about the climb
Keep the faith, keep your faith"
46,Desperado,Eagles,country,"Desperado, why don't you come to your senses
You've been out ridin' fences
For so long now
Oh, you're a hard one
I know that you've got your reasons
These things that are pleasin' you
Can hurt you somehow

Don't you draw the queen of diamonds, boy
She'll beat you if she's able
You know the queen of hearts is always your best bet
Now it seems to me, some fine things
Have been laid upon your table
But you only want the ones
That you can't get

Desperado
Oh, you ain't getting no younger
Your pain and your hunger
They're driving you home
And freedom, oh, freedom
Well that's just some people talking
Your prison is walking through this world all alone

Don't your feet get cold in the winter time?
The sky won't snow and the sun won't shine
It's hard to tell the night time from the day
And you're losing all your highs and lows
Ain't it funny how the feeling goes
Away...

Desperado
Why don't you come to your senses?
Come down from your fences, open the gate
It may be rainin', but there's a rainbow above you
You better let somebody love you
(let somebody love you)
You better let somebody love you
Before it's too late"
47,Female,Keith Urban,country,"[Verse 1]
When you hear somebody say somebody hits like a girl
How does that hit you?
Is that such a bad thing?
When you hear a song that they play saying you run the world
Do you believe it?
Will you live to see it?

[Chorus]
Sister, shoulder
Daughter, lover
Healer, broken halo
Mother nature
Fire, suit of armor
Soul survivor, Holy Water
Secret keeper, fortune teller
Virgin Mary, scarlet letter
Technicolor river wild
Baby girl, woman, child
Female

[Verse 2]
When somebody laughs and implies that she asked for it
Just cause she was wearing a skirt
Now is that how it works?
When somebody talks about how it was Adam first
Does that make you second best?
Or did he save the best for last?

[Chorus]
Sister, shoulder
Daughter, lover
Healer, broken halo
Mother nature
Fire, suit of armor
Soul survivor, Holy Water
Secret keeper, fortune teller
Virgin Mary, scarlet letter
Technicolor river wild
Baby girl, woman, child
Female

[Refrain]
Yeah
Female

[Bridge]
She's the heart of life
She's the dreamer's dream
She's the hands of time
She's the queen of kings

[Chorus]
Sister, shoulder
Daughter, lover
Healer, broken halo
Mother nature
Fire, suit of armor
Soul survivor, Holy Water
Secret keeper, fortune teller
Virgin Mary, scarlet letter
Technicolor river wild
Baby girl, woman, child
Female

[Outro]
Mhm
Female"
48,Craving You,Thomas Rhett,country,"[Verse 1: Thomas Rhett]
Every time we have to say goodbye
I'm counting down until we say hello
Every touch is like the strongest drug
I don't know how much longer I can go

[Pre-Chorus: Thomas Rhett]
I never had something that I can't walk away from
But, girl, my self-control's so paralyzed
When it comes to you, no, I ain't got no patience
There's something 'bout you girl I just can't fight

[Chorus: Thomas Rhett & Maren Morris]
You're like that cigarette
That shot of 100 proof
No matter how much I get
I'm always craving
That feeling when we kiss
The way your body moves
No matter how much I get
I'm always craving you
Craving you

[Verse 2: Thomas Rhett]
All the in-between is killing me
You know I come unglued from missing you
Sunset eyes, no, I don't have to try
Because you know exactly what to do

[Pre-Chorus: Thomas Rhett & Maren Morris]
I never had something that I can't walk away from (walk away from)
But, girl, my self-control's so paralyzed
When it comes to you, no, I ain't got no patience (I ain't got no patience)
There's something 'bout you I just can't fight

[Chorus: Thomas Rhett & Maren Morris]
You're like that cigarette
That shot of 100 proof
No matter how much I get
I'm always craving
That feeling when we kiss
The way your body moves
No matter how much I get
I'm always craving you
Craving you

[Post Chorus: Thomas Rhett & Maren Morris]
I'm always craving you
Craving you
Craving you

[Bridge: Thomas Rhett & Maren Morris]
Every time we have to say goodbye
I'm counting down until we say hello
Every touch is like the strongest drug
I don't know how much longer I can go

[Chorus: Thomas Rhett & Maren Morris]
(Yeah, yeah, yeah)
You're like that cigarette
That shot of 100 proof
No matter how much I get
I'm always craving
That feeling when we kiss
The way your body moves
No matter how much I get
I'm always craving you, yeah
Craving you

[Post Chorus: Thomas Rhett & Maren Morris]
Craving you
I'm craving you baby
I'm craving you
I'm craving you babe"
49,Everything Has Changed,Taylor Swift,country,"[Verse 1: Taylor Swift]
All I knew this morning when I woke
Is I know something now, know something now I didn't before
And all I've seen since 18 hours ago is green eyes and freckles and your smile
In the back of my mind making me feel like

[Pre-Chorus: Taylor Swift + Ed Sheeran]
I just want to know you better
Know you better, know you better now
I just want to know you better
Know you better, know you better now
I just want to know you better
Know you better, know you better now
I just want to know you, know you, know you

[Chorus: Taylor Swift + Ed Sheeran]
'Cause all I know is we said hello
And your eyes look like coming home
All I know is a simple name, everything has changed
All I know is you held the door
You'll be mine and I'll be yours
All I know since yesterday is everything has changed

[Verse 2: Ed Sheeran + Taylor Swift]
And all my walls stood tall painted blue
And I'll take them down
Take them down and open up the door for you
And all I feel in my stomach is butterflies
The beautiful kind, making up for lost time
Taking flight, making me feel like

[Pre-Chorus: Taylor Swift + Ed Sheeran]
I just want to know you better
Know you better, know you better now
I just want to know you better
Know you better, know you better now
I just want to know you better
Know you better, know you better now
I just want to know you, know you, know you

[Chorus: Taylor Swift + Ed Sheeran]
'Cause all I know is we said hello
And your eyes look like coming home
All I know is a simple name, everything has changed
All I know is you held the door
You'll be mine and I'll be yours
All I know since yesterday is everything has changed

[Bridge: Taylor Swift + Ed Sheeran]
Come back and tell me why
I'm feeling like i've missed you all this time
And meet me there tonight
And let me know that it's not all in my mind

[Pre-Chorus: Taylor Swift]
I just want to know you better
Know you better, know you better now
I just want to know you, know you, know you

[Chorus: Taylor Swift + Ed Sheeran]
'Cause all I know is we said hello
And your eyes look like coming home
All I know is a simple name, everything has changed
All I know is you held the door
You'll be mine and I'll be yours
All I know since yesterday is everything has changed

[Outro: Taylor Swift]
All I know is we said hello
So dust off your highest hopes
All I know is pouring rain
And everything has changed
All I know is a new found grace
All my days, I'll know your face
All I know since yesterday is everything has changed"
