,Song_Name,Artist,Genre,Lyrics
0,Lovesick Blues,Hank Williams,country,"[Chorus]
I got a feeling called the blues oh lord
Since my baby said goodbye
Lord I don't know what I'll do
All I do is sit and sigh, ""Oh Lord""
The last long day she said goodbye
Well Lord I thought I would cry
She'll do me, she'll do you, she's got that kind of loving
Lord I love to hear her when she calls me sweet daddy
Such a beautiful dream
I hate to think it's all over; I've lost my heart it seems
I've grown so used to you somehow
But I'm nobody's sugar daddy now
And I'm lonesome, I got the lovesick blues

[Verse]
Well I'm in love, I'm in love with a beautiful gal
That's what's the matter with me
Well I'm in love, I'm in love with a beautiful gal
But she don't care about me
Lord I tried and tried to keep her satisfied
But she just wouldn't stay
And now that she is leaving this is all I can say

[Chorus]
I got a feeling called the blues oh lord
Since my baby said goodbye
Lord I don't know what I'll do
All I do is sit and sigh, ""Oh Lord""
The last long day she said goodbye
Well Lord I thought I would cry
She'll do me, she'll do you, she's got that kind of loving
Lord I love to hear her when she calls me sweet daddy
Such a beautiful dream
I hate to think it's all over; I lost my heart it seems
I've grown so used to you somehow
But I'm nobody's sugar daddy now
And I'm lonesome, I got the lovesick blues"
1,Chootay Maatay Mp3 Song Download Djpunjab,Guri,country,"Visit this Chootay Maatay Guri Mp3 Song Download link

Chootay Maatay Song
Chootay Maatay Mp3
Chotay Maatay Mp3 Song

Chootay Maatay New Song
Chootay Maatay Song Download
Chootay Matay Audio Song
Chootay Maatay Punjabi Song

Chootay Maatay Song Djpunjab
Chutay Matay Mp3 Download
Chutay Maatay Song Download Pagalworld
Chotay Matay Mp3 Song Download Mr Jatt

Chotay Matay Full Song
Chootay Maatay New Punjabi Song
Chotay Matay Mp3 320kbps

Chootay Maatay Guri Mp3 Djpunjab
Chootay Maatay By Guri

Chootay Maatay Guri Song Download
Chootay Maatay Song Of Guri
Chutay Matay Ft Guri
Chootay Maatay Song By Guri

Guri Chootay Maatay Mp3 Free Download Wapking
Chootay Maatay Guri Song.pk
Guri Song Chootay Maatay Download
Chootay Maatay Full Mp3 Song

Punjabi Song Chootay Maatay Download
Guri New Song Chootay Maatay
Chootay Maatay Latest Song Download"
2,Babe,Sugarland,country,"[Verse 1: Sugarland]
What a shame
Didn't wanna be the one that got away, yeah
Big mistake, broke the sweetest promise
That you never should have made
I'm here on the kitchen floor
You call, but I won't hear it
You said no one else, how could you do this, babe?

[Chorus: Sugarland & Taylor Swift]
You really blew this, babe
We ain't getting through this one, babe
This is the last time I'll ever call you, babe
This is the last time, this is the last time
This is the last time, I'll ever call you babe

[Verse 2: Sugarland]
What a waste
Taking down the pictures and the plans we made, yeah
And it's strange how your face doesn't look so innocent
Your secret has its consequence and that's on you, babe
I break down every time you call
We're a wreck, you're the wrecking ball
We said no one else, how could you do this, babe?

[Chorus: Sugarland & Taylor Swift]
You really blew this, babe
We ain't getting through this one, babe
This is the last time I'll ever call you, babe
This is the last time, this is the last time
This is the last time

[Bridge: Sugarland]
Since you admitted it, I keep picturing
Her lips on your neck, I can't unsee it
I hate that because of you, I can't love you
Babe
What a shame, didn't want to be the one that got away
How could you do this, babe?

[Chorus: Sugarland & Taylor Swift]
You really blew this, babe
We ain't getting through this one, babe
How could you do this, babe
This is the last time, this is the last time
This is the last time, I'll ever call you babe

[Outro: Sugarland & Taylor Swift]
How could you do this, babe?
I'm here on the kitchen floor, you call but I won't hear it
You said I'm no one else, we ain't getting through this one, babe
I break down every time you call, this is the last time
We're a wreck, you're the wrecking ball
This is the last time, this is the last time
You said I'm no one else, this is the last time
I'll never call you, babe"
3,You Are My Sunshine,Johnny Cash,country,"The other night dear, as I lay sleeping
I dreamed I held you in my arms
But when I awoke, dear, I was mistaken
So I bowed my head and I cried

You are my sunshine, my only sunshine
You make me happy when skies are gray
You'll never know dear, how much I love you
Please don't take my sunshine away

I'll always love you and make you happy
If you will only say the same
But if you leave me and love another
You'll regret it all some day:

You are my sunshine, my only sunshine
You make me happy when skies are gray
You'll never know dear, how much I love you
Please don't take my sunshine away

You told me once, dear, you really loved me
And no one else could come between
But now you've left me and love another;
You have shattered all of my dreams:

You are my sunshine, my only sunshine
You make me happy when skies are gray
You'll never know dear, how much I love you
Please don't take my sunshine away

In all my dreams, dear, you seem to leave me
When I awake my poor heart pains
So when you come back and make me happy
I'll forgive you dear, I'll take all the blame

You are my sunshine, my only sunshine
You make me happy when skies are gray
You'll never know dear, how much I love you
Please don't take my sunshine away"
4,Say Something,Justin Timberlake,country,"[Intro: Justin Timberlake]
Mhmm, yeah, alright
Ooh

[Verse 1: Justin Timberlake]
Everyone knows all about my direction
And in my heart somewhere I wanna go there
Still, I don't go there

[Chorus: Justin Timberlake & Chris Stapleton]
Everybody says, ""say something that says something”
“Say something that says something”
“Say something that says something”
I don't wanna get caught, up in the rhythm of it
But I can't help myself, no, I can't help myself, no, no
Caught up in the middle of it
No, I can't help myself, no I can't help myself, no, no, no
Caught up in the rhythm of it

[Post-Chorus: Justin Timberlake & Chris Stapleton]
Maybe I'm looking for something I can't have (Maybe I'm looking for something I can't have)
Maybe I'm looking for something I can't have

[Verse 2: Chris Stapleton & Justin Timberlake]
Everyone knows all about my transgressions
Still in my heart somewhere, there's melody and harmony
For you and me, tonight (whoa)
I hear them call my name

[Chorus: Chris Stapleton & Justin Timberlake]
Everybody says, ""Say something""
Then, ""Say something, say something""
Then, ""Say something, say something""
Then, ""Say something""
I don't want to get caught up in the rhythm of it
But I can't get help myself, no I can't help myself, no, no
Caught up in the middle of it
No, I can't help myself, no I can't help myself, no, no, no
Caught up in the rhythm of it

[Post-Chorus: Justin Timberlake & Chris Stapleton]
Maybe I'm looking for something I can't have (Maybe I'm looking for something I can't have)
Maybe I'm looking for something I can't have (Maybe I'm looking for something I can't have)
Maybe I'm looking for something I can't have (Maybe I'm looking for something I can't have)
Maybe I'm looking for something I can't have (Maybe I'm looking for something I can't have)

[Bridge: Justin Timberlake & Chris Stapleton]
Sometimes, the greatest way to say something is to say nothing at all
Sometimes, the greatest way to say something is to say nothing at all
Sometimes, the greatest way to say something is to say nothing

[Part-Chorus: Justin Timberlake & Chris Stapleton]
But I can't help myself, no I can't help myself, no, no
Caught up in the middle of it
No, I can't help myself, no I can't help myself, no, no, no
Caught up in the rhythm of it

[Post-Chorus: Justin Timberlake & Chris Stapleton]
Maybe I'm looking for something I can't have (Maybe I'm looking for something I can't have)
Maybe I'm looking for something I can't have (Maybe I'm looking for something I can't have)
Maybe I'm looking for something I can't have (Maybe I'm looking for something I can't have)
Maybe I'm looking for something I can't have (Maybe I'm looking for something I can't have)

[Outro: Justin Timberlake & Chris Stapleton]
Sometimes the greatest way to say something is to say nothing at all
Sometimes the greatest way to say something is to say nothing at all
Sometimes the greatest way to say something is to say nothing"
5,Cry Pretty,Carrie Underwood,country,"[Verse 1]
I'm sorry, but I'm just a girl
Not usually the kind to show my heart to the world
I'm pretty good at keeping it together
I hold my composure, for worse or for better
So I apologize if you don't like what you see
But sometimes my emotions get the best of me
And falling apart is as human as it gets
You can't hide it, you can't fight what the truth is

[Chorus 1]
You can pretty lie and say it's okay
You can pretty smile and just walk away
Pretty much fake your way through anything
But you can't cry pretty

[Verse 2]
Oh no, you can’t dress it up in lace or rhinestones
It don't matter if you're in a crowd or home all alone
Yeah, it's all the same when you're looking in the mirror
A picture of pain, so let it flow like a river

[Chorus 1]
You can pretty lie and say it's okay
You can pretty smile and just walk away
Pretty much fake your way through anything
But you can't cry pretty

[Chorus 2]
You can't turn off the flood when the dam breaks
When all your mascara is going to waste
When things get ugly, you just gotta face
That you can't cry pretty

[Bridge]
Oh no, you can't
Ooh, yeah

[Chorus 2]
You can't turn off the flood when the dam breaks
When all your mascara is going to waste
When things get ugly, you just gotta face
That you can't cry pretty

[Outro]
Yeah, yeah, yeah, yeah
No, you can't cry
No, you can't cry
Yeah, yeah, yeah, yeah, yeah
No, no, no, no, no, no, no, no, woo
You can't cry
You can't cry pretty, baby
Oh yeah, woo, woo
No, you can't cry pretty, yeah"
6,Can't Help Falling In Love,Elvis Presley,country,"[Verse 1]
Wise men say
Only fools rush in
But I can't help falling in love with you
Shall I stay?
Would it be a sin?
If I can't help falling in love with you

[Chorus]
Like a river flows
Surely to the sea
Darling, so it goes
Some things are meant to be

[Verse 2]
Take my hand
Take my whole life too
For I can't help falling in love with you

[Chorus]
Like a river flows
Surely to the sea
Darling, so it goes
Some things are meant to be

[Verse 3]
Take my hand
Take my whole life, too
For I can't help falling in love with you
For I can't help falling in love with you"
7,Meant to Be,Bebe Rexha,country,"[Verse 1: Florida Georgia Line]
Baby, lay on back and relax
Kick your pretty feet up on my dash
No need to go​ nowhere fast
Let's enjoy right here where we at

[Pre-Chorus: Florida Georgia Line]
Who knows where this road is supposed to lead?
We got nothing, but time
As long as you're right here next to me, everything's gonna be alright

[Chorus: Florida Georgia Line]
If it's meant to be, it'll be, it'll be
Baby, just let it be
If it's meant to be, it'll be, it'll be
Baby, just let it be
So won't you ride with me, ride with me?
See, where this thing goes
If it's meant to be, it'll be, it'll be
Baby, if it's meant to be

[Verse 2: Bebe Rexha]
I don't mean to be so uptight
But my heart's been hurt a couple times
By a couple guys that didn't treat me right
I ain't gon' lie, ain't gon' lie
'Cause I'm tired of the fake love
Show me, what you're made of
Boy, make me believe

[Pre-Chorus: Florida Georgia Line]
Oh hold up, girl, don't you know you're beautiful?
And it's easy to see

[Chorus: Bebe Rexha & Florida Georgia Line]
If it's meant to be, it'll be, it'll be
Baby, just let it be
If it's meant to be, it'll be, it'll be
Baby, just let it be
So won't you ride with me, ride with me?
See, where this thing goes
If it's meant to be, it'll be, it'll be
Baby, if it's meant to be

[Post-Chorus: Bebe Rexha & Florida Georgia Line]
So c'mon, ride with me, ride with me
See, where this thing goes
So c'mon, ride with me, ride with me
See, where this thing goes
Baby, if it's meant to be

[Bridge: Bebe Rexha & Florida Georgia Line]
Maybe we do
Maybe we don't
Maybe we will
Maybe we won't

[Chorus: Bebe Rexha & Florida Georgia Line]
But if it's meant to be, it'll be, it'll be
Baby, just let it be (take it, baby)
If it's meant to be, it'll be, it'll be (c'mon)
Baby, just let it be (let's go)
So won't you ride with me, ride with me?
See, where this thing goes
If it's meant to be, it'll be, it'll be
Baby, if it's meant to be

[Outro: Bebe Rexha & Florida Georgia Line]
If it's meant to be, it'll be, it'll be
Baby, if it's meant to be
If it's meant to be, it'll be, it'll be
Baby, if it's meant to be"
8,Jolene,Dolly Parton,country,"[Guitar Introduction]

[Chorus]
Jolene, Jolene, Jolene, Jolene
I'm begging of you please don't take my man
Jolene, Jolene, Jolene, Jolene
Please don't take him just because you can

[Verse 1]
Your beauty is beyond compare
With flaming locks of auburn hair
With ivory skin and eyes of emerald green
Your smile is like a breath of spring
Your voice is soft like summer rain
And I cannot compete with you, Jolene

[Verse 2]
He talks about you in his sleep
There's nothing I can do to keep
From crying when he calls your name, Jolene
And I can easily understand
How you could easily take my man
But you don't know what he means to me, Jolene

[Chorus]
Jolene, Jolene, Jolene, Jolene
I'm begging of you please don't take my man
Jolene, Jolene, Jolene, Jolene
Please don't take him just because you can

[Verse 3]
You could have your choice of men
But I could never love again
He's the only one for me, Jolene
I had to have this talk with you
My happiness depends on you
And whatever you decide to do, Jolene

[Chorus]
Jolene, Jolene, Jolene, Jolene
I'm begging of you please don't take my man
Jolene, Jolene, Jolene, Jolene
Please don't take him even though you can
Jolene, Jolene"
9,Stay,Post Malone,country,"[Verse 1]
It's true that all that you know is all that you are
You said that it's all that you want and more
Fuck off and pour another drink
And tell me what you think
You know that I'm too drunk to talk right now
You put your cigarette out on my face
So beautiful, please, woman

[Refrain]
Don't break your back for me
I'll put you out of your misery

[Chorus]
Tell me that it's all okay (tell me that it's all okay)
I've been waitin' on this all damn day (waitin' on this all damn day)
Call me in the mornin', tell me how last night went
I'm here, but don't count on me to...

[Verse 2]
Stay a little longer if you convince me
And tell me all the things that you have against me
Every time we make up, the truth is faded
Everybody's blind when the view's amazin'
Damn, who are we right now?
Can we have a little conversation?
Figure it out with no intoxication
We carry on, what is our motivation?
We're never wrong, how the hell we gonna make it?
Maybe we're used to this
Tell me, what are we to do?
It's like we only play to lose
Chasin' pain with an excuse
I love that shit and so do you

[Refrain]
But don't break your back for me
I'll put you out of your misery

[Chorus]
Tell me that it's all okay (tell me that it's all okay)
I've been waitin' on this all damn day (waitin' on this all damn day)
Call me in the mornin', tell me how last night went
I'm here, but don't count on me to stay

[Guitar Solo]
Mr. Andrew Watt, ladies and gentlemen

[Chorus]
Tell me that it's all okay (tell me that it's all okay)
I've been waitin' on this all damn day (waitin' on this all damn day)
Call me in the mornin', tell me how last night went
I'm here, but don't count on me to stay"
10,Mercy,Brett Young,country,"[Verse 1]
Mercy
Why you gotta show up lookin' so good just to hurt me?
Why you wanna stop this whole damn world from turning?
Mercy
Why you hanging on so tight if this ain't working?
Why you wanna stop this flame if it's still burning?
Cause it's still burning

[Chorus]
So if you're gonna break my heart, just break it
And if you're gonna take your shot, then take it
Take it
If you made up your mind, then make it
But make this fast
If you ever loved me
Have mercy

[Verse 2]
If you go out tonight and get drunk and lonely
Wind up home alone please don't call me
And say you miss me, no

[Chorus]
So if you're gonna break my heart, just break it
And if you're gonna take your shot, then take it
Take it
If you made up your mind, then make it
But make this fast
If you ever loved me
Have mercy

[Bridge]
Woah
Oh have mercy

[Chorus]
If you're gonna break my heart, just break it
If you're gonna take your shot, take it
Take it
Oh if you're gonna break my heart, just break it
And if you're gonna take your shot, then take it
Take it
If you made up your mind, then make it
But make this fast
If you ever loved me
Mmmh if you ever loved me
Have mercy
Oh have mercy
Oh have mercy
Have mercy"
11,Something You Get Through,Willie Nelson,country,"When you lose the one you love
You think your world has ended
You think your world will be a waste of life
Without them in it
You feel there's no way to go on
Life is just a sad, sad song
But love is bigger than us all
The end is not the end at all

It's not somethin' you get over
But it's somethin' you get through
It's not ours to be taken
It's just a thing we get to do
Life goes on and on
And when it's gone
It lives in someone new
It's not somethin' you get over
But it's somethin' you get through

It's not somethin' you get over
But it's somethin' you get through
It's not ours to be taken
It's just a thing we get to do

Life goes on and on
And when it's gone
It lives in someone new
It's not somethin' you get over
But it's somethin' you get through
It's not somethin' you get over
But it's somethin' you get through"
12,In Hell I'll Be in Good Company,The Dead South,country,"Dead Love couldn't go no further
Proud of and disgusted by her
Push shove, a little bruised and battered
Oh Lord I ain't coming home with you

My life's a bit more colder
Dead wife is what I told her
Brass knife sinks into my shoulder
Oh babe don't know what I'm gonna do

I see my red head, messed bed, tear shed, queen bee
My squeeze
The stage it smells, tells, hell's bells, miss-spells
Knocks me on my knees
It didn't hurt, flirt, blood squirt, stuffed shirt
Hang me on a tree
After I count down, three rounds, in hell I'll be in good company

Dead Love couldn't go no further
Proud of and disgusted by her
Push shove, a little bruised and battered
Oh Lord I ain't coming home with you

My life's a bit more colder
Dead wife is what I told her
Brass knife sinks into my shoulder
Oh babe don't know what I'm gonna do

I see my red head, messed bed, tear shed, queen bee
My squeeze
The stage it smells, tells, hell's bells, misspells
Knocks me on my knees
It didn't hurt, flirt, blood squirt, stuffed shirt
Hang me on a tree
After I count down, three rounds, in hell I'll be in good company

In hell I'll be in Good Company"
13,What Ifs,Kane Brown,country,"[Verse 1: Kane Brown]
You say what if I hurt you, what if I leave you
What if I find somebody else and I don't need you?
What if this goes south, what if I mess you up?
You say what if I break your heart in two, then what?

[Pre-Chorus: Kane Brown]
Well I hear you girl, I feel you girl, but not so fast
Before you make your mind up, I gotta ask

[Chorus: Kane Brown & Lauren Alaina]
What if I was made for you and you were made for me?
What if this is it, what if it's meant to be?
What if I ain't one of them fools just playin' some game?
What if I just pull you close, what if I lean in?
And the stars line up, and it's our last first kiss
What if one of these days, baby, I go and change your name?
What if I loved all these what ifs away?

[Verse 2: Kane Brown & Lauren Alaina]
What if the sky falls (sky falls)
Or the sun stops burnin'?
We could worry about them what ifs 'til the world stops turnin'?
Or I could kiss you (you should kiss me)
What if you liked it? (bet I'd like it)
Well we ain't never gonna know unless we try it

[Chorus: Kane Brown & Lauren Alaina]
What if I was made for you and you were made for me?
What if this is it, what if it's meant to be?
What if I ain't one of them fools just playin' some game?
What if I just pull you close, what if I lean in?
And the stars line up, and it's our last first kiss
What if one of these days baby, I go and change your name?
What if I loved all these what ifs away?
Awe yeah
C'mon

[Bridge: Kane Brown]
You say what if I hurt you, what if I leave you?
What if I find somebody else and I don't need you?
Damn

[Chorus: Kane Brown & Lauren Alaina]
What if I was made for you and you were made for me?
What if this is it, what if it's meant to be?
What if I ain't one of them fools just playin' some game?
What if I just pull you close, what if I lean in?
And the stars line up, and it's our last first kiss
What if one of these days baby, I go and change your name?
What if I loved all these what ifs away?

[Outro: Kane Brown & Lauren Alaina]
Away (away)
What if?"
14,Самая вышка,Raim & Artur,country,"Строишь глазки, что за страсти
Подхожу к тебе немедленно
Со словом «Здрасьте»
Ты такая милая, ты такая красивая
Слов нет просто
Я просто в шоке
Твоё тело просто космос
Всё ближе-ближе, всё ближе-ближе
Повторяй за мной
Поднимая руки выше, ещё выше...ещё выше
Прошу танцуй со мной девушка из Парижа

Моя малышка, твоя улыбка
Ең әдемі, самая вышка...

Сені мен көрген сайын, как будто тебя знаю
Жақындап танысам десем орысша ой не знаю
Ай дауысын сенің, ай қимылын сенің
Майысқан шыбық белін, общем кайф әрбір жерін

Әдемісің до того, көзім тоймайды...
Кім болсада все равно сендей болмайды...
Моя малышка, твоя улыбка
Ең әдемі, самая вышка..."
15,Get Along,Kenny Chesney,country,"[Verse 1]
A man wearin' a t-shirt, says ""Virginia is for lovers""
Had a Bible in his left hand and a bottle in the other
He says ""All you're really given is the sunshine and your name""
We both started laughin' when the sky started to rain

[Chorus]
Get along, on down the road
We've got a long long way to go
Scared to live, scared to die
We ain't perfect but we try
Get along while we can
Always give love the upper hand
Paint a wall, learn to dance
Call your mom, buy a boat
Drink a beer, sing a song
Make a friend, can't we all get along

[Verse 2]
Saw a model on a billboard, 1-800 get to know me
Wondered was she photoshopped, or were her eyes really that lonely?
Did she leave her hometown thinkin' she'd end up in L.A.?
Did she break down in the desert and get stuck beside the highway?

[Chorus]
Get along, on down the road
We've got a long long way to go
Scared to live, scared to die
We ain't perfect but we try
Get along while we can
Always give love the upper hand
Paint a wall, learn to dance
Call your mom, buy a boat
Drink a beer, sing a song
Make a friend, can't we all get along

[Bridge]
We find out when you die the keys to heaven can't be bought
We still don't know what love is but we sure know what it's not
Sometimes you got to

[Chorus]
Get along, on down the road
We've got a long long way to go
Scared to live, scared to die
We ain't perfect but we try
Get along while we can
Always give love the upper hand
Paint a wall, learn to dance
Call your mom, buy a boat
Drink a beer, sing a song
Make a friend, can't we all get along"
16,"Take Me Home, Country Roads",John Denver,country,"Almost heaven, West Virginia
Blue ridge mountains, Shenandoah river
Life is old there, older than the trees
Younger than the mountains, blowing like a breeze

Country roads, take me home
To the place I belong
West Virginia, mountain mamma
Take me home, country roads

All my memories, gather round her
Miners' lady, stranger to blue water
Dark and dusty, painted on the sky
Misty taste of moonshine, teardrop in my eye

Country roads, take me home
To the place I belong
West Virginia, mountain mamma
Take me home, to the country roads

I hear her voice in the morning hour she calls me
Radio reminds me of my home far away
Driving down the road I get a feeling
That I should have been home yesterday, yesterday

Country roads, take me home
To the place I belong
West Virginia, mountain mamma
Take me home, country roads

Country roads, take me home
To the place I belong
West Virginia, mountain mamma
Take me home, to the country roads

Take me home, that country road
Take me home, that country road"
17,Hurt,Johnny Cash,country,"[Produced by Rick Rubin]

[Verse 1]
I hurt myself today
To see if I still feel
I focus on the pain
The only thing that's real
The needle tears a hole
The old familiar sting
Try to kill it all away
But I remember everything

[Chorus]
What have I become
My sweetest friend?
Everyone I know
Goes away in the end
And you could have it all
My empire of dirt
I will let you down
I will make you hurt

[Verse 2]
I wear this crown of thorns
Upon my liar's chair
Full of broken thoughts
I cannot repair
Beneath the stains of time
The feelings disappear
You are someone else
I am still right here

[Chorus]
What have I become
My sweetest friend?
Everyone I know
Goes away in the end
And you could have it all
My empire of dirt
I will let you down
I will make you hurt

[Outro]
If I could start again
A million miles away
I would keep myself
I would find a way"
