,Song_Name,Artist,Genre,Lyrics
34,All Along The Watchtower,Bob Dylan,country,"[Verse 1]
""There must be some way out of here""
Said the joker to the thief
""There's too much confusion
I can't get no relief
Businessmen, they drink my wine
Plowmen dig my earth
None of them along the line
Know what any of it is worth""

[Verse 2]
""No reason to get excited""
The thief, he kindly spoke
""There are many here among us
Who feel that life is but a joke
But you and I, we've been through that
And this is not our fate
So let us not talk falsely now
The hour is getting late""

[Verse 3]
All along the watchtower
Princes kept the view
While all the women came and went
Barefoot servants too

[Verse 4]
Outside, in the distance
A wildcat did growl
Two riders were approaching
The wind began to howl"
35,Love Me Tender,Elvis Presley,country,"[Verse 1]
Love me tender
Love me sweet
Never let me go
You have made my life complete
And I love you so

[Verse 2]
Love me tender
Love me true
All my dreams fulfilled
For my darling I love you
And I always will

[Verse 3]
Love me tender
Love me long
Take me to your heart
For it's there that I belong
And we'll never part

[Verse 4]
Love me tender
Love me dear
Tell me you are mine
I'll be yours through all the years
Till the end of time

[Verse 5]
(When at last my dreams come true
Darling this I know
Happiness will follow you
Everywhere you go)"
36,Before He Cheats,Carrie Underwood,country,"[Verse 1]
Right now, he's probably slow dancing
With a bleached-blond tramp
And she's probably getting frisky
Right now, he's probably buying her some fruity little drink
Cause she can't shoot whiskey
Right now, he's probably up behind her with a pool-stick
Showing her how to shoot a combo
And he don't know

[Hook]
That I dug my key into the side of his
Pretty little souped up four-wheel drive
Carved my name into his leather seats
I took a Louisville slugger to both headlights
Slashed a hole in all four tires
Maybe next time he'll think before he cheats

[Verse 2]
Right now, she's probably up singing some
White-trash version of Shania karaoke
Right now, she's probably saying ""I'm drunk""
And he's a thinking that he's gonna get lucky
Right now, he's probably dabbing on
Three dollars worth of that bathroom polo
Oh, and he don't know

[Hook]
That I dug my key into the side of his
Pretty little souped up four-wheel drive
Carved my name into his leather seats
I took a Louisville slugger to both headlights
Slashed a hole in all four tires
Maybe next time he'll think before he cheats

[Bridge]
I might've saved a little trouble for the next girl
Cause the next time that he cheats
Oh, you know it won't be on me
No, not on me

[Hook]
Cause I dug my key into the side of his
Pretty little souped up four-wheel drive
Carved my name into his leather seats
I took a Louisville slugger to both headlights
Slashed a hole in all four tires
Maybe next time he'll think before he cheats
Oh, maybe next time he'll think before he cheats

[Outro]
Oh, before he cheats"
37,All Too Well,Taylor Swift,country,"[Verse 1]
I walked through the door with you, the air was cold
But something 'bout it felt like home somehow and I
Left my scarf there at your sister's house
And you've still got it in your drawer, even now
Oh, your sweet disposition
And my wide-eyed gaze
We're singing in a car getting lost Upstate
The autumn leaves falling down like pieces into place
And I can picture it after all these days

[Pre-Chorus]
And I know it's long gone, and that magic's not here no more
And I might be okay, but I'm not fine at all

[Chorus]
'Cause there we are again on that little town street
You almost ran the red 'cause you were looking over at me
Wind in my hair, I was there, I remember it all too well

[Verse 2]
Photo album on the counter
Your cheeks were turning red
You used to be a little kid with glasses in a twin-sized bed
And your mother's telling stories 'bout you on the tee ball team
You taught me about your past thinking your future was me

[Pre-Chorus]
And I know it's long gone, and there was nothing else I could do
And I forget about you long enough to forget why I needed to

[Chorus]
'Cause there we are again in the middle of the night
We're dancing round the kitchen in the refrigerator light
Down the stairs, I was there, I remember it all too well, yeah

[Bridge]
And maybe we got lost in translation
Maybe I asked for too much
But maybe this thing was a masterpiece
'Till you tore it all up
Running scared, I was there, I remember it all too well
And you call me up again just to break me like a promise
So casually cruel in the name of being honest
I'm a crumpled up piece of paper lying here
'Cause I remember it all, all, all... too well

[Verse 3]
Time won't fly it's like I'm paralyzed by it
I'd like to be my old self again
But I'm still trying to find it
After plaid shirt days and nights when you made me your own
Now you mail back my things and I walk home alone
But you keep my old scarf from that very first week
'Cause it reminds you of innocence and it smells like me
You can't get rid of it, 'cause you remember it all too well, yeah

[Chorus]
Because there we are again when I loved you so
Back before you lost the one real thing you've ever known
It was rare, I was there, I remember it all too well

[Outro]
Wind in my hair, you were there, you remember it all
Down the stairs, you were there, you remember it all
It was rare, I was there, I remember it all too well"
38,Begin Again,Taylor Swift,country,"[Verse 1]
Took a deep breath in the mirror
He didn't like it when I wore high heels
But I do
Turn the lock and put my headphones on
He always said he didn't get this song but I do, I do
Walked in expecting you'd be late
But you got here early and you stand and wave
I walk to you
You pull my chair out and help me in
And you don't know how nice that is but I do

[Chorus]
And you throw your head back laughing like a little kid
I think it's strange that you think I'm funny 'cause he never did
I've been spending the last eight months
Thinking all love ever does is break and burn and end
But on a Wednesday in a cafe, I watched it begin again

[Verse 2]
You said you never met one girl who
Had as many James Taylor records as you
But I do
We tell stories and you don't know why I'm coming off a little shy
But I do

[Chorus]
And you throw your head back laughing like a little kid
I think it's strange that you think I'm funny 'cause he never did
I've been spending the last eight months
Thinking all love ever does is break and burn and end
But on a Wednesday in a cafe, I watched it begin again

[Bridge]
And we walked down the block, to my car
And I almost brought him up
But you start to talk about the movies
That your family watches every single Christmas
And I want to talk about that
And for the first time what's past is past

[Chorus]
'Cause you throw your head back laughing like a little kid
I think it's strange that you think I'm funny 'cause he never did
I've been spending the last eight months
Thinking all love ever does is break and burn and end
But on a Wednesday in a cafe, I watched it begin again
But on a Wednesday in a cafe, I watched it begin again"
39,Barrett's Privateers,Stan Rogers,country,"Oh, the year was 1778
How I wish I was in Sherbrooke now
A letter of marque came from the king
To the scummiest vessel I've ever seen
God damn them all! I was told
We'd cruise the seas for American gold
We'd fire no guns, shed no tears
But I'm a broken man on a Halifax pier
The last of Barrett's Privateers

Oh, Elcid Barrett cried the town
How I wish I was in Sherbrooke now
For twenty brave men all fishermen who
Would make for him the Antelope's crew
God damn them all! I was told
We'd cruise the seas for American gold
We'd fire no guns, shed no tears
But I'm a broken man on a Halifax pier
The last of Barrett's Privateers

The Antelope sloop was a sickening sight
How I wish I was in Sherbrooke now
She'd a list to the port and her sails in rags
And the cook in the scuppers with the staggers and jags
God damn them all! I was told
We'd cruise the seas for American gold
We'd fire no guns, shed no tears
But I'm a broken man on a Halifax pier
The last of Barrett's Privateers

On the King's birthday we put to sea
How I wish I was in Sherbrooke now
We were 91 days to Montego Bay
Pumping like madmen all the way
God damn them all! I was told
We'd cruise the seas for American gold
We'd fire no guns, shed no tears
But I'm a broken man on a Halifax pier
The last of Barrett's Privateers

On the 96th day we sailed again
How I wish I was in Sherbrooke now
When a bloody great Yankee hove in sight
With our cracked four pounders we made to fight
God damn them all! I was told
We'd cruise the seas for American gold
We'd fire no guns, shed no tears
But I'm a broken man on a Halifax pier
The last of Barrett's Privateers

Now the Yankee lay low down with gold
How I wish I was in Sherbrooke now
She was broad and fat and loose in the stays
But to catch her took the Antelope two whole days
God damn them all! I was told
We'd cruise the seas for American gold
We'd fire no guns, shed no tears
But I'm a broken man on a Halifax pier
The last of Barrett's Privateers

Then at length we stood two cables away
How I wish I was in Sherbrooke now
Our cracked four pounders made an awful din
But with one fat ball, the Yank stove us in
God damn them all! I was told
We'd cruise the seas for American gold
We'd fire no guns, shed no tears
But I'm a broken man on a Halifax pier
The last of Barrett's Privateers

The Antelope shook and pitched on her side
How I wish I was in Sherbrooke now
Barrett was smashed like a bowl of eggs
And the Main truck carried off both me legs
God damn them all! I was told
We'd cruise the seas for American gold
We'd fire no guns, shed no tears
But I'm a broken man on a Halifax pier
The last of Barrett's Privateers

So here I lay in my 23rd year
How I wish I was in Sherbrooke now
It's been 6 years since we sailed away
And I just made Halifax yesterday
God damn them all! I was told
We'd cruise the seas for American gold
We'd fire no guns, shed no tears
But I'm a broken man on a Halifax pier
The last of Barrett's Privateers"
40,Fire and Rain,James Taylor,country,"[Verse 1]
Just yesterday morning, they let me know you were gone
Suzanne, the plans they made put an end to you
I walked out this morning and I wrote down this song
I just can't remember who to send it to

[Chorus]
I've seen fire and I've seen rain
I've seen sunny days that I thought would never end
I've seen lonely times when I could not find a friend, but I always thought that I'd see you again

[Verse 2]
Won't you look down upon me, Jesus
You've got to help me make a stand
You've just got to see me through another day
My body's aching and my time is at hand and I won't make it any other way

[Chorus]
Oh, I've seen fire and I've seen rain
I've seen sunny days that I thought would never end
I've seen lonely times when I could not find a friend, but I always thought that I'd see you again

[Verse 3]
Been walking my mind to an easy time, my back turned towards the sun
Lord knows when the cold wind blows it'll turn your head around
Well, there's hours of time on the telephone line to talk about things to come
Sweet dreams and flying machines in pieces on the ground

[Chorus]
Oh, I've seen fire and I've seen rain
I've seen sunny days that I thought would never end
I've seen lonely times when I could not find a friend
But I always thought that I'd see you baby, one more time again, now

[Outro]
Thought I'd see you one more time again
There's just a few things coming my way this time around, now
Thought I'd see you, thought I'd see you, fire and rain, now"
41,Jailhouse Rock,Elvis Presley,country,"[Verse 1:]
The warden threw a party in the county jail
The prison band was there and they began to wail
The band was jumping and the joint began to swing
You should've heard those knocked out jailbirds sing

[Chorus:]
Let's rock, everybody, let's rock
Everybody in the whole cell block
Was dancing to the Jailhouse Rock

[Verse 2:]
Spider Murphy played the tenor saxophone
Little Joe was blowing on the slide trombone
The drummer boy from Illinois went crash, boom, bang
The whole rhythm section was the Purple Gang

[Chorus:]
Let's rock, everybody, let's rock
Everybody in the whole cell block
Was dancing to the Jailhouse Rock

[Verse 3:]
Number forty-seven said to number three
""You're the cutest jailbird I ever did see
I sure would be delighted with your company
Come on and do the Jailhouse Rock with me""

[Chorus:]
Let's rock, everybody, let's rock
Everybody in the whole cell block
Was dancing to the Jailhouse Rock

[Verse 4:]
The sad sack was a sitting on a block of stone
Way over in the corner weeping all alone
The warden said, ""Hey, buddy, don't you be no square
If you can't find a partner use a wooden chair""

[Chorus:]
Let's rock, everybody, let's rock
Everybody in the whole cell block
Was dancing to the Jailhouse Rock

[Verse 5:]
Shifty Henry said to Bugs, ""For Heaven's sake
No one's looking, now's our chance to make a break""
Bugsy turned to Shifty and he said, ""Nix nix
I want to stick around a while and get my kicks.""

[Chorus:]
Let's rock, everybody, let's rock
Everybody in the whole cell block
Was dancing to the Jailhouse Rock"
42,State of Grace,Taylor Swift,country,"[Verse 1]
I'm walking fast through the traffic lights
Busy streets and busy lives
And all we know is touch and go
We are alone with our changing minds
We fall in love till it hurts or bleeds, or fades in time

[Chorus]
And I never saw you coming
And I’ll never be the same

[Verse 2]
You come around and the armor falls
Pierce the room like a cannon ball
Now all we know, is don’t let go
We are alone just you and me
Up in your room and our slates are clean
Just twin fire signs, four blue eyes

So you were never a saint
And I've loved in shades of wrong
We learn to live with the pain
Mosaic broken hearts
But this love is brave and wild

[Chorus]
And I never saw you coming
And I’ll never be the same

[Bridge]
This is a state of grace
This is the worthwhile fight
Love is a ruthless game
Unless you play it good and right
These are the hands of fate
You’re my Achilles heel
This is the golden age of something good
And right and real

[Chorus]
And I never saw you coming
And I’ll never be the same
And I never saw you coming
And I’ll never be the same

[Outro]
This is a state of grace
This is a worthwhile fight
Love is a ruthless game
Unless you play it good and right"
43,Coming Home,Keith Urban,country,"[Verse 1: Keith Urban]
I wake up feeling, in my soul I'm
Living someone else's life
I'm turnin' into concrete, harder than these city streets
But no one even cares if I'm alive

[Pre-Chorus: Keith Urban]
I gotta get it right, mmm
Get it right, mmm mmm

[Chorus: Keith Urban]
There's a place that I know where they all know me
I gotta get back now to the ones who love me
Wrap myself around you, never let you go
There's nothin' in the world that feels like
The place that I know where they all know me
I gotta get back now to the ones who love me
Wrap myself around you, never let you go
There's nothin' in the world that feels like
Coming home, home, home, mmm
Coming home

[Verse 2: Keith Urban]
My mind's heavy and I can't sleep, not even a memory
Is good enough to get me through the night, mmm
I'm longin' for the real thing, people who know the real me
And all the ways to love me back to life

[Pre-Chorus: Keith Urban]
Mmm, I gotta get it right, ooh, yeah
Get it right, ooh, yeah

[Chorus: Keith Urban]
There's a place that I know where they all know me
I gotta get back now to the ones who love me
Wrap myself around you, never let you go
There's nothin' in the world that feels like
The place that I know where they all know me
I gotta get back now to the ones who love me
Wrap myself around you, never let you go
There's nothin' in the world that feels like
Coming home, home, home, mmm
Coming home, home, home, mmm
Coming home

[Bridge: Julia Michaels and Keith Urban]
Yeah I know it's only one call away but it's not the same
Yeah I know it's only one call away but it's not the same (just not the same)
Yeah I know it's only one call away but it's not the same (just not the same)
Yeah I know it's only one call away but it's not the same

[Chorus: Keith Urban and Julia Michaels]
There's a place that I know where they all know me
I gotta get back now to the ones who love me (oh, baby)
Wrap myself around you, never let you go
There's nothin' in the world that feels like (hey!)
The place that I know where they all know me
I gotta get back now to the ones who love me
Wrap myself around you, never let you go (yeah!)
There's nothin' in the world that feels like
Coming home

[Outro: Keith Urban and Julia Michaels]
(Nothin' in the world)
I'm feeling lost in all the madness
(Nothin' in the world that feels like I'm)
I need somewhere to ease my mind
Coming home (comin' home)
These sidewalks filled with different faces (ooh-hoo)
So many places but there's none like mine
Coming home"
44,Need You Now,Lady Antebellum,country,"[Verse 1: Hillary Scott]
Picture perfect memories
Scattered all around the floor
Reachin' for the phone 'cause
I can't fight it anymore

[Pre-Chorus: Hillary Scott]
And I wonder if I ever cross your mind
For me it happens all the time

[Chorus: Band]
It's a quarter after one, I'm all alone and I need you now
Said I wouldn't call, but I lost all control and I need you now
And I don't know how I can do without
I just need you now

[Verse 2: Charles Kelley]
Another shot of whiskey
Can't stop lookin' at the door
Wishing you'd come sweeping
In the way you did before

[Pre-Chorus: Hillary Scott + Charles Kelley]
And I wonder if I ever cross your mind
For me it happens all the time

[Chorus:Band]
It's a quarter after one, I'm little drunk and I need you now
Said I wouldn't call, but I lost all control and I need you now
And I don't know how I can do without
I just need you now

[Bridge: Hillary Scott + Charles Kelley]
Yes, I'd rather hurt than feel nothin' at all

[Chorus: Hillary Scott + Charles Kelley + Band]
It's a quarter after one, I'm all alone and I need you now
And I said I wouldn't call, but I'm a little drunk and I need you now
And I don't know how I can do without, I just need you now

[Outro: Hillary Scott]
I just need you now
Oh, baby, I need you now"
45,Safe & Sound,Taylor Swift,country,"[Verse 1: Taylor Swift]
I remember tears streaming down your face
When I said I'll never let you go
When all those shadows almost killed your light
I remember you said don't leave me here alone
But all that's dead and gone and passed tonight

[Hook: Taylor Swift with Joy Williams of the Civil Wars backup]
Just close your eyes
The sun is going down
You'll be all right
No one can hurt you now
Come morning light
You and I'll be safe and sound

[Verse 2: Taylor Swift with John Paul White of the Civil Wars backup]
Don't you dare look out your window
Darling, everything's on fire
The war outside our door keeps raging on
Hold on to this lullaby
Even when the music's gone
Gone

[Hook]
Just close your eyes
The sun is going down
You'll be all right
No one can hurt you now
Come morning light
You and I'll be safe and sound

[Bridge: Taylor Swift with the Civil Wars backup]

[Hook]
Just close your eyes
You'll be all right
Come morning light
You and I'll be safe and sound

[Outro: Taylor Swift with the Civil Wars backup]
Ooh, ooh, ooh, ooh oh oh[repeat 'til fade]"
46,Million Reasons,Lady Gaga,country,"[Verse 1]
You're giving me a million reasons to let you go
You're giving me a million reasons to quit the show
You're givin' me a million reasons
Give me a million reasons
Givin' me a million reasons
About a million reasons

If I had a highway, I would run for the hills
If you could find a dry way, I'd forever be still
But you're giving me a million reasons
Give me a million reasons
Givin' me a million reasons
About a million reasons

[Chorus]
I bow down to pray
I try to make the worst seem better
Lord, show me the way
To cut through all his worn out leather
I've got a hundred million reasons to walk away
But baby, I just need one good one to stay

[Verse 2]
Head stuck in a cycle, I look off and I stare
It's like that I've stopped breathing, but completely aware
'Cause you're giving me a million reasons
Give me a million reasons
Givin' me a million reasons
About a million reasons

And if you say something that you might even mean
It's hard to even fathom which parts I should believe
'Cause you're giving me a million reasons
Give me a million reasons
Givin' me a million reasons
About a million reasons

[Chorus]
I bow down to pray
I try to make the worst seem better
Lord, show me the way
To cut through all his worn out leather
I've got a hundred million reasons to walk away
But baby, I just need one good one to stay

[Bridge]
Hey, ehh, ehh, eyy
Baby I'm bleedin', bleedin'
Stay, ehh, ehhy
Can't you give me what I'm needin', needin'
Every heartbreak makes it hard to keep the faith
But baby, I just need one good one
Good one, good one, good one, good one, good one

[Chorus]
When I bow down to pray
I try to make the worst seem better
Lord, show me the way
To cut through all his worn out leather
I've got a hundred million reasons to walk away
But baby, I just need one good one, good one
Tell me that you'll be the good one, good one
Baby, I just need one good one to stay"
47,Wagon Wheel,Darius Rucker,country,"[Verse 1]
Heading down south to the land of the pines
I'm thumbing my way into North Caroline
Staring up the road and pray to God I see headlights
I made it down the coast in seventeen hours
Picking me a bouquet of dogwood flowers
And I'm a-hoping for Raleigh, I can see my baby tonight

[Chorus]
So rock me mama like a wagon wheel
Rock me mama any way you feel
Hey mama rock me
Rock me mama like the wind and the rain
Rock me mama like a south bound train
Hey mama rock me

[Verse 2]
Running from the cold up in New England
I was born to be a fiddler in an old time string band
My baby plays a guitar, I pick a banjo now
Oh, north country winters keep a-getting me down
Lost my money playing poker so I had to leave town
But I ain't turning back to living that old life no more

[Chorus]
So rock me mama like a wagon wheel
Rock me mama any way you feel
Hey mama rock me
Rock me mama like the wind and the rain
Rock me mama like a south bound train
Hey mama rock me

[Verse 3]
Walking to the south out of Roanoke
I caught a trucker out of Philly had a nice long toke
But he's a heading west from the Cumberland gap
To Johnson City, Tennessee
And I got to get a move on before the sun
I hear my baby calling my name and I know that she's the only one
And if I die in Raleigh at least I will die free

[Chorus]
So rock me mama like a wagon wheel
Rock me mama any way you feel
Hey mama rock me
Oh rock me mama like the wind and the rain
Rock me mama like a south bound train
Hey hey mama rock me
So rock me mama like a wagon wheel
Rock me mama any way you feel
Hey hey mama rock me
Mama rock me
Mama rock me
Rock me mama like the wind and the rain
Rock me mama like a south bound train
Hey hey mama rock me
You can rock me
Rock me"
48,If I Die Young,The Band Perry,country,"[Intro]
If I die young, bury me in satin
Lay me down on a bed of roses
Sink me in the river at dawn
Send me away with the words of a love song
Oh-oh, oh-oh

[Verse 1]
Lord make me a rainbow I'll shine down on my mother
She'll know I'm safe with you
When she stands under my colors
Oh and life ain't always what you think it ought to be, no
Ain't even gray but she buries her baby
The sharp knife of a short life
Well I've had just enough time

[Chorus]
If I die young, bury me in satin
Lay me down on a bed of roses
Sink me in the river at dawn
Send me away with the words of a love song

[Pre-Chorus]
The sharp knife of a short life
Well, I've had just enough time

[Verse 2]
And I'll be wearing white when I come into your kingdom
I'm as green as the ring on my little cold finger
I've never known the lovin' of man
But it sure felt nice when he was holdin' my hand
There's a boy here in town, says he'll love me forever
Who would have thought forever could be severed by

[Pre-Chorus]
The sharp knife of a short life
Well, I've had just enough time

[Bridge]
So put on your best boys, and I'll wear my pearls
What I never did is done
A penny for my thoughts—oh no, I'll sell 'em for a dollar
They're worth so much more after I'm a goner
And maybe then you'll hear the words I've been singin'
It's funny when you're dead how people start listenin'

[Chorus]
If I die young, bury me in satin
Lay me down on a bed of roses
Sink me in the river at dawn
Send me away with the words of a love song

[Outro]
Ooh, ooh, the ballad of a dove
Go with peace and love
Gather up your tears, keep 'em in your pocket
Save 'em for a time when you're really gonna need 'em
Oh, the sharp knife of a short life
Well, I've had just enough time
So put on your best boys, and I'll wear my pearls"
