,Artist,Lyrics,Song,genre
28,Travis Scott,Produced Eestbound WondaGurl Dont open windownDont let antidote yahnPoppin pills know oohnIn hills know HollywoodnDont go front door through backnIts lowkey night show oohnSo open window oohnDont let antidote yah 1 Party Sunday that funnDo Monday one timenSpent check weekend oh GodnI might thats boss shit I hit three peat oohnFucked three hoes I met week Robert HorrynI old hoes oh no nonMy nigga thats nono straight up She want coco cocainanI want dinero paper huntin wellnWho front door who isnIf feds oh no no dont let em in shhh Dont open window yahnDont let antidote yah oohnPoppin pills know yahnIn hills know HollywoodnDont go front door in backnIts lowkey night show ooh Ayy ooh oohnAt night show oooohhwahnAt night show highernAt night show oooohhwahnOoh night show get lit nigganOoh night show Anything happen night show yuhnEverything happen night show oooohhwahnOoh night shownAnything happen night show yuhnOoh night show Ooh bitch home night shownOoh straight up fuckin right ho Ooh catch flight night shownOoh lets go lets get piped thoughnBottles got us right though aint sippin light nonRRRRRR La Flame I aint got type thoughnOnly got one night though twice though RRRRRR Its lit night shownOoh night show ooh oohnAt night shownOoh night shownYeah night shownEverything happen night shownOoh night shownAnything happen night shownOoh Stackin day day young nigganYou know gotta go get it go get it nigga They hatin stankin waitinnDont mistaken dyin stayinnLord Im fire think Im Satan Callin crazy different occasionsnKickin cameraman stagesnCause I like snappin anglesnIm overboard Im overimpatientnOver niggas kids ages Dealin Mo shit thats complicatednLike two bitches might related HTown got onenAnd Bun B like number onenIts late night got late shownIf wanna roll I got place where Poppin pills know oohnIn hills know HollywoodnDont go front door through backnIts lowkey night show oohnSo open window oohnDont let antidote,Antidote,rap
29,Fetty Wap Featuring Remy Boyz,Produced Peoples Yeaaah baby 17 RemyBoy Lifestyle Ay ay look Baby girl damn fine thoughnIm tryna know I could hit behind though Im sipping like fine wine thoughnAnd over I press rewind though ay You talking bands girl I got itnBenjamins pocket I traded Trues Robins He playing Batman Fettys gon rob him ay I got Glock Rari ayn17 shots 38nI got Glock Rarin17 shots 38 Im like yeah finenWonder shell minenShe walk past I press rewindnTo see ass one timenAnd I got sewed upnRemy Boyz know usnAll fast money slow bucksnNo one control usnAy yeaaah baby Im like yeah finenWonder shell minenShe walk past I press rewindnTo see ass one timenAnd I got sewed upnRemy Boyz know usnAll fast money slow bucksnNo one control usnAy yeaaah baby 2 Montana Bucks Tell seenIs money its menI smoke twenty smell weed I got hunnies VnThey like Monty baby daddynIm like yeah I got Robins jeansnYou see wings every pair All see Remy BoyznYou know niggas everywherenAnd somebody got problemnWe could meet anywherenNow go say somethingnDont niggas play dumbnYou know came from You dont want sauce A1 Im like yeah finenWonder shell minenShe walk past I press rewindnTo see ass one timenAnd I got sewed upnRemy Boyz know usnAll fast money slow bucksnNo one control usnAy yeaaah baby Ay think know usnThey cant control usnMan I got sewed upnRemy Boyz know usn679 Zoo year babynMonty Zoovier babynZooGang zoo near baby yeah baby A thousand shoes I walk baby 105 walkthrough baby ZooGang know whole zoo nearnAnd baby Im Zoovier Removed album PDice She cutie fine make wanna make minenShe aint nothing like bimbos If like it swerve light stain herenBlowing pluck window We get playing press rewind got singing every timenTake high note girlfriendnGot city looking rude I aint Diddy I aint Loon I think I need girlfriendnShe feeling great Im talking hernShe RemyGirl Im gon pursue her I brought lot loud lot Remy sip onnThousand dollars I get tip onnIm her asked fatty realnShe said thats her got happy feelnIm bout spoil her got happy feelnIm bout spoil her oh my Im like yeah finenWonder shell minenShe walk past I press rewindnJust see ass one timenAnd I got sewed upnRemy Boyz know usnAll fast money slow bucksnNo one control usnAy yeaaah baby ZooWap MontynZoowap DiceynYeaah baby Remy BoyznYeaah yeaaah,679,rap
30,G-Eazy x Bebe Rexha,Hook Bebe Rexha GEazy Oh me InSolo ride I dienCause I got life YeahnOh I need hand holdnEven night coldnI got fire soul 1 GEazy And far I see I need privacynPlus whole lot tree fuck modesty I need space menGive world theyre tryna see A Stella Maxwell right beside menA Ferrari Im buyin threenA closet Saint Laurent get I want I want Cause hunger drivin me yeahnI need alone I need home Understand Im speakin onnIf time money I need loannBut regardless Ill always keep keepin on Fuck fake friendsnWe take Ls make Ms While yall follow make trendsnIm right back work break ends Hook Bebe Rexha GEazy Oh me InSolo ride I dienCause I got lifenGot life yeahnOh I need hand holdnEven night coldnI got fire soul PostHook Bebe Rexha GEazy I need anything get nightnExcept beat thats heartnYeah keepin alive Keeps alivenI need anything make satisfied You knownCause music goodnAnd gets every time Yeah 2 GEazy Yeah I dont like talkin strangersnSo get fuck me Im anxiousnIm tryna cool I may go ape shitnSay Fuck yall yall faces It changes though Im famousnEveryone knows lifestyle dangerousnBut I love it rush amazinnCelebrate nightly everyone rages I found cope angersnIm swimmin moneynSwimmin liquor liver muddynBut good Im still sippin bubbly This shit lovely shit aint random I get luckynMade right cause Im sick it cuddy They take money grantednBut want work ittell now funny Hook Bebe Rexha GEazy Oh me InSolo ride I dienCause I got lifenOh I need hand holdnEven night coldnI got fire soul PostHook Bebe Rexha GEazy I need anything get nightnExcept beat thats heartnYeah keepin alivenI need anything make satisfiednCause music fills goodnAnd gets every time Bridge Bebe Rexha GEazy Like babababadabanBababadaba YeahnBabababadabanBababadabanBabababadabanBababadabanCause music fills goodnAnd gets every time 3 GEazy Yeah lonely nights I laid awakenPray Lord soul take My hearts become cold break Know Im great Im broke hellnHavin dreams Im foldin cake All life Ive told waitnBut Ima get now yeah debatenYeah Hook Bebe Rexha GEazy Oh me InSolo ride I dienCause I got lifenGot life yeahnOh I need hand holdnEven night coldnI got fire soul PostHook Bebe Rexha GEazy I need anything get nightnExcept beat thats heartnAnd keepin alive Keeps alivenI need anything make satisfied You knownCause music fills goodnAnd gets every time Bridge Bebe Rexha Like babababadabanBababadabanBabababadabanBababadabanBabababadabanBababadabanCause music fills goodnAnd gets every time Produced By Michael Keenan Music Video,"Me, Myself & I",rap
31,Yo Gotti Featuring Nicki Minaj,I seen girl post BM So I hit DM All eyes yeah I see em Yeah thats man Id hate whoop It goes DM it go downnIt go DM it go down go downnIt goes DM it go downnIt go DM it go down go down I tell her Snapchat pussy moodnOr Facetime pussy its cool whoo Boy DM poppin DM poppinnMy DM caught body I got celebs DMnThey breakin news see themnBut nah talkin we talkinnWe see sucker shit often fuck nigga I seen girl post BM So I hit DM All eyes yeah I see em Yeah thats man Id hate whoop It goes DM it go downnIt go DM it go down go downnIt goes DM it go downnIt go DM it go down go down Dont hate get screenshotted pettynBitch DM everybody rules I love Gram I love Gram I love GramnIm addicted it I know I I know I am And I followed Angela SimmonsnBoy I got crush Angela SimmonsnThey like Damn Gotti boldnFuck it Ima let world know goals I seen girl post BM So I hit DM All eyes yeah I see em Yeah thats man Id hate whoop It goes DM it go downnIt go DM it go down go downnIt goes DM it go downnIt go DM it go down go down Snapchat pussy moodnSnapchat pussy its coolnSnapchat pussy moodnSnapchat pussy its cool I seen girl post BM So I hit DM All eyes yeah I see em Yeah man I hate whoop It goes DM it go downnIt go DM it go down go downnIt goes DM it go downnIt go DM it go down go down,Down In The DM,rap
32,Fetty Wap,I want mine again baby ayynI know lifestyle driving crazy ayynI cannot see without younWe call fans though girl know donI go way please younI go way see younAnd I want mine baby ayynI know lifestyle driving crazy ayynBut I cannot see without younWe call fans though girl know donI go way please younI go way see younI aint playing games I need you Baby understand Im young nigga livingnComing trap nigga know get itnI aint chasing pussy girl Im talkin bout digitsnBig bank rolls pockets 50s Turned little check then I showed I could triple itnBaby Zoovier want you I give fuck cares tats facenShe dont give fuck stares looking goodnGet fucked sight Im tryna finish I started withnIm tryna spend I got with ayynShe trap queen let hit bando ayynWe counting up watch far bands go ayy Hop beamer jump Lambo ayynRoll bands up smooth wind go ayynDumping wood guts window ayynMarried money I aint never let go ayynBaby Zoowap bando ayynDumping wood guts window ayynMarried money I aint never let go ayynBaby ZooWap fucking bando I want mine again baby ayy yeah babynI know ayy lifestyle ayy driving crazy yeah babynI cannot see without ayynWe call fans though girl know baby donI go way please babynI go way see babynAnd I want mine baby yeah babynI know lifestyle driving crazy yeah babynBut I cannot see without younWe call fans though girl know donI go way please younI go way see yanI aint playing games I need you I hope know I need you ayy yeah babynI get knees too ayy yeah babynDo anything please you ayy yeah babynTop breeze through ayy yeah babynKnow call Zoovier ZooviernWe living like movie ZooviernAnd bands going up girlnYou know ran itnI need baby baby I aint afraid admit itnGirl I need baby ayy I need baby girl tell itnYeaah baby bands Ima spend itnBig ZooWap finish babynWhen I come through baby screaming outnZoovier baby scream loud I want mine again baby I want minenI know lifestyle driving crazy babynI cannot see without aynWe call fans though girl know we donI go way please younI go way see yeah babynAnd I want mine baby I want minenI know lifestyle driving crazynBut I cannot see without younWe call fans though girl know donI go way please ayynI go way see younI aint playing games I need you And I want mine babynI know lifestyle driving crazynBut I cannot see without younWe call fans though girl know donI go way please younI go way see younI aint playing games I need you,Again,rap
33,Future Featuring Drake,I dont wanna hear that I dont wanna hear none thatnTalkin cameras like What need shitnFuck shit I dont remember none shit Where ass at dog niggas wouldnt feed menWhere ass at dog bitches didnt need menWhere ass at dog niggas tried run offnWhere ass at dog You made pull gun out Where ass at dog went switched sidesnWhere ass at dog niggas spread lies himnWhere ass at dog bodies came sliding Where ass at dog I serving pies Where ass at dog niggas wouldnt feed menWhere ass at dog bitches didnt need menWhere ass at dog niggas tried run offnWhere ass at dog You made pull gun out Where ass at dog I Pyrex Where ass at dog I drinking HiTech Where ass at We keep fully loaded contracts Had rain dance dick ass jumping Running pussy like nigga going jogging Fuck little Louis put bitch pocket Put pic gram popping Where ass I trapping storenHad struggle get Im sell dope Jackie Chan moves got game choke Gas rolling blunt Amoco 12 tryin come spot open dopenBurglar bar doors got young nigga confidentnJuugin stove still bangin honestnBlowing O yo call ho onion 2 Drake Man ass took city over Where ass theyd ask whats hold up Where ass niggas first got news Now ass around were paying back duesnWhere you When dogs needed help Lawyers commissary aint gon pay itself Where ass recorded bathroom Where ass I take attendance like classroomnMan I aint got choicenCause nowadays I swear shit done changed boy Im selfmade selfish women selfemployed Ill buy neighbors house complain noise Man ass at dog niggas wouldnt feed menWhere ass at dog bitches didnt need menWhere ass at last winter coldest Fuck at I 6 shoulders Where ass dog niggas wouldnt feed menWhere ass dog bitches didnt need menWhere ass dog niggas tried run offnWhere ass dog You made pull gun out 60 walk through bitch dont panic Had bitches fall fucking like savage Heard tryna swim ocean jacket Heard nigga came squeezing ratchetnHeard nigga came squeezing ratchet Serve lot dog food call muttnWhere ass dog I comeup Where ass at dog niggas wouldnt feed menWhere ass at dog bitches didnt need menWhere ass at dog niggas tried run offnWhere ass at dog You made pull gun out Where ass at I trapping storenHad struggle get Im sell dope Juugin stove still bangin honest Blowing O yo call ho onion,Where Ya At,rap
34,Young Thug,Ricky Racks I see younThuggernYSL life bitchnYeah fuck you momma everything elsenFree GOAT Thats best friend thats best friend flexinnBig ol booty bitch missus Texas whats next isnIm gon skeet off lil nigga come catch me catch menAnd thats bestie bestie best friend go best friendnNigga livin TTG everything still fleeknBad bitch rollin wit me gon smile cause fleeknHundred thousand dollars inside pants shit fleeknHeyyeah Yeah Take boys school swagonometry Bitch Im bleedin bad like bumble beenHold up Hold it hold it nigga proceed Ima eat booty like groceriesnEat coochie lay bitch like lets it No Tiger bitch eat wood eat woodnSupplier bitch I got pistols wood I want tacos Meagan Good Helicopter choppin buzznStuff racks inside nudge Bang side nigga curbnAnd reefer louder speaker Yeah niece hangin The BeatlesnIf ever find her better keep her 37 cameras sneakers Goin like Ox Beanie Sigel Send cop I cant wait mistreat emnForcin ho I cant wait mislead emnAnd beat em aint people Thats best friend thats best friend flexinnBig ol booty bitch missus Texas whats next isnIm gon skeet off lil nigga come catch me catch menAnd thats bestie bestie best friend go best friendnNigga livin TTG everything still fleeknBad bitch rollin wit me gon smile cause fleeknHundred thousand dollars inside pants shit fleeknHeyyeah Yeah Let tell I spent couple hundreds todaynI done cut back lean Im Hen Dussé Dont talkin see him better shoot facenI got hundred bitches cant wait replace Michael Jackson nigga Thugger Jackson moon walkin The SLIME army tool shoppinnMe horny goat Im boolin bull stopnNo I cant get arrested cause Im talkin bout necklace Ima put bitch buck Im dog lets get stuck My lil sister Dora eat Lucky Charms give luck Waddup cuz Here yo cup call Bloods bring bupnYour crew suck got bucks aint drugs nigga Thats best friend thats best friend flexinnBig ol booty bitch missus Texas whats next isnIm gon skeet off lil nigga come catch me catch menAnd thats bestie bestie best friend go best friendnNigga livin TTG everything still fleeknBad bitch rollin wit me gon smile cause fleeknHundred thousand dollars inside pants shit fleeknHeyyeah Produced Ricky Racks Young Shad,Best Friend,rap
35,DLOW,But betcha cant like m Betcha cant whip like me Cant Milly Rock like me Cant sexy walk like me Cant hit quan like me Betcha cant drop like menCant hit folks like menCant nae nae like me Now twerk twerknNow twerk twerknNow twerk twerknNow twerk twerk Eh,Do It Like Me,rap
36,DeJ Loaf Featuring Big Sean,Oh yah yah bitch back menYou know me Im clean Im holy bitch Im godly I go real niggas brag bout bought menCause know I got bag gotta fuck commas If I fuck make cum got promise stress menDont blowin phone leavin voice messages Sayin I right better exesnI told nigga stop it talkin necklacenSee difference me I never needed niggas evernIll leave em I met em I aint trippin extrasnGoons cut try talk necklacenIf ever disrespect me pussy dont disrespectful I said woo I said I know I know I knownHe heard me waitin doornI said woo yeah mink floor Used bust shit skatin 6 9 come 4nWe got glow sticks ho chicks bitch act like know this Im antisocial social network aint motion I move like that I show emotions niggas bitches disgustinnBananas Trojans pop pussy legend I said woo I said I know I know I knownI said bitch back menI said woo I said bitch back menI said woo get nigganI said woah woah yah yah bitch back menI said woah woah yah yah bitch back menI said woah woah yah yah bitch back menI said woah woah yah yah bitch back menBig Sean joins innBack me back me I said bitch back menBack me back me I said bitch back menAhh Sean DonnBack me back me I said bitch back menDetroit shitnI said back me I said bitch back me Back me want backs coffinsnIts cold D still wanna take jacket me Back I afford get mixed mastered homienMy mama fronted money backup homienBitch back me Bank account look like ballot homie yeah checked upnMy niggas packin get trippin unpackin homie Yeah I overdo it yeah thats salad homienYeah Im overdressed aint salad me Me DeJ together holy matrimony Yohhh hard smile shitnWhen aint free Juan I got real ones trial shit Fuck peers unless talkin bout Belle Isle shit The check seven figures I might try dial shitnAnd I fuck make cum blowin phone Lately Ive messin girls tend shit own I turn dusk dawn turn chair throne Fuck whip make take Uber homenCold chromosome I grew without hammock I everything except panic feel me Finally Famous familynAnd expandin top floor like tannin She throwin tantrumsnShe gon hold dick like Grammy I give bomb D damage like I said woo I said I know I know I knownDetroit shit nigganI said bitch back menI said woo I said bitch back menWhat dognI said woo get nigganI said woah yah yah bitch back menI said woah woah yah yah bitch back menI said woah woah yah yah bitch back menI said woah woah yah yah bitch back menBack me back me I said bitch back menBack me back me I said bitch back menBack me back me I said bitch back menI said back me I said bitch back me Yeah thats right nigganI said woah yah yahnFor citynWoah yah yah bitch back menYou got Queen DeJ Sean Don straight upnHa Its time boss everything Im gettin everything,Back Up,rap
37,iLoveMemphis,Produced Buck Nasty I finna I finna finna show to Hit Quan hit Quan hit Quan hit QuannI said get low swing armnI said get low hit QuannIm finna show tonHit Quan hit Quan hit Quan hit QuannI said get low swing armnI said get low hit Quan I paper chase vanishnHit Quan make boyfriend panicnI heart Memphis I also love dancingnI done took em I plan landing I call shots like NikenNo FaceTime people want Skype menIf I time would really write menI stay yall mind oh I think like me Clean pair sneaks designer beltnPlease watch step cause Im feeling myself Throw flag play man somebody get refnGo blah la la la low man somebody get help Pulled block Hit Quan hit Quan hit Quan hit QuannI said get low swing armnI said get low hit QuannIm finna show tonHit Quan hit Quan hit Quan hit QuannI said get low swing armnI said get low hit Quan Pull block dance like crazynThis chick hella hot I know chick crazynIf I think makes crazynWe thots crazy Flexing always agendanYour whole team rats CEO Master Splinter Bout hit Quan turn girl member Now whole team flexing I think got winnernPeople want dap cant get none menI went jail snap up least I bum moneynPeople wanna walk around tryna steal lingonJust make sure talk say hes thing though Hit Quan hit Quan hit Quan hit QuannI said get low swing armnI said get low hit QuannIm finna show tonHit Quan hit Quan hit Quan hit QuannI said get low swing armnI said get low hit Quan,Hit The Quan,rap
38,Drake & Future,Yeah I know signed deal butnI need advance next one toonThey know Ima aroundnYeah I need it Cause I got really big teamnAnd need really big ringsnThey need really nice thingsnBetter comin stringsnBetter comin stringsnWe need really nice thingsnWe need really big ringsnI got really big teamnI got really big teamnThey need really big ringsnThey need really nice thingsnBetter comin stringsnBetter comin stringsnWe need really nice thingsnWe need really big ringsnI got really big team Man time alive You vs minenAre talkin teams Are talkin teamsnOh switchin sides Wanna come me Look smile me look owl menI chase girls run mile me Say gon ride me Ill buy tires you This game differentnYou get one shot niggas gon foul you Man fuck em all man want allnDont get involved gon knock ya offnAnd top off Im dogsnIts new season still breathin And I got really big teamnAnd need really big ringsnThey need really nice thingsnBetter comin stringsnBetter comin stringsnWe need really nice thingsnWe need really big ringsnI got really big teamnI got really big teamnThey need really big ringsnThey need really nice thingsnBetter comin stringsnBetter comin stringsnWe need really nice thingsnWe need really big ringsnI got really big team Man time alivenIm drinkin lean thought I died I run kidnappers Im talkin bout kidnappersnIm talkin bout murderin niggas Im talkin bout carjackers You battle rapper Im official trappernNiggas droppin subliminals nigganThat jibber jabber We take Mellow Yellow fill red foreverever These niggas jelly jealousnMan niggas get scared tellitellinnI fuck check everythingnI bought ice feds came I bought bitch new Celine I got rings I got racks like Serena All rings Aquafina bitch Aquafina Pluto Jupiter I go Venus Im fresh store Im cleanersnWho keepin score cause niggas losin Cause I got really big teamnAnd need really big ringsnThey need really nice thingsnBetter comin stringsnBetter comin stringsnWe need really nice thingsnWe need really big ringsnI got really big teamnI got really big teamnThey need really big ringsnThey need really nice thingsnBetter comin stringsnBetter comin stringsnWe need really nice thingsnWe need really big ringsnI got really big team Man time,Big Rings,rap
39,Kevin Gates,Hello What deal Bet I got two phones one plug one load I got two phones one bitches one dough Think I need two more line bumpin Im ring ring ringinnCountin money ring ring ringinnTrap jumpin Im ring ring ringin I got two phones one plug one load I got two phones one bitches one dough Think I need two more line bumpin Im ring ring ringinnCountin money ring ring ringinnTrap jumpin Im ring ring ringin Button start foreign oh God Im gorgeousnI put key inside pocketnPark it might get see it new Ferrari Man mirror choose bother Someone said callin I feel like talkinnEverything I get returned way I bought it Phone interrupting Im recordinnPhone making women feel unimportant Call dog say way retardednKeep oil cause I using ForemannKitchen I finished new performance Hater wish wellnI got clientelenI got scale I got two phones one plug one load I got two phones one bitches one dough Think I need two more line bumpin Im ring ring ringinnCountin money ring ring ringinnTrap jumpin Im ring ring ringin I got two phones one plug one load I got two phones one bitches one dough Think I need two more line bumpin Im ring ring ringinnCountin money ring ring ringinnTrap jumpin Im ring ring ringin There go again one lil friendsnThey give damn nigga beennAll wanna know I got givenHow much I spend What I got lendnWhat I I them Bricks comin somewhere rim Section doin numbers nowhere gym Jumpin Honda I got in Askin I cop none concern Everything sale goin biz Partners jail gotta feed kids I got two phones one plug one load I got two phones one bitches one dough Think I need two more line bumpin Im ring ring ringinnCountin money ring ring ringinnTrap jumpin Im ring ring ringin I got two phones one plug one load I got two phones one bitches one dough Think I need two more line bumpin Im ring ring ringinnCountin money ring ring ringinnTrap jumpin Im ring ring ringin Getting calling cards Barbie dollnWhen round know Im bodyguard Money callin me baby girl Im sorrynYou high yella important Smell like tartar Imma put water Engagin Im gazin hipsnAnd aint nobody makin attemptsnAmazing clip hanging slanging dicknMaybe make takin tripsnMaybe I thinkin impatientnPhone ringing hold up is I got two phones one plug one load I got two phones one bitches one dough Think I need two more line bumpin Im ring ring ringinnCountin money ring ring ringinnTrap jumpin Im ring ring ringin I got two phones one plug one load I got two phones one bitches one dough Think I need two more line bumpin Im ring ring ringinnCountin money ring ring ringinnTrap jumpin Im ring ring ringin,2 Phones,rap
