,Artist,Lyrics,Song,genre
40,Missy Elliott Featuring Pharrell Williams,Produced Pharrell Intro Shorty what The dance dumbnHow fromnStickin tonguenGirl know youngnA bunch girls shit look funnThats fromnYou know start till onenThats from Im faded exaggeration Backs breakin like percolationnBoys yard hip spankin Where make drop like matrix Cant take it chicks fakinnYall still sleep better stay awakenednHot new dance hood make it Make donk move fast make think drinkinnHead floor collect thoughnYou better huddle cause beats cold Pop that pop that cock reloadnThis another hit I got ace hole Boys back playa peep thatnYou got small stack playa keep that Im Big Mac make wanna eat that Like mmmmm yak yaknJunk trunk make pumps bumpnGirls wanna fun make stickin tongue The dance dumbnHow fromnStickin tongue girlnBut know youngnA bunch girls shit look funnThats fromnYou know start till onenThats from I come bitch like liquidnDrip drip businessnClick click get picture Hermés Trismegistus Witness get liftednBasic nigga I born basementnShape shift nigga I think like spaceship False ohnahnahnahnI different yall far apartnThe way I balance bars I never fall I I callnThe almighty yellow star God Lyrically Im Optimus PrimenThe car I drive look far I ride When I go by smoke eyesnSo open eyes jokes guysnAnd aint gotta mason see throughnSome shit occasion The dance dumbnHow fromnStickin tongue girlnBut know youngnA bunch girls shit look funnThats fromnYou know start till onenThats from Im like kakarakarakrakarakaraknMake new track make em fall crack Give em slap appetizer smacknIm fat back make boys collapse Yeah I rap jacknBoys wanna jump pussy cat Got new idea let switch itnMan Im futuristic Big lips big big big hipsnBody thick like biscuit Different rippin shit microphone grippin itnGettin Benjamins new car whippin it Uh Im far ahead yall man Im top starsnI care none are blahblahblahblahnYou best go rewrite bars Shawty whatnHow from TriflinnHow fromnThats fromnThats fromnShawty whatnHow from HeynHow fromnThats fromnThats from,WTF (Where They From),rap
41,Lil Dicky Featuring Fetty Wap & Rich Homie Quan,LD AKA The Independent VariablenTrap God servin hallway Fetty Wap Ayy gold at baby Fuck I need gold mannAyy clothes at baby Fuck I need clothes mannAyy dough at babynIn bank know I aint tryna blow dat babynAyy gon save money Im thriftynAyy gon save money Im stingynAyy gon save moneynWhat doin We gon save dat money The rap game got wrongnWe aint bout go spend money flex emnWe aint really got like yall Yeah baby Im type motherfucker check checknDo math I aint never gettin robbed NonThose margaritas goin card NonI aint bout split damn thing convenience sake Im restaurant workin waitressnHold upnYou aint heard Lil Dave Yung L Jew biz majornFuck know world raised innIve savin money since motherfucker thirteen I wear pair jeans everyday Its truenFree sandwiches homie two stamps away Its truenBook flight December I leave May I donDrugs generic still work same I get logins Netflix cousin GregnThanks Greg Fetty Wap Ayy gold at babynAyy clothes at babynAyy dough at babynIn bank know I aint tryna blow that babynAyy gon save money Im JewishnAyy gon save money Im frugalnAyy gon save money Im imprudentnWhat do We gon save money 2 Rich Homie Quan All luggage Louie V I swear God nigga All bitches scared me I put rod emnAll bitches actin thoughtless I disregard themnAll bitches actin holy aint got God em I teach lil nigga somethin like preachernI take ass church fresh hell Easter I make ass burp like baby without hiccupnI could Interlude Lil DickynQuan whats saving money thoughnYou know full verse would expensive anywaysnI think I aint parkin unless meter green homie Please Hair cut several months inbetween homie Always Hit mafuckin lights I leave homie YOLO Single ply TP ass bleed Airbnb motherfuckin lease Im never there Im Cali fuck company Delaware At happy hour takin chicken I even carenAnd applies dating wingsnPeep matinees phone bill got motherfuckin fam All fam 401k rollin bands Ayy Coppin sweaters summer sale em Im hotnThe fuck rappers bragging bout You overpaying it Fetty Wap Ayy gold at babynAyy clothes at babynAyy dough at babynIn bank know I aint tryna blow that babynAyy gon save money Im judiciousnAyy gon save money Im cost efficientnAyy gon save money I differentnWhat do We gon save money I aint never hit bar cover Never Low thread count hard covers Woo Free trial memberships dognI never join shits dognFuck think dog Frequent flying like motherfuckin finch though General Tso half dozen sticknJust I whet appetite bitnWhatchu talkin bout My AC never nothing blow fans though Walgreens card shoppin brands though Boy go hard collecting got Venmo Save every motherfuckin roach tryna smoke Check clothes drawers I aint playin aroundnIts LD lil boy Mr Handmedown My dirty drawers gettin worn blame nownYou think I got 450 quarters me well I fuckin dont Fetty Wap Ayy gold at babynAyy clothes at babynAyy dough at babynIn bank know I aint tryna blow that babynAyy gon save money 1738 Ayy gon save money Im kikenAyy gon save money I eat figsnWhat do We gon save money Bridge Fetty Wap Every time niggas tryna playnAnd lately Ive stackin crazynStackin cause bands babyn800k underneath bed baby Outro Lil Dicky If restaurant got iced coffeenAnd waiter refillin without word cautionnAnd get fuckin bill see double charged yanFor coffee told em theres problemnSing along likenOhh double charge thatnDont double charge me likenOhh double charge that Dont yourselfncause I might ask ice cubes worthnWhat ice cubes worthnThats differentiator making nonfree perknAnd I might make work difficult need benSo think it take minute let breathe B But think it bruh saw get burger bacon sidenAfter looking price side baconnAnd comparing difference cheeseburgernVs bacon cheeseburger making decision I would hate waiter tryna tell something differentnIma get Yelp minute reviewnThis piece shit place like kike know hownUnless take extra coffee I might get loud unless you Oh accidentnYou even mean sniffnYou even was thats Im embarrassed,$ave Dat Money,rap
42,Kevin Gates,They ask Im real I say Is serious My daughter gon love bitch here All diamonds shine cause really diamonds Bad bitches line really trying They ask Im high I say Really really Got money mind I say Really really I look like I ballin cause Im really ballin I apologize Im really sorry They ask Im lyin I say Really really Im really mind I say Really reallynReally really Make em believe I made em believe A lyrical song writer sing Bringing money like raking leaves I trying get paper sneezenAchoo blessing She special you I look specialnActually I treat regular Not seen making spectacle Scared feds switch cellular Grey Monte Carlo Pockets indigent cant careful Steve like em tall yellownBroke college fresh low mileage I like em black pretty white teethnBody unique booty fleek Jhené Aiko chewing cheeksnGroceries please know me All diamonds shine cause really diamonds They ask Im high I say Really really When yo bitch I mess hernNo detective work I questioningnWhere been trying read messages I speak man thats irregular What need undressin hernWhat need caressin her Pulling hair back go pressin hernTrying see tap first made bet her Relationship flaking eczemanShe catching feelings say inseparable Oyster Perpetual replica Mustang GT streets smoking vegetables Trunk front make elephant I really really put syrup beverages Shopping Beverly check etiquettenLoving swag women tailor keep checking it Carats glisten necklaces All diamonds shine cause really diamonds They ask Im high I say Really really,Really Really,rap
43,2 Chainz,All niggas ballinnAll niggas athletic All niggas A1nAll got street cred All niggas ballinnAll niggas athletic Pulled PhantomnPulled dancer Got pocket full moneynKinda hard keep pants up Lil Quay fucked Xans upnKinda hard understand us Duffle bags EscaladenCall bitch bread trucknGot bitch going retardednCall Uber spare truck All niggas never scared usnAll niggas never ran up Bitch tryna put head me Niggas tryna put feds me Niggas tryna take meds me Everything players onlynNiggas sunny like Arizona Gunshots sayin something Spraying shit like aerosol You foul thats fair ball Nigga cant reach goalsnKeep shootin damn air ball My partners still smoke parole They say Im crazynI used talk stove Go dealership fishtail lot Shawty said want 5 millionnCause I told leave call thotnShit like not damn Still got ACT stock man You wavin thing skynWe wavin thing bodynWe wavin thing eye Told lil bitch Ill passnNigga watch assist I run trap like marathon You know like feelin gone I know like ceilin gone I sit FarrakhannTurn White House Terror Dome I used serve Chevron I used serve necklace on bitch Directed Motion Family,Watch Out,rap
44,Fetty Wap,My niggas stack money spend itnCause die cannot take younIf aint beefin bout money whats problemnDont worry niggas cause I got em uhnMy niggas stack money spend it uhnCause die cannot take younAnd aint beefin bout money whats problem UhnDont worry niggas ZooWap got em uh On everything 17 Im wildin ayynTreat whole squad island ayynZiploc gang bring lighter ayynIts gon house party island ayy Shit boom like M80s island Its lot trillionaires throwin dollarsnCausin pure hell wildin islandnI swell pockets swellnCome try Hunned Gang man theyll shoot yanI squad I gangnI squad I gangnIts Zoovie trap aint damn thing change My niggas stack money spend itnCause die cannot take younIf aint beefin bout money whats problemnDont worry niggas cause I got em uhnMy niggas stack money spend it uhnCause die cannot take younAnd aint beefin bout money whats problem UhnDont worry niggas ZooWap got em uh,RGF Island,rap
45,Lil Durk & DeJ Loaf,Ooh I like way movenShawty baby everything truthnTogether cool cant losenKeep em feet baby I know confusednShawty Beyoncé Durk DeJ Durk DeJ Durk DeJnShawty BeyoncénDurk DeJ Durk DeJ Durk DeJnMy Beyoncé Trippin drank I know worth itnIndependent baby I know workin Adrianas serving drinks 20 bottles urgentnI know better nobodys perfect We flirted minute DeJ thats babynI aint trippin Im like Henny yeah Im kidneys She like play songs way Im hittin itnTurn around like Damn Durk I like way hittin it Dont believe rumors girlnYou know Ill you girlnI wanna hear shit niggasnThat tried you girlnFuck past right nownShawty got right nownAnd hot right nownYou get right now baby Ooh I like way movenShawty baby everything truthnTogether cool cant losenKeep em feet baby I know confusednShawty Beyoncé Durk DeJ Durk DeJ Durk DeJnShawty BeyoncénDurk DeJ Durk DeJ Durk DeJnMy Beyoncé 2 DeJ Loaf I let get want it knock push itnI plottin while I got I want him They understand none plannedn99 problems bitch better none Na na na na yeah yeahnThis aint want I told thatnLeave girl thatnGet DeJ aint ever goin backnHe shy I seen him smile Heard rumors aint style I hatin townnHotel I FaceTime you towel They aint get aint problemnWhat fuck itnDurk DeJnIm thinkin bout changin last name Ooh I like way movenShawty baby everything truthnTogether cool cant losenKeep em feet baby I know confusednShawty Beyoncé Durk DeJ Durk DeJ Durk DeJnShawty BeyoncénDurk DeJ Durk DeJ Durk DeJnMy Beyoncé You InWhite dress flowers suit tienMe like Bonnie ClydenNo beat case were die Who I say aint naturalnYour haters haters aint switchin up baby I got younIm like tattoonThe way wear dress gon attack you The way look me baby I got younI hit front I like back toonShe say Lay I ride younI know feindingnShe scratchin back I like screaminnI fuck leave her feinding Shawty Beyoncé Ooh I like way movenShawty baby everything truthnTogether cool cant losenKeep em feet baby I know confusednShawty Beyoncé Durk DeJ Durk DeJ Durk DeJnShawty BeyoncénDurk DeJ Durk DeJ Durk DeJnMy Beyoncé Durk DeJ Durk DeJ Durk DeJnUuuuuuu Uuuuuuu,My Beyonce,rap
46,"Colonel Loud Featuring T.I., Young Dolph & Ricco Barrino",Thanking God weed women sunshine Dumb hot Out Sunset Blowing kushnFrom one timenYou get contact Catch ya ass red lightnWanna run em sideways HellcatnOn run flat Hear waves crashing playing spades living room CrackingnSound like Doggystyle interlude Kurupt Gotti nigga gas at From Bankhead Hollywood addressnSame nigga thonOne one get ass kicked And I smoking best loud California Palm trees air top pushed backnBlowing smoke roof cookies exactnIm always Cali cause atnBitches bud good weather know bout that Breaking backwoods rolling gasoline up Like sip limearitas sisco I hopped ass 101 headed north,California,rap
47,iLoveMemphis,I said Ill show InLean dab lean dabnLean dab lean dabnLean dab lean dabnLean dab lean dab I said Ill show InLean dab lean dabnLean dab lean dabnLean dab lean dabnLean dab lean dab Wake morning I dab Had pull block cause today I get whip And know top drop cars name naenae Had hit Quan cause today good day I said Ill show InLean dab lean dabnLean dab lean dabnLean dab lean dabnLean dab lean dab I said Ill show InLean dab lean dabnLean dab lean dabnLean dab lean dabnLean dab lean dab Nice shoes car clean cause its sunny outsidenThat mean I pull top down Always used dodge cops riding around plate tagsnBut never catch me driving like taxi Its iHeart Memphis I also love dabbingnI done took em I feel like pilotnI done took em I dont care bout mileage Lean dab lean dabnLean dab lean dabnLean dab lean dabnLean dab lean dab I said Ill show InLean dab lean dabnLean dab lean dabnLean dab lean dabnLean dab lean dab You google me google menYou google me google me,Lean & Dabb,rap
48,J. Cole,Produced Vinylz 1 Since youngin always dreamed gettin richnLook nigganFantasize white picket fencenWith trees nigga Used want Pathfinder tintsnThats I need nigganThrow 20s bitch get rinsednBut I see nigganThat worlds lot bigger ever since Picked papernAnd say nigga Eddie caught body Im convincednAnybody killer gotta push em limits Fuck timid CivicnPoliticin pushers pimpsnIm tryna write story I get glimpsenYeah I get glimpse Hook 1 Last night I bad dreamnThat I trapped citynThen I asked really bad thing They robbin niggas dailynCan blame nigga aint never thingsnGuess not Whats value thingnLast night pulled nigga light likenUgh nice watch run itnHands air now hands air run itnHands air now hands air run itnHands air now hands airnHands air now hands air Small town nigga Hollywood dreamsnI know everything glitters aint goldnI know shit aint always good seemsnBut tell till get could knownHow could know How could know 2 Listen Im go get richnFuck nigganWe gon circle round Ville hit lick Cop tree nigganAnd powder bag make flipnYou gon see nigganOne day gon graduate cop bricknAnd thats key nigganListen Im bout go get richnStand back watch want nigganMe I want pockets fat badder bitchnTired seein niggas flaunt I wanna flaunt nigga Watch rollers fuckin Crown VicnTryna lock nigga up thats nigga Wanna know funny thing shitnEven let em kill dreamnItll haunt nigga haunt you Hook 2nLast night I bad dreamnThat I trapped citynThen I asked really bad thingnI look around likenDo wanna another nigga aint never thingsnGuess not Whats value thingnLast night pulled nigga light likenYou know fuck nigga run shitnUh nice watch run itnHands air now hands air run itnHands air now hands air run itnHands air now hands airnHands air now hands air Father forgive childish waysnI look outside clouds graynI need hands take miles awaynYour wish command command commandnBut go Ive got warn nownWhatever goes surely must come downnAnd get piece know peace foundnSo take man take man take mannYour wish command command command,A Tale Of 2 Citiez,rap
49,Future,Took shot Henny Ive going brazy brazy They say whole hood got investigationnThey know talk stick talk stick talknThey know talk lick talk lick talk 10 million dollars cash fuck friend Started sipping syrup Ive geeked ever since Gotta keep heat seat ever since You know talk stick talk stick talk Im bout fuck cash new toynBout fuck cash new toy You cant understand us cause soft Taliban bands run em straight machinery They came stick heard itnThey came bitch swerving I cant believe blood aint shirtnBecause got hit closerange We talking stick talk talking bricks toonWe talking lick talk Ima fuck bitch too I aint got manners slutsnIma put thumb butt Took shot Henny Ive going brazy brazy They say whole hood got investigationnThey know talk stick talk stick talknThey know talk lick talk lick talk Im bout fuck cash new toynBout fuck cash new toy You cant understand us cause soft Taliban bands run em straight machinery Ima tell lie oathnI see eyes going broke Oxycontin got body count sak pase Riding car I barely pronouncenOrdered chauffeur told him ride round whole worldnI Eway molly old girl Get little cheaper could winnHit little harder get Benz 10 million dollars cash fuck friend Started sipping syrup Ive geeked ever sincenGotta keep heat seat ever since You know talk stick talk stick talk Im bout fuck cash new toynBout fuck cash new toy You cant understand us cause soft Taliban bands run em straight machinery Fully loaded whip tote fully loaded clips Fucking niggas Ill smoke zipnRed eyes I got Zoes me Taliban bands run em straight machinery Took shot Henny Ive going brazy brazy They say whole hood got investigationnThey know talk stick talk stick talknThey know talk lick talk lick talk 10 million dollars cash fuck friend Started sipping syrup Ive geeked ever sincenGotta keep heat seat ever sincenGotta keep heat seat ever since You know talk stick talk stick talk,Stick Talk,rap
50,Migos Featuring Lil Uzi Vert,You know young rich niggasnYou know aint really never old moneynWe got whole lotta new money though hah If Young Metro trust Im gon shoot ya Raindrop drip drop top drop topnSmokin cookie hotbox cookie Fuckin bitch thot thot thot Cookin dope crockpot pot We came nothin somethin nigga hey Cry river give tissue hey My bitch bad boujee bad Cookin dope Uzi blaownMy niggas savage ruthless savagenWe got 30s 100 rounds grrah My bitch bad boujee bad Cookin dope Uzi dope My niggas savage ruthless heynWe got 30s 100 rounds glah Offset whoo whoo whoo whoo whoo Rackaids rackaids got backends backends Im ridin around coupe coupe I take bih right you Bitch Im dog roof grrnBeat ho walls loose hey Hop frog whoo skrt Bankrolls keep company cash Yeah pull Ghosts whoo Yeah diamonds choker glah Holdin fire holster blaow Rick Ruler diamonds cooler cooler This Rollie Muller heynDabbin em like usual dab Magic brick voodoo magic Im young rich plus Im bougie hey Im stupid I keep Uzi rrah Rackaids rackaids got backends backendsnSo money makin back ache aagh You niggas got low Act rate Act We Nawf yeah dat way nawf Fat Cookie blunt ashtray cookie Hop Lamb drag race skrt I let birds take bath bae brr Raindrop drip drop top drop topnSmokin cookie hotbox cookie Fuckin bitch thot thot thot Cookin dope crockpot pot We came nothin somethin nigga hey Cry river give tissue hey My bitch bad boujee bad Cookin dope Uzi blaownMy niggas savage ruthless savagenWe got 30s 100 rounds grrah My bitch bad boujee bad Cookin dope Uzi dopenMy niggas savage ruthless heynWe got 30s 100 rounds glah Pour four Im droppin muddynOuter space Kid Cudi drank Dont move fast I might shoot ya huhnDraco bad boujee draco Im always hangin shooters brrah Still playin pots pans call Quavo Ratatouille Run sack call Boobie run itnWhen Im stage show boobies ayy Ice neck Im coolest ice Hop suicide Uzi pewpewpew I pull up I pull up I pull upnI hop drugs good luck skrrtnIm cookin Im cookin Im whippinnIm whippin rock up let lock lock up I gave 10 racksnI told go shoppin spend pop ten These bitches fuck suck dicknAnd bustin Instagram get clout up Uh yeah dat way float track like Segway gonYeah dat way I used trap Subway trappinnYeah dat way young nigga trap AK rrrahnYeah dat way big dyke ho get door Macy Gray hey Raindrop drip drop top drop topnSmokin cookie hotbox cookie Fuckin bitch thot thot thot Cookin dope crockpot pot We came nothin somethin nigga hey Cry river give tissue hey My bitch bad boujee bad Cookin dope Uzi blaownMy niggas savage ruthless savagenWe got 30s 100 rounds grrah My bitch bad boujee bad Cookin dope Uzi dopenMy niggas savage ruthless heynWe got 30s 100 rounds glah Yeah yeah yeah yeah yeah Ayy wait niggas watchinnI swear God clonesnYeah hey huh Switchin hoes like flows what Switchin flows like clothes like what Cause money come roofnDrive Rari bitch got roof skrtnWait kind Rari 458 damn Look go strip club make rain Go sleep jacuzzi yeahnWakin right twopiece yeah Gettin chicken blue cheese yeah Boy fake like collar snakinnI swear God Gucci ayy Saw girl once choosin yeah Raindrop drip drop top drop topnSmokin cookie hotbox cookie Fuckin bitch thot thot thot Cookin dope crockpot pot We came nothin somethin nigga hey Cry river give tissue hey My bitch bad boujee bad Cookin dope Uzi blaownMy niggas savage ruthless savagenWe got 30s 100 rounds grrah My bitch bad boujee bad Cookin dope Uzi dopenMy niggas savage ruthless heynWe got 30s 100 rounds glah,Bad And Boujee,rap
51,Rae Sremmurd Featuring Gucci Mane,Black Beatles citynBe back immediately confiscate moneys Ear DrummersnRae Sremm Guwop Mike WiLL I sent flowers said receive emnBut said need em Mike WiLL That girl real crowd pleaser Small world friends know me Young bull livin like old geezer Quick release cash watch fall slowly Haters mad whatever reason They lose DJ drops needle Getting gone Im blinkin New day new money madenThere nothin explain Im fuckin black Beatle cream seats Regal Rockin John Lennon lenses like see em spread eagle Like clockwork I blow allnAnd get more Get somebody both Black Beatles got babes belly rollin She think love me I think trollin That girl real crowd pleaser Small world friends know me Young bull livin like old geezer Quick release cash watch fall slowly They lose DJ drops needle Came two girls look like strippers real clothes A yellow bitch green hair real weirdonBlack man yellow Lamb red light go They seen Guwop came side door Theres much money floor buyin school clothes Pint lean pound weed kilo I Eurostep past hater like Im Rondo Like Chapo servin yayo gringos That girl real crowd pleaser Small world friends know me Young bull livin like old geezer Quick release cash watch fall slowly They lose DJ drops needle Shes good teaser blowin reefer DG me I got lot flavor I wear leather Gucci jackets like still 80s Black Beatle bitch Paul McCartney related That girl real crowd pleaser Small world friends know me Young bull livin like old geezer Quick release cash watch fall slowly They lose DJ drops needle,Black Beatles,rap
52,Machine Gun Kelly x Camila Cabello,Am I headnAm I mindnIf knew bad things I likenDont think I explain itnWhat I say complicatednDont matter saynDont matter donI wanna bad things younSo good cant explain itnWhat I say complicated And were wildnAnd nights youngnAnd drugnBreathe til face numb Nails scratchin back tattnEyes closed scream outnAnd keep hipsnWhile teeth sink lipsnWhile bodys giving lifenAnd suffocate kiss I want forevernEven were togethernScars body I take wherevernI want forevernEven were together Scars body I look whenever Am I headnAm I mindnIf knew bad things I likenDont think I explain itnWhat I say complicatednDont matter saynDont matter donI wanna bad things younSo good cant explain itnWhat I say complicated And I love way breathnNumbs like novacainenAnd arenAlways high Keep strange Okay yeah Im insanenBut same Let paint picturenCouch kitchennNothin heels onnLosin religion I want forevernEven were togethernScars body I take wherevernI want forevernEven were togethernScars body I look whenever Am I headnAm I mindnIf knew bad things I likenDont think I explain itnWhat I say complicatednDont matter saynDont matter donI wanna bad things younSo good cant explain itnWhat I say complicated PreChorus Machine Gun Kelly Camila Cabello I want forevernEven were togethernScars body I take wherevernI want forevernEven were togethernScars body I look whenever Am I headnAm I mindnIf knew bad things I likenDont think I explain itnWhat I say complicatednDont matter saynDont matter donI wanna bad things younSo good cant explain itnWhat I say complicated,Bad Things,rap
53,Drake,Ive long look like menThey look menI got fake people showin fake love menStraight face straight facenIve long look like menThey look menI got fake people showin fake love menStraight face straight face Just shit look reachnI reach back like one threenLike one three yeah Thats smile facenWhole time wanna take placenWhole time wanna take placenWhole time wanna take placenYeah I know wanna take placenI tell love fakenI trust word saynHow wanna clique mistakesnLook face same Ive long look like menThey look menI got fake people showin fake love menStraight face straight facenIve long look like menThey look menI got fake people showin fake love menStraight face straight face Thats smile facenWhole time wanna take placenWhole time wanna take placenWhole time wanna take placenYeah I know wanna take placenI tell love fake I tell love fakenI trust word say I trust wordnHow wanna clique mistakesnThats I heardnLook face same Ive long look like menThey look menI got fake people showin fake love menStraight face straight facenIve long look like menThey look menI got fake people showin fake love menStraight face straight face And chune headtopnSo watch speak name know,Fake Love,rap
